headline,date,doc_type,material_type,section,keywords
Pacific Rim Leaders Urge New Focus on Global Trade Talks,2013-10-08,article,News,,"['International Trade and World Market', 'International Relations']"
What Is the Higgs?,2013-10-08,multimedia,Interactive Feature,,"['Higgs Boson', 'Particle Accelerators']"
"‘Still Crazy After All These Years,’ Two Ways",2013-10-08,article,News,,"['Music', 'Baby Boomers']"
"For Nobel, They Can Thank the ‘God Particle’",2013-10-08,article,News,,"['Nobel Prizes', 'Higgs Boson', 'Physics']"
Study Suggests Fact-Checking Influences Political Behavior,2013-10-08,article,News,,['United States Politics and Government']
Close but Not Quite,2013-10-08,article,News,,[]
In Performance: Norbert Leo Butz of ‘Big Fish’,2013-10-08,article,News,,"['Music', 'Theater']"
A Woman to Serve on Twitter’s Board? Here Are 25,2013-10-08,article,News,,"['Boards of Directors', 'Online Advertising', 'Women and Girls']"
A Debutante With Lesbian Moms: How Does She Come Out?,2013-10-08,article,News,,"['Debutantes', 'Homosexuality', 'Baby Boomers', 'Same-Sex Marriage, Civil Unions and Domestic Partnerships', 'Customs, Etiquette and Manners']"
Britain Expands Program to Spur Home Purchases,2013-10-08,article,News,,"['Banking and Financial Institutions', 'European Sovereign Debt Crisis (2010- )', 'Mortgages', 'Real Estate and Housing (Residential)']"
Today in Small Business: The ‘Enormous’ Benefits of Obamacare,2013-10-08,article,News,,"['Entrepreneurship', 'Small Business', 'United States Economy']"
A Worrisome Calm on Wall Street,2013-10-08,article,News,,[]
Take Me to the Bad Old Bronx,2013-10-08,article,News,,['Subways']
Default Deniers,2013-10-08,article,News,,[]
Nest Labs Reinvents the Smoke Alarm,2013-10-08,article,News,,[]
"I.M.F. Cuts Forecasts for Global Expansion, and Warns U.S. on Its Stalemate",2013-10-08,article,News,,"['Economic Conditions and Trends', 'International Trade and World Market', 'United States Economy', 'Federal Budget (US)']"
Karzai Lashes Out at the U.S. for Its Role and Focus in Afghanistan,2013-10-08,article,News,,"['Afghanistan War (2001- )', 'United States International Relations']"
The Midterms: Sam Wang Weighs In,2013-10-08,article,News,,[]
European Lawmakers Reject Tight Restrictions on E-Cigarettes,2013-10-08,article,News,,"['Smoking and Tobacco', 'ADVERTISING AND MARKETING', 'Regulation and Deregulation of Industry']"
De Keersmaeker’s Famous ‘Rosas’ Dance Gets the Fan Treatment,2013-10-08,article,News,,['Dancing']
Inquiry Into Illicit Online Marketplace Extends to Britain,2013-10-08,article,News,,"['Computers and the Internet', 'E-Commerce']"
Concert for the Opposition,2013-10-08,article,News,,['Classical Music']
1931: Leading Paris Couturiers,2013-10-08,article,News,,"['Archives and Records', 'Couture (Fashion)', 'Fashion and Apparel', 'Photography']"
Icahn Secures Seats on Nuance’s Board,2013-10-08,article,News,,"['Boards of Directors', 'Shareholder Rights and Activism']"
City’s Charter Schools Fear Having de Blasio for a Landlord,2013-10-08,article,News,,"['Elections, Mayors', 'Charter Schools', 'Education (K-12)']"
South Korea Says North Restarted Nuclear Reactor,2013-10-08,article,News,,['Nuclear Weapons']
Nuclear Power and the Shutdown,2013-10-08,article,News,,[]
Eric Garcetti Takes the Stage,2013-10-08,multimedia,Video,,"['Mayors', 'Mexican-Americans']"
Genes Suggest European Women at Root of Ashkenazi Family Tree,2013-10-08,article,News,,"['Jews and Judaism', 'Genetics and Heredity', 'DNA (Deoxyribonucleic Acid)']"
"After the I.V.F., the Wait",2013-10-08,article,News,,"['In Vitro Fertilization', 'Infertility', 'Parenting', 'Pregnancy and Childbirth']"
Back-to-Work Day at H.P.,2013-10-08,article,News,,[]
The Journey to Europe,2013-10-08,article,News,,['Refugees and Displaced Persons']
Invitation to a Dialogue: Don’t Teach to the Test,2013-10-08,article,Letter,,"['Tests and Examinations', 'Education (K-12)', 'SAT (College Admission Test)', 'ADMISSIONS STANDARDS', 'Children and Childhood', 'Teachers and School Employees']"
"By Design | At Christie’s, the Legacy of a ’70s Decorator Hits the Auction Block",2013-10-08,article,News,,"['Art', 'Auctions']"
"Dead 22 Years, ‘Baby Hope’ Has a Name Again",2013-10-08,article,News,,"['Murders and Attempted Murders', 'Child Abuse and Neglect']"
The Iditarod Trail by Snowmobile,2013-10-08,article,News,,"['Dog Sledding', 'Iditarod Trail Sled Dog Race (Alaska)', 'Travel and Vacations']"
"After Having Sloppy Start, Smith and the Jets Look Sharper",2013-10-08,article,News,,['Football']
"Debt Ceiling ‘Blackmail,’ Then and Now",2013-10-08,article,News,,"['Extortion and Blackmail', 'National Debt (US)', 'United States Politics and Government']"
"Soundtrack for a Debt Showdown – In the Red, Got No Green and I’m Feeling So Blue",2013-10-08,article,News,,"['Blues Music', 'Country Music', 'Federal Budget (US)', 'Music', 'National Debt (US)']"
A Guide to Affordable Dental Care,2013-10-08,article,News,,"['Elder Care', 'Teeth and Dentistry']"
World Monuments Fund Lists Vista of the New Jersey Palisades as Endangered,2013-10-08,article,News,,[]
Supreme Court Again Weighs Spending Limits in Campaigns,2013-10-08,article,News,,"['Campaign Finance', 'Citizens United v Federal Election Commission (Supreme Court Decision)']"
Recent Deals Show Freer Capitalism Is Taking Hold in Japan,2013-10-08,article,News,,"['Mergers, Acquisitions and Divestitures']"
"School Bus Drivers in Boston Stop Work, Surprising the City ",2013-10-08,article,News,,"['Strikes', 'Buses', 'Education (K-12)']"
"The Gun Report: October 8, 2013",2013-10-08,article,News,,[]
An Indian’s Maiden Visit to Pakistan,2013-10-08,article,News,,[]
Image of the Day: October 8,2013-10-08,article,News,,[]
U.S. Warned by Japanese Over Perils of a Default,2013-10-08,article,News,,"['United States Economy', 'Economic Conditions and Trends', 'National Debt (US)', 'Shutdowns (Institutional)', 'Federal Budget (US)']"
How Google’s Search Changes Affect Small Businesses,2013-10-08,article,News,,"['ADVERTISING AND MARKETING', 'Online Advertising', 'Small Business']"
What Do You Look for in Modern Translation?,2013-10-08,article,News,,"['Books and Literature', 'Translation and Interpreters']"
"Lift ‘Threats,’ Obama Insists, Spurning Talks",2013-10-08,article,News,,"['Federal Budget (US)', 'Shutdowns (Institutional)', 'Patient Protection and Affordable Care Act (2010)', 'National Debt (US)']"
Indian Workers Strike Over Plan to Split State,2013-10-08,article,News,,"['Strikes', 'Electric Light and Power', 'Hunger Strikes']"
U.S. Upholds Ban on Some Samsung Products,2013-10-08,article,News,,"['Smartphones', 'Tablet Computers', 'Inventions and Patents']"
No Offense to Tourists: Taxi ‘Jeopardy!’ Is Easier,2013-10-08,article,News,,"['ADVERTISING AND MARKETING', 'Taxicabs and Taxicab Drivers', 'Television']"
European Officials Consulted Business Leaders on Trade Pact ,2013-10-08,article,News,,['International Trade and World Market']
‘Imperfect Intelligence’ Said to Hinder U.S. Raid on Militant in Somalia,2013-10-08,article,News,,"['Terrorism', 'United States Defense and Military Forces', 'Nairobi, Kenya, Westgate Mall Shootings (2013)']"
"In Store | Sleek, Seductive Italian Furniture Makes Its Way Stateside",2013-10-08,article,News,,['Design']
The Opinion Section Is Expanding,2013-10-08,article,News,,[]
Mementos of James Coburn Up for Auction,2013-10-08,article,News,,['Auctions']
Boehner Calls for Spending Negotiations,2013-10-08,multimedia,Video,,"['Shutdowns (Institutional)', 'United States Politics and Government']"
"A Nuisance Can Be Tasty, Too",2013-10-08,multimedia,Slideshow,,"['Weeds', 'Restaurants', 'Herbs', 'Agriculture and Farming', 'Chefs']"
New Ingredients Sprout From the Cracks,2013-10-08,article,News,,"['Weeds', 'Agriculture and Farming', 'Restaurants', 'Flowers and Plants']"
Turkey Lifts Longtime Ban on Head Scarves in State Offices,2013-10-08,article,News,,['Muslim Veiling']
Waiting for the Market’s Call to Reason,2013-10-08,article,News,,"['Dow Jones Stock Average', 'Emergency Economic Stabilization Act (2008)', 'National Debt (US)', 'United States Economy', 'United States Politics and Government']"
A Transcendence Grounded in Austere Contemplation,2013-10-08,article,Review,,['Dancing']
"Lhota, Speaking to Corporate Leaders, Harshly Criticizes de Blasio",2013-10-08,article,News,,[]
Passing the Time Until He Arrives,2013-10-08,article,Review,,"['Theater', 'Yiddish Language']"
Walking on Sydney’s Wild Side,2013-10-08,article,News,,"['Travel and Vacations', 'Parks and Other Recreation Areas', 'ABORIGINES']"
The Meaning of Mountains,2013-10-08,article,Question,,"['Mountain Climbing', 'Sherpas (Himalayan People)', 'Travel and Vacations']"
Letters to the Editor,2013-10-08,article,Letter,,"['Holocaust and the Nazi Era', 'Jews and Judaism', 'Travel and Vacations']"
They Put Art in the Game,2013-10-08,multimedia,Slideshow,,['Basketball']
Hecklers Greet Hynes Effort to Renew Bid for Re-election,2013-10-08,article,News,,"['Elections, District Attorneys', 'Demonstrations, Protests, and Riots']"
The Non-Paparazzi View of Daniel Radcliffe,2013-10-08,article,News,,['Photography']
Rules of Style | Ferragamo’s New Leading Lady on Flying in Style and Dressing Like a Star,2013-10-08,article,News,,['Fashion and Apparel']
‘Obamacare’ – With or Without Quotation Marks,2013-10-08,article,News,,[]
Key Moments From the Hearing on Campaign Contributions,2013-10-08,multimedia,Interactive Feature,,[]
Obama on Raising the Debt Ceiling,2013-10-08,multimedia,Video,,"['Politics and Government', 'National Debt (US)', 'Shutdowns (Institutional)']"
Butter Tasting,2013-10-08,multimedia,Video,,"['Cooking and Cookbooks', 'Butter']"
The N.F.L.'s Endangered Species,2013-10-08,multimedia,Video,,['Football']
Spreading Culture,2013-10-08,article,News,,"['Butter', 'Cooking and Cookbooks', 'Dairy Products', 'Bakeries and Baked Products', 'Cookies']"
Video Sports of The Times: The N.F.L.’s Endangered Species,2013-10-08,article,News,,[]
Shutdown Denies Death and Burial Benefits to Families of 4 Dead Soldiers,2013-10-08,article,News,,"['United States Defense and Military Forces', 'Federal Budget (US)']"
‘NewsHour’ Ex-Anchors to Cede Ownership,2013-10-08,article,News,,"['News and News Media', 'Television']"
David vs. Goliath,2013-10-08,article,News,,"['Civil War (US) (1861-65)', 'Ships and Shipping', 'Submarines and Submersibles', 'Torpedoes']"
$4 Million Grant to Help Rebrand Lincoln Center Institute,2013-10-08,article,News,,['Grants (Corporate and Foundation)']
Beyond the Rhetoric: Researching and Writing About the Health Care Law,2013-10-08,article,News,,[]
"Mourning Syrian Soldier, but Not Doubting a War",2013-10-08,article,News,,"['Alawite Muslims', 'Middle East and North Africa Unrest (2010- )', 'Funerals and Memorials']"
Second Team of Weapons Experts to Head to Syria,2013-10-08,article,News,,"['Biological and Chemical Warfare', 'Middle East and North Africa Unrest (2010- )']"
The Elm,2013-10-08,multimedia,Slideshow,,['Restaurants']
"Living in Canarsie, Brooklyn",2013-10-08,multimedia,Slideshow,,['Real Estate and Housing (Residential)']
A Fearless Palate for the Drop-In Crowd,2013-10-08,article,Review,,['Restaurants']
"In Canarsie, a Coalition of the Tried-and-True",2013-10-08,article,News,,['Real Estate and Housing (Residential)']
The Shadow of the Sequester,2013-10-08,article,News,,"['Federal Budget (US)', 'Liberalism (US Politics)', 'United States Politics and Government']"
Court Blocks City’s Plan for ‘Taxis of Tomorrow’,2013-10-08,article,News,,['Taxicabs and Taxicab Drivers']
"In Twitter’s I.P.O. Filing, Signs of a Start-Up That Has Matured",2013-10-08,article,News,,['Initial Public Offerings']
"Encouraging the Reviewers, Honestly",2013-10-08,article,News,,['Consumer Reviews']
Villard Michel Richard Opening at the New York Palace,2013-10-08,article,News,,"['Restaurants', 'Chefs']"
Fantasy Football Week 6: Mining for Waiver Wire Gold,2013-10-08,article,News,,"['Football', 'Fantasy Sports']"
"Nazism’s Feminine Side, Brutal and Murderous",2013-10-08,article,Review,,"['Books and Literature', 'Holocaust and the Nazi Era', 'Women and Girls']"
The ioSafe N2 Is a Disaster-Resistant Backup Drive,2013-10-08,article,News,,"['Data Storage', 'Computers and the Internet']"
"Meringue-Based Cakes, Fried Turkey Tails and More",2013-10-08,article,News,,"['Food', 'Bakeries and Baked Products']"
Each One Witchier Than the Next,2013-10-08,article,Review,,"['Television', 'Witchcraft']"
Pentagon Says Shutdown Affects Military Death Benefits,2013-10-08,article,News,,[]
Pictures of the Day: Pakistan and Elsewhere,2013-10-08,article,News,,['Photography']
Hi-Fi Accessories for Your Headphones,2013-10-08,article,News,,['Headphones and Headsets']
An App to Create Your Movie-Star Photo,2013-10-08,article,News,,"['Mobile Applications', 'Photography', 'Software']"
"Filipino Opera, Informed by Oppression",2013-10-08,article,Review,,['Opera']
A Little Monster in Need of a Hug,2013-10-08,article,News,,"['Toys', 'Elmo (Fictional Character)']"
A Showcase for Sustainable Food,2013-10-08,article,News,,"['Agriculture and Farming', 'Chefs', 'Restaurants', 'Travel and Vacations']"
"Disembodied Voices Hold Forth, Uttering the Question on Your Lips",2013-10-08,article,Review,,['Dancing']
Obama on the Supreme Court,2013-10-08,multimedia,Video,,['Politics and Government']
"Face to Face With Time, No Blinking",2013-10-08,article,Review,,['Music']
Wilson Out as Giants’ Woes Continue,2013-10-08,article,News,,['Football']
"Pleasing Deities, and the Eyes, With Storytelling Steps From India",2013-10-08,article,Review,,['Dancing']
"Hotel Review: Topping Rose House in Bridgehampton, N.Y.",2013-10-08,article,News,,"['Travel and Vacations', 'Hotels and Travel Lodgings']"
Restaurant Report: The Blackanese Sushi & Wine Bar in Johannesburg,2013-10-08,article,News,,"['Sushi', 'Restaurants', 'Travel and Vacations']"
Starbucks Aims to Move Beyond Beans,2013-10-08,article,News,,['ADVERTISING AND MARKETING']
The Guarantee That Banks May Fear to Invoke,2013-10-08,article,News,,"['ACCOUNTING AND ACCOUNTANTS', 'Banking and Financial Institutions', 'Foreclosures', 'Mortgages', 'Subprime Mortgage Crisis']"
Learning to Live With the Family Secret,2013-10-08,article,Review,,['Television']
Oil Shocks Ahead? Probably Not,2013-10-08,article,News,,"['Oil (Petroleum) and Gasoline', 'Production', 'Natural Gas', 'Shale', 'International Trade and World Market', 'Drilling and Boring']"
"They, Like, Know the Lines",2013-10-08,article,Review,,"['Theater', 'Television']"
"Surf’s Up, and So Is the Curtain at This Festival",2013-10-08,article,News,,['Theater']
The Me Generation Would Struggle Here,2013-10-08,article,Review,,['Theater']
The Long Shadow of Citizens United,2013-10-08,article,News,,['Citizens United v Federal Election Commission (Supreme Court Decision)']
The Met’s Commissioning Program Is Starting to Bear Operas,2013-10-08,article,News,,['Opera']
New Corporate Tax Shelter: A Merger Abroad,2013-10-08,article,News,,"['Corporate Taxes', 'Mergers, Acquisitions and Divestitures', 'Tax Shelters']"
"Classical Musicians, Too, Make Berlin Their Capital",2013-10-08,article,News,,"['Classical Music', 'Music']"
Obama on China,2013-10-08,multimedia,Video,,['Politics and Government']
The 12 Best Restaurants in New York for Wine,2013-10-08,article,Review,,"['Wines', 'Restaurants']"
Obama on Terrorism,2013-10-08,multimedia,Video,,"['Terrorism', 'United States International Relations']"
Robert Redford in Pictures,2013-10-08,multimedia,Slideshow,,['Movies']
Bessies Are Presented to Dancers in Ceremony at the Apollo,2013-10-08,article,News,,"['Dancing', 'Awards, Decorations and Honors', 'New York Dance and Performance Awards (Bessies)']"
U.S. Military Deaths in Afghanistan,2013-10-08,article,List,,"['United States Defense and Military Forces', 'Afghanistan War (2001- )']"
Moving to the Cadence of an Elizabethan Text,2013-10-08,article,News,,['Dancing']
"Simona de Silvestro, the IndyCar Driver, Says the Future of Racing Is Electric",2013-10-08,article,News,,"['Automobile Racing', 'Automobiles', 'Indianapolis 500 (Auto Race)', 'Nuclear Energy']"
Higgs Boson Particle Theory Wins Nobel,2013-10-08,multimedia,Video,,"['Higgs Boson', 'Nobel Prizes', 'Physics', 'Particle Accelerators']"
These Donors Will Take Anything but Manhattan,2013-10-08,article,News,,"['Art', 'Philanthropy', 'Culture (Arts)']"
European Union Official Calls for More Surveillance of Migrant Routes,2013-10-08,article,News,,"['Maritime Accidents and Safety', 'Immigration and Emigration', 'Illegal Immigration']"
Curtain Call | The Designers of Paris Fashion Week Take Their Bows,2013-10-08,article,News,,"['Fashion and Apparel', 'Paris Fashion Week']"
The Handwriting Is on the Purse,2013-10-08,article,Review,,"['Fashion and Apparel', 'Shopping and Retail', 'Handbags and Purses']"
Boehner ‘Disappointed’ by Obama’s News Conference,2013-10-08,article,News,,"['National Debt (US)', 'United States Politics and Government']"
Paris Fashion Week | Curtain Call,2013-10-08,multimedia,Video,,[]
"Survey Says: Parents Are Happy, but Tired",2013-10-08,article,News,,"['Child Care', 'Children and Childhood', 'Emotions', 'Parenting', 'Polls and Public Opinion', 'Research']"
Airport Noise Linked to Heart Risk,2013-10-08,article,News,,"['Air Pollution', 'AIRPORTS', 'Elderly', 'Heart', 'Medicine and Health', 'Noise']"
"Comfortable in the Contemporary, While Honoring the Venerable",2013-10-08,article,Review,,"['New York Cabaret Convention', 'Music']"
Argentine President Undergoes Surgery for Blood Clot,2013-10-08,article,News,,[]
India Increases Effort to Harness Biomass Energy,2013-10-08,article,News,,"['Bioenergy and Biofuels', 'Agriculture and Farming', 'Alternative and Renewable Energy', 'Waste Materials and Disposal', 'Energy and Power']"
"For Klinsmann, All Roads Lead to Brazil",2013-10-08,article,News,,"['World Cup 2014 (Soccer)', 'Soccer']"
Envoys Near Deal to Free Ex-Premier of Ukraine,2013-10-08,article,News,,[]
"Iran’s Foreign Minister Discusses Twitter, Netanyahu and Kerry on State Television",2013-10-08,article,News,,['Social Media']
Broadway ‘Soul Doctor’ to Close on Sunday,2013-10-08,article,News,,['Theater']
Undercover Detective Is Arrested in Attack on S.U.V.,2013-10-08,article,News,,"['Assaults', 'Police Brutality, Misconduct and Shootings', 'Traffic Accidents and Safety', 'Motorcycles, Motor Bikes and Motorscooters']"
Falling Behind,2013-10-08,multimedia,Interactive Feature,,"['Education', 'Mathematics', 'Labor and Jobs']"
"Obama to Pick Yellen as Leader of Fed, Officials Say",2013-10-08,article,News,,"['United States Economy', 'Appointments and Executive Changes']"
Annotations on a Speech,2013-10-08,multimedia,Interactive Feature,,"['Elections, Mayors', 'Speeches and Statements']"
A History of Fed Appointments,2013-10-08,multimedia,Interactive Feature,,[]
The Economy Under Recent Fed Leaders,2013-10-08,multimedia,Interactive Feature,,['Inflation (Economics)']
Surgery Ends Season for Sanchez,2013-10-08,article,News,,"['Football', 'Sports Injuries']"
Boehner on Negotiations,2013-10-08,multimedia,Video,,"['Shutdowns (Institutional)', 'Politics and Government', 'Federal Budget (US)']"
Modern Updates to Old-School Building Materials,2013-10-08,article,News,,"['Solar Energy', 'Real Estate and Housing (Residential)', 'Building (Construction)', 'Energy Efficiency', 'Sustainable Living']"
"Off Scottish Coast, Harnessing Motion of Ocean Waves",2013-10-08,article,News,,"['Alternative and Renewable Energy', 'Tidal and Wave Power']"
Sports Beginning to See the Energy-Efficient Light,2013-10-08,article,News,,"['Stadiums and Arenas', 'Light-Emitting Diodes', 'Lighting', 'Energy Efficiency']"
"In a Hot, Thirsty Energy Business, Water Is Prized",2013-10-08,article,News,,"['Electric Light and Power', 'Water']"
Nuclear Plants Vexed at Prices That Shift as Demand Does,2013-10-08,article,News,,"['Nuclear Energy', 'Prices (Fares, Fees and Rates)', 'Energy and Power', 'Electric Light and Power', 'Wind Power', 'Coal', 'Natural Gas', 'Regulation and Deregulation of Industry']"
Unplugging Bottlenecks in Oil and Gas Deliveries,2013-10-08,article,News,,"['Pipelines', 'Keystone Pipeline System', 'Infrastructure (Public Works)', 'Natural Gas', 'Oil (Petroleum) and Gasoline']"
"In Return to Vancouver, Schneider Duels Old Team",2013-10-08,article,News,,"['Hockey, Ice', 'Draft and Recruitment (Sports)']"
Yellen’s Path to the Pinnacle,2013-10-08,multimedia,Interactive Feature,,['United States Economy']
Another Unlikely Moment for an Unlikely Star,2013-10-09,article,News,,['Baseball']
"At the Gravestone of ‘Baby Hope,’ Investigators Who Never Let Go",2013-10-09,article,News,,"['Murders and Attempted Murders', 'Missing Persons']"
Pentagon Names Envoy for Guantánamo’s Closing,2013-10-09,article,Brief,,"['Detainees', 'Shutdowns (Institutional)']"
Stubborn Skills Gap in America’s Work Force,2013-10-09,article,News,,"['Labor and Jobs', 'United States Economy', 'Education']"
"Renovated Tenement Awaits the Return of One of Its Carpenters, Jimmy Carter",2013-10-09,article,News,,"['Restoration and Renovation', 'Real Estate and Housing (Residential)']"
Power Grid Is Attacked in Arkansas,2013-10-09,article,News,,"['Electric Light and Power', 'Power Outages and Blackouts']"
Jody L. Kriss,2013-10-09,article,Interview,,"['Real Estate and Housing (Residential)', 'Brownstones']"
U.S. Issues Warning on Salmonella Believed to Be Linked to a Poultry Farm,2013-10-09,article,News,,"['Agriculture and Farming', 'Salmonella (Bacteria)', 'Poultry', 'Food Contamination and Poisoning']"
"My Afro, Myself",2013-10-09,article,Op-Ed,,"['Hair', 'Elections, Mayors']"
Janet Yellen: An Updated Reading List,2013-10-09,article,News,,['Appointments and Executive Changes']
Kansas Legislature Threatens Showdown With Court Over School Financing,2013-10-09,article,News,,"['Education (K-12)', 'State Legislatures', 'Supreme Courts (State)', 'Suits and Litigation (Civil)', 'Conservatism (US Politics)']"
"China: Police Fire on Tibetan Protesters, Report Says",2013-10-09,article,Brief,,"['Demonstrations, Protests, and Riots']"
SAC Is Said to Weigh Plea Deal in Insider Trading Case,2013-10-09,article,News,,"['Fines (Penalties)', 'Hedge Funds', 'Insider Trading']"
Transactions,2013-10-09,article,News,,"['Real Estate (Commercial)', 'Real Estate and Housing (Residential)', 'Renting and Leasing (Real Estate)']"
Uninsured Find More Success via Health Exchanges Run by States,2013-10-09,article,News,,"['Patient Protection and Affordable Care Act (2010)', 'Health Insurance and Managed Care', 'States (US)', 'Medicaid']"
Atlantic 10 Hoping Edginess of Barclays and Brooklyn Will Rub Off on Conference,2013-10-09,article,News,,"['Basketball (College)', 'Draft and Recruitment (Sports)']"
China: Decision in Bo Xilai Appeal Expected Soon,2013-10-09,article,Brief,,['Prisons and Prisoners']
Why Won’t McDonald’s Really Lead?,2013-10-09,article,News,,"['Diet and Nutrition', 'Fast Food Industry']"
Deadlock Worry Jolts the Market for T-Bills,2013-10-09,article,News,,"['National Debt (US)', 'Stocks and Bonds']"
"He’s Over 80, but a Convict Gets No Parole",2013-10-09,article,News,,"['Murders and Attempted Murders', 'Attacks on Police', 'Probation and Parole', 'Prisons and Prisoners', 'Traffic and Parking Violations']"
No Physicist Is an Island,2013-10-09,article,Op-Ed,,"['Physics', 'Science and Technology', 'Higgs Boson', 'Nobel Prizes', 'Large Hadron Collider']"
8 Lawmakers Arrested at Immigration Protest,2013-10-09,article,News,,"['Immigration and Emigration', 'Demonstrations, Protests, and Riots', 'Citizenship and Naturalization']"
Cuomo Denounces Con Ed’s Proposed Rate Increase,2013-10-09,article,News,,['Hurricane Sandy (2012)']
Brazil’s Next Steps,2013-10-09,article,Editorial,,"['Economic Conditions and Trends', 'Income Inequality', 'Editorials']"
Winning Lottery Numbers for Oct. 8,2013-10-09,article,List,,['Lotteries']
Broken Military Justice,2013-10-09,article,Editorial,,"['Sex Crimes', 'Law and Legislation', 'United States Defense and Military Forces', 'Editorials']"
Let’s Build a More Secure Internet,2013-10-09,article,Op-Ed,,"['Open-Source Software', 'Surveillance of Citizens by Government', 'Computers and the Internet', 'Computer Security']"
"Regaining Swagger, Tigers Force a Game 5",2013-10-09,article,News,,['Baseball']
"First End the Crisis, Then Talk",2013-10-09,article,Editorial,,"['United States Politics and Government', 'Federal Budget (US)', 'National Debt (US)', 'Shutdowns (Institutional)', 'Editorials']"
A Study in Scarcity: Women at Central Banks,2013-10-09,article,News,,"['Appointments and Executive Changes', 'Banking and Financial Institutions', 'Women and Girls']"
"Today’s Scuttlebot: The Demise of Lavabit, and an Interview With John McAfee",2013-10-09,article,News,,[]
Drivers’ Defense: Too Drunk to Be Guilty,2013-10-09,article,News,,"['Murders and Attempted Murders', 'Drunken and Reckless Driving', 'Decisions and Verdicts', 'Alcohol Abuse']"
U.S. Fringe Festival,2013-10-09,article,Op-Ed,,"['Tea Party Movement', 'United States Politics and Government', 'Shutdowns (Institutional)', 'Patient Protection and Affordable Care Act (2010)', 'Federal Budget (US)']"
Britain and Iran Move to Repair Diplomatic Relations,2013-10-09,article,News,,"['Diplomatic Service, Embassies and Consulates', 'Nuclear Weapons', 'Embargoes and Economic Sanctions']"
"Call an Audible, Dan",2013-10-09,article,Op-Ed,,"['Native Americans', 'Names, Organizational', 'Discrimination', 'Football']"
City Council to Decide Fate of Mecca for Graffiti Artists,2013-10-09,article,News,,"['Graffiti', 'Real Estate and Housing (Residential)', 'City Councils', 'Area Planning and Renewal', 'Affordable Housing']"
Cardinals Know How to Raise Young Arms ,2013-10-09,article,News,,['Baseball']
