headline,date,doc_type,material_type,section,keywords
"From England, Fashion’s Latest Darling",2013-01-10,article,News,,"['Fashion and Apparel', 'Music']"
Things I Saw — No. 52,2013-01-10,article,News,,['Art']
"Quotation of the Day for Thursday, Jan. 10, 2013",2013-01-10,article,Quote,,[]
"At Once Catholic and Secular, France Debates Gay Marriage",2013-01-10,article,News,,"['Same-Sex Marriage, Civil Unions and Domestic Partnerships', 'ADOPTIONS']"
Teenage Bedrooms: The Forbidden Frontier,2013-01-10,multimedia,Video,,"['Teenagers and Adolescence', 'Interior Design and Furnishings', 'Computers and the Internet']"
New York Is Moving Quickly to Enact Tough Curbs on Guns,2013-01-10,article,News,,"['Gun Control', 'Law and Legislation', 'Newtown, Conn, Shooting (2012)', 'State of the State Message (NYS)']"
Something to Fill In,2013-01-10,article,News,,['Crossword Puzzles']
"Editors’ Note: January 10, 2013",2013-01-10,article,Correction,,[]
Lawmaking Maverick Resumes Course in Nebraska,2013-01-10,article,News,,"['State Legislatures', 'Term Limits (Political Office)', 'Law and Legislation']"
Hall Vote Puts a Damper on Cooperstown’s Party,2013-01-10,article,News,,"['Baseball', 'Doping (Sports)']"
Trial Begins in Death of 2-Month-Old Girl,2013-01-10,article,News,,"['Shaken Baby Syndrome', 'Murders and Attempted Murders']"
Woman Is Shot in Brooklyn,2013-01-10,article,News,,"['Crime and Criminals', 'Murders and Attempted Murders']"
Cuomo Calls for State to Return to Progressive Ideals,2013-01-10,article,News,,"['State of the State Message (NYS)', 'Global Warming', 'Gun Control', 'Minimum Wage']"
"Lewis Follows in Fancy Footsteps, but Few Can Follow in His",2013-01-10,article,News,,"['Dancing', 'Football']"
"Atop New York Senate, an Odd Couple With Some Issues",2013-01-10,article,News,,['State Legislatures']
Who Is Jack Lew?,2013-01-10,article,News,,['United States Politics and Government']
Police Say Suspect Planned to Blow Up Washington Arch,2013-01-10,article,News,,"['Bombs and Explosives', 'Terrorism']"
"Ailing on Court and Off, Lakers Lose Fifth Straight",2013-01-10,article,News,,['Basketball']
"In Harlem, a Nightspot So Iconic They’ll Reopen It. Twice.",2013-01-10,article,News,,['Bars and Nightclubs']
Lottery Numbers,2013-01-10,article,List,,['Lotteries']
Isner Withdraws From Australian Open,2013-01-10,article,News,,[]
Obama to Use King and Lincoln Bibles for Inaugural,2013-01-10,article,News,,['Inaugurations']
U.S. Consumer Watchdog to Issue Mortgage Rules,2013-01-10,article,News,,"['Mortgages', 'Banking and Financial Institutions', 'Consumer Protection', 'Personal Finances', 'Dodd-Frank Wall Street Reform and Consumer Protection Act (2010)', 'Real Estate and Housing (Residential)']"
Word of the Day | effigy,2013-01-10,article,News,,[]
"Rescuing China’s Bears From Bile Farms, One by One",2013-01-10,article,News,,"['ANIMALS', 'Bears', 'Cruelty to Animals']"
Philanthropist Abandons Plan for Velodrome in Brooklyn Park,2013-01-10,article,News,,"['Bicycles and Bicycling', 'Philanthropy', 'Stadiums and Arenas', 'Area Planning and Renewal']"
What’s on Thursday,2013-01-10,article,Schedule,,[]
"News Quiz | January 10, 2013",2013-01-10,article,News,,[]
IHT Quick Read: Jan. 10,2013-01-10,article,News,,[]
"In India’s Ancient Khajuraho, Eroticism Mingles With International Commerce",2013-01-10,article,News,,[]
"3 Kurds Are Killed in Paris, in Locked-Door Mystery",2013-01-10,article,News,,"['Kurds', 'Murders and Attempted Murders']"
"Test Yourself | English, Jan. 10, 2013",2013-01-10,article,News,,[]
2012 Was the Hottest Year on Record,2013-01-10,article,News,,[]
Echoes of Prayer and People,2013-01-10,article,News,,"['Cameras', 'Photography', 'Pilgrimages', 'Prayers and Prayer Books', 'Religion and Belief']"
Betrayed by Basel,2013-01-10,article,News,,['Regulation and Deregulation of Industry']
Do Adults Who Are ‘Only Trying to Help’ Sometimes Make Things Worse?,2013-01-10,article,News,,[]
Private Equity in China: Which Way Out?,2013-01-10,article,News,,"['Initial Public Offerings', 'Private Equity']"
Ask a Financial Aid Expert About the Fafsa,2013-01-10,article,News,,"['Colleges and Universities', 'Financial Aid (Education)', 'Scholarships and Fellowships']"
Help for Planning End-of-Life Care,2013-01-10,article,News,,"['Elder Care', 'Living Wills and Health Care Proxies']"
Jets Widen Search for General Manager,2013-01-10,article,News,,['Football']
Visit by Google Chairman May Benefit North Korea,2013-01-10,article,News,,['United States International Relations']
What to See on the London Stage in 2013,2013-01-10,article,News,,[]
Where Is the Indian Economy Headed?,2013-01-10,article,News,,"['Credit Ratings and Credit Rating Agencies', 'Economic Conditions and Trends', 'Forecasts', 'Gross Domestic Product']"
Q&A: How to Reinstall the Google Chrome Browser,2013-01-10,article,News,,['Chrome (Browser)']
Pound for Pound,2013-01-10,article,News,,"['Economic Conditions and Trends', 'Taxation']"
"Two Very Different Stories of Murder, Faith and Forgiveness",2013-01-10,article,News,,['Murders and Attempted Murders']
Divisional Round Probabilities: Atlanta-Seattle Coin Toss Game,2013-01-10,article,News,,"['Football', 'Playoff Games']"
Selling a Business? It’s the Details That Count,2013-01-10,article,News,,"['Hiring and Promotion', 'Mergers, Acquisitions and Divestitures', 'Small Business']"
"With Laos Disappearance, Signs of a Liberalization in Backslide",2013-01-10,article,News,,"['Civil Rights and Liberties', 'Missing Persons']"
"The Delhi Gang Rape Accused: Vinay Sharma, a ‘Quiet and Simple’ Boy",2013-01-10,article,News,,"['Sex Crimes', 'Women and Girls']"
"Returns at Hedge Funds Run by Women Beat the Industry, Report Says",2013-01-10,article,News,,"['Hedge Funds', 'Women and Girls']"
‘Lincoln’ Leads Oscar Field With 12 Nominations,2013-01-10,article,News,,"['Academy Awards (Oscars)', 'Movies']"
"At Last, the Straw Bale House Is a … Home",2013-01-10,article,News,,"['Clay', 'Internships', 'Sand and Gravel']"
The Last Man Asian Literary Prize,2013-01-10,article,News,,"['Books and Literature', 'Man Booker Prize', 'Writing and Writers']"
European Central Bank Leaves Key Rate Unchanged,2013-01-10,article,News,,"['Euro (Currency)', 'Interest Rates', 'European Sovereign Debt Crisis (2010- )']"
Quasi Inauguration for Chávez in Venezuela,2013-01-10,article,Op-Ed,,['Appointments and Executive Changes']
In His Comfort Zone,2013-01-10,article,News,,"['Theater', 'Movies', 'ACTORS AND ACTRESSES']"
"The Breakfast Meeting: A Late-Night Ratings Race, and a Controversial Puppeteer Resigns",2013-01-10,article,News,,"['ADVERTISING AND MARKETING', 'Boycotts', 'Puerto Ricans', 'Puppets', 'Tea', 'Television']"
"The 2012 Patent Rankings: IBM on Top (Again), Google and Apple Surging",2013-01-10,article,News,,['Inventions and Patents']
App Smart Extra: More Options for Divers,2013-01-10,article,News,,['Mobile Applications']
Reversing Greece’s free fall,2013-01-10,article,Op-Ed,,['European Sovereign Debt Crisis (2010- )']
Lindsay Lohan in 'The Canyons',2013-01-10,multimedia,Video,,[]
Opinion Report: The Hastert Rule,2013-01-10,article,News,,[]
Here Is What Happens When You Cast Lindsay Lohan in Your Movie,2013-01-10,article,News,,['Movies']
Battle Lines Drawn Over Herbalife,2013-01-10,article,News,,[]
Gambling on a Crowded Subway Platform,2013-01-10,article,News,,"['Commuting', 'Lotteries', 'Smartphones', 'Subways']"
Theories Link Paris Murders to Kurdish Peace Moves,2013-01-10,article,News,,['Kurds']
Herbalife Responds to Accusations From Hedge Fund,2013-01-10,article,News,,['Hedge Funds']
The Early Word: Fight Prep,2013-01-10,article,News,,[]
Vain Glorious | Laura Mercier’s Caviar Stick Eye Color,2013-01-10,article,News,,['Beauty']
"In the Spirit of Ada Louise Huxtable, a Times Critic Reinvents His Role",2013-01-10,article,News,,[]
‘Lincoln’ Leads Academy Award Nominations,2013-01-10,article,News,,"['Academy Awards (Oscars)', 'Movies']"
Cerberus to Buy Albertsons Grocery Chain From Supervalu,2013-01-10,article,News,,[]
What We’re Reading,2013-01-10,article,News,,[]
Director Snubs Point to a Threeway Race: ‘Lincoln’ vs. ‘Playbook’ and ‘Pi’,2013-01-10,article,News,,['Academy Awards (Oscars)']
Edward St. Aubyn: By the Book,2013-01-10,article,Question,,"['Books and Literature', 'Writing and Writers']"
What Chris Christie Didn’t Say,2013-01-10,article,News,,"['Gun Control', 'Newtown, Conn, Shooting (2012)']"
Drug Agency Recommends Lower Doses of Sleep Aids for Women,2013-01-10,article,News,,"['Drugs (Pharmaceuticals)', 'Ambien (Drug)', 'Insomnia', 'Women and Girls']"
Seau Suffered From Brain Disease,2013-01-10,article,News,,"['Chronic Traumatic Encephalopathy', 'Football', 'Suicides and Suicide Attempts', 'Concussions', 'Research', 'Brain']"
I Don’t Want My Preschooler to Be a ‘Gentleman’,2013-01-10,article,News,,"['Children and Childhood', 'Customs, Etiquette and Manners', 'Discrimination', 'Education (Pre-School)', 'Parenting', 'Title IX (Gender Discrimination Legislation)', 'Women and Girls']"
Poetry Pairing | ‘Bleak Weather’,2013-01-10,article,News,,[]
Photos of The Moment | E. Tautz,2013-01-10,article,News,,"['Fashion and Apparel', 'London Fashion Week', 'Photography']"
"A Statement on Steroids, but What Does It Say?",2013-01-10,article,News,,"['Steroids', 'Baseball']"
Daily Report: Google Chief Urges North Korea to Embrace Web,2013-01-10,article,News,,['Computers and the Internet']
"Celeste Bartos, New York Philanthropist, Dies at 99",2013-01-10,article,Obituary (Obit),,"['Philanthropy', 'Deaths (Obituaries)']"
Every ’Wich Way,2013-01-10,article,News,,"['Cooking and Cookbooks', 'Sandwiches']"
"Sally Field, on Texting With Abraham Lincoln",2013-01-10,article,News,,"['Academy Awards (Oscars)', 'Movies']"
British Panel Castigates Ex-UBS Officials at Hearing,2013-01-10,article,News,,"['Libor (London Interbank Offered Rate)', 'Regulation and Deregulation of Industry']"
Worrying About Electronic Benefits Deadline? Don’t,2013-01-10,article,News,,"['Debit Cards', 'Social Security (US)']"
France Considers a Gay Marriage Bill as Marriage Itself Is in Decline,2013-01-10,article,News,,"['Children and Childhood', 'Homosexuality', 'Marriages', 'Same-Sex Marriage, Civil Unions and Domestic Partnerships']"
California Suggests Mobile App Privacy Guidelines,2013-01-10,article,News,,"['Mobile Applications', 'Online Advertising', 'Privacy']"
From Homeless Teen to Oscar-Nominated Film Subject,2013-01-10,article,News,,"['Academy Awards (Oscars)', 'Movies']"
Syria Denounces U.N. Envoy as ‘Biased’ ,2013-01-10,article,News,,"['Middle East and North Africa Unrest (2010- )', 'Helicopters', 'Defense and Military Forces', 'Military Vehicles']"
The Choice Blogger Graduates,2013-01-10,article,News,,"['ADMISSIONS STANDARDS', 'Blogs and Blogging (Internet)', 'Colleges and Universities']"
No Words Says It All,2013-01-10,article,News,,"['Baseball', 'Newspapers']"
Chávez Illness Delays Inauguration,2013-01-10,multimedia,Video,,[]
A Bit of Relief on Food Prices,2013-01-10,article,News,,"['Agriculture and Farming', 'Drought', 'Food', 'Prices (Fares, Fees and Rates)']"
Hagel’s Confirmation Proceedings Will Be Short on Old Senate Allies,2013-01-10,article,News,,"['United States Defense and Military Forces', 'United States Politics and Government']"
The Geopolitics of Soap Operas,2013-01-10,article,News,,"['Muslims and Islam', 'Soap Operas', 'Television']"
Thursday Reading: Flu Is Widespread This Year,2013-01-10,article,News,,[]
Minister Backs Out of Speech at Inaugural,2013-01-10,article,News,,"['Homosexuality', 'Inaugurations']"
Finding Hope After Miscarriage,2013-01-10,article,News,,"['Infertility', 'Miscarriages', 'Pregnancy and Childbirth']"
Honda to Assemble 2014 Accord Hybrid in Ohio,2013-01-10,article,News,,"['Automobiles', 'Electric and Hybrid Vehicles']"
2013 Academy Awards — The Nominees,2013-01-10,multimedia,Slideshow,,"['Academy Awards (Oscars)', 'Movies']"
With Apologies to John Hawkes and Marion Cotillard,2013-01-10,article,News,,['Academy Awards (Oscars)']
Sifting Out Sandy,2013-01-10,multimedia,Video,,['Beaches']
"Columbus Circle Subway Station, 10:48 A.M.",2013-01-10,article,News,,[]
Forced Entry,2013-01-10,article,News,,['Real Estate and Housing (Residential)']
A Great Year in Film,2013-01-10,multimedia,Video,,['Movies']
Ben Horowitz on the Impact of Software Everywhere,2013-01-10,article,News,,"['Labor and Jobs', 'Software', 'Venture Capital']"
Look of The Moment | Taylor Swift,2013-01-10,article,News,,[]
Lawyer Says Indian Gang Rape Suspect Was Tortured by Police,2013-01-10,article,News,,"['Sex Crimes', 'Murders and Attempted Murders']"
A Boy's Silence Is Broken,2013-01-10,multimedia,Video,,"['Ears and Hearing', 'Hearing Aids', 'Disabilities', 'Education']"
Simon Rattle to Leave Berlin Philharmonic in 2018,2013-01-10,article,News,,['Classical Music']
F.C.C. Says Failure of 911 in Storm Was Preventable,2013-01-10,article,News,,"['Emergency Telephone Numbers', 'Disasters and Emergencies', 'Regulation and Deregulation of Industry', 'Telephones and Telecommunications', 'Mid-Atlantic States (US)']"
The Spectacular Rise and Fall of Fitz John Porter,2013-01-10,article,News,,"['Civil War (US) (1861-65)', 'United States Defense and Military Forces']"
Swearing In Postponed for Ill Chávez,2013-01-10,multimedia,Video,,['Inaugurations']
A Loss in the Family,2013-01-10,article,News,,['Crossword Puzzles']
London Men’s Fashion Week Fall 2013 Accessories,2013-01-10,multimedia,Slideshow,,['Fashion and Apparel']
Ang Lee on the Digital Characters Who Can’t Argue Back,2013-01-10,article,News,,['Academy Awards (Oscars)']
Baseball Writers Select No One for Hall,2013-01-10,multimedia,Video,,[]
Tough Path Seen by Obama on Ban of Assault Weapons,2013-01-10,article,News,,"['Gun Control', 'Law and Legislation', 'Newtown, Conn, Shooting (2012)']"
Justin Timberlake Signals That He’s ‘Ready.’ Just Not Yet.,2013-01-10,article,News,,['Social Networking (Internet)']
"Amy Adams, Scared by Her Own Character",2013-01-10,article,News,,['Academy Awards (Oscars)']
Image of the Day: Jan. 10,2013-01-10,article,News,,[]
"With ‘Daisy,’ Beats Electronics Bets on Digital Music",2013-01-10,article,News,,['Music']
Toronto Shows Faith in Nelsen,2013-01-10,article,News,,['Soccer']
Nokia Has Some Good News After Two Years of Gloom,2013-01-10,article,News,,"['Company Reports', 'Smartphones']"
"A Persistent Foreign Predator, Dangerous but Delicious",2013-01-10,article,News,,"['Endangered and Extinct Species', 'Invasive Species']"
Baseball to Expand Drug-Testing Program,2013-01-10,article,News,,"['Tests (Drug Use)', 'Steroids', 'Baseball', 'Human Growth Hormone', 'Testosterone', 'Doping (Sports)']"
When the Doctor Returns to Doctoring,2013-01-10,article,News,,"['Careers and Professions', 'Doctors']"
The Extent of the Fires,2013-01-10,multimedia,Interactive Feature,,"['Forest and Brush Fires', 'Fires and Firefighters']"
The People’s Love for Chávez Continues,2013-01-10,multimedia,Video,,[]
Theater Talkback:  Familiar Faces in Two Dimensions,2013-01-10,article,News,,"['ACTORS AND ACTRESSES', 'Movies', 'Theater']"
Obama’s Chief of Staff Pick Is Said to Be Down to 2,2013-01-10,article,News,,"['United States Politics and Government', 'Appointments and Executive Changes']"
"For Anne Hathaway and Hugh Jackman, a Bittersweet Day",2013-01-10,article,News,,"['Academy Awards (Oscars)', 'Movies']"
How Are You Warding Off the Flu?,2013-01-10,article,News,,['Influenza']
Britney Spears Said to Be Leaving ‘The X Factor’,2013-01-10,article,News,,[]
What’s at the Center of the Debate Over Herbalife,2013-01-10,article,News,,['Ponzi and Pyramid Schemes']
"Before Rebuilding Beaches, Plucking Debris From Storm-Tossed Sand",2013-01-10,article,News,,"['Hurricane Sandy (2012)', 'Sand and Gravel', 'Beaches']"
Strike on Broadway,2013-01-10,multimedia,Interactive Feature,,"['Theater', 'Strikes']"
London Top 5,2013-01-10,article,News,,"['Fashion and Apparel', 'London Fashion Week']"
Undocumented Reformers,2013-01-10,multimedia,Video,,"['Immigration Detention', 'Citizenship and Naturalization']"
Candidates in a Box,2013-01-10,multimedia,Interactive Feature,,"['Presidential Election of 2008', 'Politics and Government']"
State of the Union,2013-01-10,multimedia,Interactive Feature,,[]
Clouds Seen in Regulators’ Crystal Ball for Banks,2013-01-10,article,News,,"['Banking and Financial Institutions', 'Regulation and Deregulation of Industry', 'Dodd-Frank Wall Street Reform and Consumer Protection Act (2010)']"
How the Pentagon Spread Its Message,2013-01-10,multimedia,Interactive Feature,,"['News and News Media', 'UNITED STATES ARMAMENT AND DEFENSE', 'Television', 'PUBLIC OPINION', 'United States Politics and Government']"
Fed Profit of $88.9 Billion Sent to Treasury in 2012 ,2013-01-10,article,News,,"['Banking and Financial Institutions', 'Interest Rates']"
Judge Blocks Restaurant Plan for Union Square Park,2013-01-10,article,News,,"['Decisions and Verdicts', 'Parks and Other Recreation Areas', 'Restaurants']"
"Despite Recent Losses, India Has an Edge in Upcoming Cricket Series",2013-01-10,article,News,,['Cricket (Game)']
Cyberstalkers Threaten Pipeline Security,2013-01-10,article,News,,"['Computer Security', 'Computers and the Internet', 'Cyberwarfare', 'Executive Orders', 'Infrastructure (Public Works)', 'Law and Legislation', 'Pipelines', 'Regulation and Deregulation of Industry', 'Security and Warning Systems', 'United States Politics and Government']"
Did Zeitlin Take Bigelow’s Spot?,2013-01-10,article,News,,"['Academy Awards (Oscars)', 'Movies']"
Carbon Emissions Across the United States,2013-01-10,multimedia,Interactive Feature,,"['Carbon Dioxide', 'Global Warming', 'Energy and Power']"
Excerpt: 'The Other Place',2013-01-10,multimedia,Video,,['Theater']
Downturn Still Squeezes Colleges and Universities ,2013-01-10,article,News,,"['Colleges and Universities', 'Tuition', 'Endowments']"
New School Show Tunes,2013-01-10,multimedia,Interactive Feature,,"['Theater', 'Music']"
From Sketch to Stage: Dressing Dickens,2013-01-10,multimedia,Interactive Feature,,['Theater']
Milestones: W. Mark Felt,2013-01-10,multimedia,Interactive Feature,,['Pentagon Papers']
New Mortgage Rules Left Out Down Payments,2013-01-10,article,News,,"['Consumer Protection', 'Mortgages', 'Real Estate and Housing (Residential)', 'Regulation and Deregulation of Industry']"
A ‘Genre Boy’ Returns to Television,2013-01-10,multimedia,Interactive Feature,,['Television']
"On Second Night in New Slot, a Ratings Slide for Kimmel",2013-01-10,article,News,,['Television']
David O. Russell’s Pre-Emptive Thank-You,2013-01-10,article,News,,"['Academy Awards (Oscars)', 'Movies']"
Scene City: ‘Girls’ Premieres Second Season,2013-01-10,multimedia,Slideshow,,"['Parties (Social)', 'Television']"
The Sell: ‘Reasons to Be Pretty’,2013-01-10,multimedia,Interactive Feature,,"['Theater', 'ADVERTISING AND MARKETING']"
"Plenty of Guts, Little Glory",2013-01-10,multimedia,Interactive Feature,,['Television']
A Closer Look at Immigration Reform,2013-01-10,multimedia,Video,,"['Immigration and Emigration', 'United States Politics and Government']"
What Is a Guy?,2013-01-10,multimedia,Interactive Feature,,['Theater']
Protesters From Afar,2013-01-10,multimedia,Video,,"['Russian-Americans', 'Immigration and Emigration', 'Politics and Government', 'Demonstrations, Protests, and Riots', 'Russian Orthodox Church']"
Where Are They Now?,2013-01-10,multimedia,Interactive Feature,,[]
Terrorists No Match for Single City Cop,2013-01-10,article,Review,,['Books and Literature']
The End Is Near!,2013-01-10,multimedia,Interactive Feature,,['Television']
There Was Even a Snub in the Foreign Language Category,2013-01-10,article,News,,['Academy Awards (Oscars)']
The Motor City Though the Camera Lens,2013-01-10,article,News,,"['Art', 'Automobiles', 'Museums', 'North American International Auto Show', 'Photography']"
A Day of ‘Conquests’,2013-01-10,multimedia,Interactive Feature,,['Theater']
Clothes Make the Show,2013-01-10,multimedia,Interactive Feature,,"['Television', 'Fashion and Apparel']"
A History of Hall of Fame Shutouts,2013-01-10,article,News,,['Baseball']
In Performance: TV’s Best,2013-01-10,multimedia,Interactive Feature,,['Television']
"Pacific Tuna Stocks Have Plummeted, Scientists Warn",2013-01-10,article,News,,"['Auctions', 'Fish Farming', 'Fishing, Commercial', 'Tuna']"
Untangling ‘Top Girls’,2013-01-10,multimedia,Interactive Feature,,['Theater']
Emmanuelle Riva’s Very Good Morning,2013-01-10,article,News,,['Academy Awards (Oscars)']
Competing Stimulus Bills,2013-01-10,multimedia,Interactive Feature,,['Obama Stimulus Plan']
More On a Quest for Common Ground on Climate Change,2013-01-10,article,News,,"['Air Pollution', 'Carbon Dioxide', 'Conservatism (US Politics)', 'Energy Efficiency', 'Global Warming', 'Greenhouse Gas Emissions', 'Liberalism (US Politics)', 'Video Recordings and Downloads']"
"And in This Corner, the Boys of ‘Girls’",2013-01-10,article,Question,,"['ACTORS AND ACTRESSES', 'Television']"
A ‘New Normal’ Star Thrives in the TV Ensemble,2013-01-10,article,Question,,['Television']
The Edges Are Still Sharp in Brooklyn,2013-01-10,article,News,,['Television']
Points for Every (Bumpy) Lap,2013-01-10,article,News,,"['Roller Derby', 'Roller Skating']"
Cuomo’s State of the State Address,2013-01-10,multimedia,Video,,['Politics and Government']
Creative Use of White Space in Sports … Discuss,2013-01-10,article,News,,[]
Art House | Wendell Castle,2013-01-10,article,News,,['Art']
‘Flight’s’ Screenwriter Is Just Thrilled His Name Was Pronounced Right,2013-01-10,article,News,,"['Academy Awards (Oscars)', 'Movies']"
"To Counter China, Japan and Philippines Will Bolster Maritime Cooperation",2013-01-10,article,News,,['Defense and Military Forces']
Thinking About the Brink,2013-01-10,article,News,,[]
Visions and Voices of a Nation Divided,2013-01-10,article,Review,,"['Civil War (US) (1861-65)', 'Art']"
Student Shot at California High School,2013-01-10,article,News,,"['School Shootings', 'Murders and Attempted Murders']"
Microsoft’s Surface Pro Tablet Changes the Game,2013-01-10,article,News,,"['Computer Keyboards', 'iPad', 'Laptop Computers', 'Tablet Computers']"
The 12.30.12 Issue,2013-01-10,article,Letter,,[]
A Storm Victim’s Luck Changes,2013-01-10,article,News,,['Hurricane Sandy (2012)']
Video: Russian Protesters in New York City,2013-01-10,article,News,,"['Demonstrations, Protests and Riots']"
Zizi Limona,2013-01-10,multimedia,Slideshow,,['Restaurants']
A Cruise Across the Mediterranean,2013-01-10,article,Review,,['Restaurants']
Why an I.P.O. Revival May Have to Wait,2013-01-10,article,News,,"['Banking and Financial Institutions', 'Government Bonds', 'Initial Public Offerings', 'Junk Bonds', 'Stocks and Bonds']"
TimesCast Politics: A Closer Look at Immigration Reform,2013-01-10,article,News,,"['Immigration and Emigration', 'United States Politics and Government']"
New York Legislators Debate Details of Gun Law,2013-01-10,article,News,,"['Gun Control', 'State Legislatures']"
The Boys of ‘Girls’,2013-01-10,multimedia,Slideshow,,['Television']
The Mostly Solved Deficit Problem,2013-01-10,article,News,,[]
Carter Family Songs in Red Hook,2013-01-10,article,News,,['Music']
Judge Postpones Sentencing for Wells Fargo Broker,2013-01-10,article,News,,"['Frauds and Swindling', 'Sentences (Criminal)']"
Blasts in Pakistan Kill Scores and Stir Fears on Elections,2013-01-10,article,News,,"['Bombs and Explosives', 'Elections', 'Hazaras (Ethnic Group)']"
Launching a Fragrance Line (In a Manner of Speaking) ,2013-01-10,article,News,,"['ADVERTISING AND MARKETING', 'Space', 'Perfumes and Fragrances']"
A God in Pursuit of a Redemption,2013-01-10,article,Review,,"['Theater', 'Under the Radar Festival']"
Friends Without Benefits,2013-01-10,article,News,,"['Love (Emotion)', 'Friendship', 'Modern Love (Times Column)']"
Herbalife Shares Fall After Company Defends Itself,2013-01-10,article,News,,"['Company Reports', 'Ponzi and Pyramid Schemes']"
Jacki Weaver and the Lord of Greenwich Village,2013-01-10,article,News,,"['Academy Awards (Oscars)', 'Movies']"
"A Debate, to and Fro",2013-01-10,article,Question,,"['Jews and Judaism', 'Parties (Social)', 'Customs, Etiquette and Manners']"
An Old Magician’s Ploy Adds a Bit of Flair to a Show That’s Not Exactly About Race,2013-01-10,article,Review,,"['Race and Ethnicity', 'Theater', 'Blacks', 'Black People', 'Comedy and Humor']"
Drilling Down: Andrew Sullivan Decides to Start His Own Business,2013-01-10,article,News,,['Small Business']
"In Cyprus Bailout, Questions of Whether Depositors Should Shoulder the Bill",2013-01-10,article,News,,"['European Sovereign Debt Crisis (2010- )', 'Economic Conditions and Trends', 'Banking and Financial Institutions', 'Government Bonds', 'Politics and Government']"
Sharp Words From European Minister for Countries in North,2013-01-10,article,News,,"['Appointments and Executive Changes', 'European Sovereign Debt Crisis (2010- )', 'Economic Conditions and Trends']"
Ask Well: Exercises for Tennis Elbow,2013-01-10,article,News,,"['Medicine and Health', 'Tendinitis', 'Tennis']"
"In Saudi Town, Women Protest Detentions, Leading to Their Own",2013-01-10,article,News,,"['Demonstrations, Protests, and Riots', 'Detainees', 'Human Rights and Human Rights Violations', 'Middle East and North Africa Unrest (2010- )', 'Women and Girls']"
"Citadel Posted 25% Return Last Year, Beating Industry Again",2013-01-10,article,News,,"['Company Reports', 'Hedge Funds']"
A Wide-Awake Bradley Cooper; a Sleepy Jennifer Lawrence,2013-01-10,article,News,,"['Academy Awards (Oscars)', 'Movies']"
Turn Off That TV and Go Outside and Play,2013-01-10,article,News,,"['Parenting', 'Parks and Other Recreation Areas', 'Playgrounds', 'Research']"
Q&A: Dealing With Duplicate Work on Dropbox,2013-01-10,article,News,,['Data Storage']
