headline,date,doc_type,material_type,section,keywords
Highlights and Analysis: Red Sox Take Game 1 From Bumbling Cardinals,2013-10-23,article,News,,"['Baseball', 'World Series']"
Feeding Fliers With Local Fare,2013-10-23,article,News,,"['AIRPORTS', 'Restaurants', 'Travel and Vacations']"
"Food Matters | For L.A.’s Thoughtful Young Eaters, a New Breed of Catering Company",2013-10-23,article,News,,[]
T-Mobile US Tries to Lure Tablet Customers With Some Free Data,2013-10-23,article,News,,"['Cellular Telephones', 'iPad', 'Tablet Computers']"
Looking for a Bus or Train? New Sites Aim to Help,2013-10-23,article,News,,"['Buses', 'Computers and the Internet', 'Travel and Vacations', 'Railroads']"
Hotel Review: Copacabana Palace in Rio de Janeiro,2013-10-23,article,News,,['Travel and Vacations']
After ‘There’s a Kid With a Gun’ Came ‘Teacher Down’,2013-10-23,article,News,,"['Afghanistan War (2001- )', 'Military Bases and Installations', 'Murders and Attempted Murders', 'School Shootings']"
Longing for the ‘Wow’ at Apple’s Product Showcases,2013-10-23,article,News,,['iPad']
‘The Simpsons’: Springfield to Brazil,2013-10-23,article,News,,"['World Cup 2014 (Soccer)', 'Television', 'Soccer']"
Glaxo Sales Fall in China as Inquiry Continues,2013-10-23,article,News,,"['Company Reports', 'Drugs (Pharmaceuticals)', 'Bribery and Kickbacks']"
Wheelies: The Here’s Looking at You Kid Edition,2013-10-23,article,News,,"['Automobiles', 'Electric and Hybrid Vehicles', 'Tea Party Movement', 'Auctions']"
Alan S. Blinder on Janet Yellen,2013-10-23,multimedia,Video,,[]
Russia Reduces Charges in Greenpeace Case ,2013-10-23,article,News,,"['Demonstrations, Protests, and Riots', 'Piracy at Sea', 'Ships and Shipping', 'Oil (Petroleum) and Gasoline', 'Offshore Drilling and Exploration']"
New York Public Library Postpones Release of Revised Renovation Plan,2013-10-23,article,News,,['Libraries and Librarians']
Boston and St. Louis Orchestra Musicians Play Up the World Series,2013-10-23,article,News,,"['Classical Music', 'World Series']"
8 Questions for 3 Buffetts,2013-10-23,article,News,,"['Agriculture and Farming', 'Philanthropy', 'Stocks and Bonds', 'Tax Credits, Deductions and Exemptions']"
An Afghan Interpreter Seeks a Visa That Is Unlikely to Come,2013-10-23,article,News,,[]
Theater Will Ignore NC-17 Rating for ‘Blue Is the Warmest Color’,2013-10-23,article,News,,"['Movies', 'Ratings (Parental Guidance)']"
Tea Party Group Begins Anti-Health Care Law Blitz in Four House Districts,2013-10-23,article,News,,['Patient Protection and Affordable Care Act (2010)']
Lobbying Heats Up Before Farm Talks,2013-10-23,article,News,,"['Farm Bill (US)', 'Lobbying and Lobbyists']"
"Among the Ruins, Education Is Also Lost",2013-10-23,multimedia,Slideshow,,"['Education and Schools', 'Earthquakes']"
No Comment Necessary: Fight Nukes With Nukes,2013-10-23,article,News,,['Nuclear Weapons']
Keeping Score: Statistics to Watch at the World Series,2013-10-23,article,News,,['World Series']
Scene City: Fashion Stars Take a Bow,2013-10-23,multimedia,Slideshow,,"['Fashion and Apparel', 'Awards, Decorations and Honors']"
Roundup slide show,2013-10-23,multimedia,Slideshow,,[]
Appeals Court Throws Out Confidential Arbitration in Delaware,2013-10-23,article,News,,"['ARBITRATION, CONCILIATION AND MEDIATION', 'Courts and the Judiciary']"
"Bill Mazer, Sports Fixture in New York, Dies at 92",2013-10-23,article,Obituary (Obit),,"['Radio', 'Television', 'Deaths (Obituaries)', 'Baseball']"
"A Wife Committed to Cruz’s Ideals, but a Study in Contrasts to Him",2013-10-23,article,News,,"['Patient Protection and Affordable Care Act (2010)', 'United States Politics and Government', 'Federal Budget (US)', 'Health Insurance and Managed Care']"
"Middle East Peace Talks Go On, Under the Radar",2013-10-23,article,News,,"['Palestinians', 'International Relations']"
The Benefits of Having Your Own Moving Truck,2013-10-23,article,News,,"['Automobiles', 'Moving and Moving Industry']"
A Royal Christening in Britain Amid a Refrain of Coos,2013-10-23,article,News,,['Royal Family']
Lorde and Eminem Battle at the Top of the Singles Chart,2013-10-23,article,News,,['Music']
Nina Arianda Returning to New York Stage in ‘Red Vienna’,2013-10-23,article,News,,['Theater']
An Evening of Mark Morris ... and Some Other People,2013-10-23,article,Review,,['Dancing']
Following the Stars in a Rush to Riches,2013-10-23,article,Review,,"['Books and Literature', 'Man Booker Prize']"
A Night to Pay Homage With Their Wardrobes,2013-10-23,article,News,,"['Fashion and Apparel', 'Awards, Decorations and Honors']"
Three Men Lean in for Mutual Support,2013-10-23,article,Review,,"['Music', 'Jazz']"
A Guitar Opens Up Some Musical Spaces That Only a Voice Can Fill,2013-10-23,article,Review,,['Music']
Student Ensemble’s Sound Belies Its Origin,2013-10-23,article,Review,,"['Classical Music', 'Music']"
From the Wilderness to an Electric Role,2013-10-23,article,News,,['Theater']
Lundqvist’s Backup to Make N.H.L. Debut ,2013-10-23,article,News,,"['Hockey, Ice']"
"Bach in a String Concert, Sharing a Program With Bluegrass",2013-10-23,article,Review,,"['Classical Music', 'Music']"
Q. and A.: Tom Byer on Soccer in China,2013-10-23,article,News,,"['Soccer', ""Women's World Cup (Soccer)"", 'World Cup (Soccer)']"
Pictures of the Day: West Bank and Elsewhere,2013-10-23,article,News,,['Photography']
Anatomy: ‘Blue Is the Warmest Color’,2013-10-23,multimedia,Video,,['Movies']
A Seattle Theater’s Broadway Credentials,2013-10-23,article,News,,['Theater']
Could Obamacare Discredit Neoliberalism?,2013-10-23,article,News,,"['Health Insurance and Managed Care', 'Liberalism (US Politics)', 'Patient Protection and Affordable Care Act (2010)']"
Sparse Competition and Higher Premiums,2013-10-23,multimedia,Interactive Feature,,"['Patient Protection and Affordable Care Act (2010)', 'Health Insurance and Managed Care']"
Anatomy of a Scene: Video of ‘Blue Is the Warmest Color’,2013-10-23,article,News,,['Movies']
$45 for a Premium Hockney Viewing,2013-10-23,article,News,,"['Museums', 'Art']"
London’s Tech City Takes Root,2013-10-23,multimedia,Slideshow,,"['Start-ups', 'Computers and the Internet']"
Technology on the Thames,2013-10-23,article,News,,"['Start-ups', 'Computers and the Internet']"
A Liberal Parts Ways With Fox ,2013-10-23,article,News,,['News and News Media']
Music History at Caffè Lena,2013-10-23,multimedia,Slideshow,,"['Folk Music', 'Music']"
Everyone Except Mozart,2013-10-23,article,Review,,"['Opera', 'Classical Music']"
"Folk Music Heaven, Upstairs",2013-10-23,article,News,,"['Folk Music', 'Music', 'Books and Literature']"
Blurring Lines Between People and Other Creatures,2013-10-23,article,Review,,['Dancing']
Hollywood Stars Ask N.S.A. to Stop Mass Surveillance,2013-10-23,article,News,,['Surveillance of Citizens by Government']
A Chef in the Field | Pumpkins,2013-10-23,article,News,,"['Cooking and Cookbooks', 'Pumpkins']"
Jury Finds Bank of America Liable in Mortgage Case,2013-10-23,article,News,,"['Banking and Financial Institutions', 'Mortgages', 'Subprime Mortgage Crisis', 'Suits and Litigation (Civil)']"
A Sport Coat Meets a Topcoat,2013-10-23,multimedia,Slideshow,,"['Fashion and Apparel', 'Men and Boys', 'Coats']"
Sophie Calle Mounts an Exhibition of Missing Art,2013-10-23,article,News,,"['Art', 'Museums']"
A Roundup of Worthy Apps for the New iPads,2013-10-23,article,News,,"['Tablet Computers', 'Mobile Applications', 'iPad']"
"Joel Grey, M.C. in ‘Cabaret,’ to Publish Memoir",2013-10-23,article,News,,['Books and Literature']
Art You Can Live With,2013-10-23,article,News,,['Interior Design and Furnishings']
Designer Theremin,2013-10-23,multimedia,Video,,"['Musical Instruments', 'Art']"
What Would They Do with Axl Rose?,2013-10-23,article,News,,"['Art', 'Books and Literature']"
Eating in a Most Peculiar Way,2013-10-23,article,News,,"['Space and Astronomy', 'Museums', 'Chairs', 'Art']"
The Cavendish Invitational in Monaco,2013-10-23,article,News,,"['Cards and Card Games', 'Bridge (Card Game)']"
"Discounts at Flor, Maine Cottage Furniture, Blue Dot and Luceplan",2013-10-23,article,News,,"['Furniture', 'Lighting', 'Carpets and Rugs', 'Interior Design and Furnishings']"
A Wave of Strange Creatures,2013-10-23,article,News,,"['Musical Instruments', 'Art']"
"Yes, That’s Right: Sconces",2013-10-23,article,News,,"['Lighting', 'Interior Design and Furnishings']"
A Blueprint for Misery,2013-10-23,article,Question,,['Art']
Where Peace Comes Whizzing By,2013-10-23,multimedia,Slideshow,,"['Alternative and Renewable Energy', 'ARCHITECTURE']"
For Her Next Production ...,2013-10-23,article,News,,"['ARCHITECTURE', 'Alternative and Renewable Energy']"
Only Slightly Mad,2013-10-23,multimedia,Slideshow,,['Interior Design and Furnishings']
David Bromberg and Nancy Josephson: Duet for Violin and Voodoo,2013-10-23,article,News,,"['Interior Design and Furnishings', 'Violins', 'Art', 'Music']"
Pension Alert Is Issued in Chicago Budget Talk,2013-10-23,article,News,,"['Budgets and Budgeting', 'Pensions and Retirement Plans', 'Government Employees']"
"The Devil Is in the Details, but Few Take Notice",2013-10-23,article,News,,"['Halloween', 'Haunted Houses']"
Face to Face With My Inner Mean Old Man,2013-10-23,article,News,,"['Haunted Houses', 'Halloween', 'Noise']"
How to Haunt a House,2013-10-23,multimedia,Slideshow,,['Haunted Houses']
House Haunters,2013-10-23,article,News,,"['Haunted Houses', 'Halloween', 'Interior Design and Furnishings']"
The Over-the-Topcoat,2013-10-23,article,News,,"['Fashion and Apparel', 'Men and Boys', 'Coats']"
"Fall Fashion Trends: Jewelry, and Skirts that Flutter",2013-10-23,article,News,,"['Fashion and Apparel', 'Shopping and Retail', 'Jewels and Jewelry', 'Lingerie and Underwear']"
"Competition Rises for AT&T, as Does 3rd-Quarter Profit",2013-10-23,article,News,,['Company Reports']
How Winglets Work,2013-10-23,multimedia,Interactive Feature,,['AIRLINES AND AIRPLANES']
"Openings, Sales and Events for the Week of Oct. 24",2013-10-23,article,News,,"['Fashion and Apparel', 'Shopping and Retail']"
"Funding Circle, British Peer-to-Peer Lender, Expands to U.S.",2013-10-23,article,News,,['Small Business']
Makeup Trend: Matte Base Layers,2013-10-23,article,News,,"['Cosmetics and Toiletries', 'Skin']"
Prospect Park Closing on Friday for Obama Visit,2013-10-23,article,News,,"['Marine One (Helicopter)', 'Shutdowns (Institutional)', 'Education (K-12)']"
New Mexico Justices to Rule on Gay Marriage,2013-10-23,article,News,,"['Same-Sex Marriage, Civil Unions and Domestic Partnerships', 'State Legislatures', 'Supreme Courts (State)']"
The Biggest Economy Killer: Our Government,2013-10-23,article,Op-Ed,,"['United States Economy', 'Federal Budget (US)', 'Labor and Jobs', 'Shutdowns (Institutional)', 'United States Politics and Government']"
New Clean Air Rules Would Do Little,2013-10-23,article,Op-Ed,,"['Greenhouse Gas Emissions', 'Global Warming', 'Coal', 'Natural Gas', 'Regulation and Deregulation of Industry', 'Carbon Dioxide', 'Electric Light and Power', 'Air Pollution']"
"For Emily Ratajkowski, ‘Blurred Lines’ Brings a Career Path Into Focus",2013-10-23,article,News,,"['Models (Professional)', 'Fashion and Apparel']"
"At the Bathroom Sink, Razors Face Off",2013-10-23,article,News,,"['Shaving and Shavers', 'Men and Boys', 'Skin']"
Oil Spill in North Dakota Raises Detection Concerns,2013-10-23,article,News,,"['Oil Spills', 'Pipelines']"
Web Sites and Grave Sites,2013-10-23,article,Op-Ed,,"['Patient Protection and Affordable Care Act (2010)', 'Computers and the Internet', 'United States Politics and Government']"
"Butch Warren, 74, Prominent Jazz Bassist, Dies",2013-10-23,article,Obituary (Obit),,"['Jazz', 'Deaths (Obituaries)']"
A Stylist’s Custom Fashion,2013-10-23,article,News,,"['Fashion and Apparel', 'Dresses']"
Adelson Suggests U.S. Nuclear Strike on Iran Ahead of Negotiations,2013-10-23,article,News,,"['Nuclear Weapons', 'United States International Relations']"
2012 Leak Detection Study,2013-10-23,multimedia,Interactive Feature,,"['Oil Spills', 'Pipelines']"
Lawmaker Says Iran Has Halted Enrichment,2013-10-23,article,News,,"['Uranium', 'Nuclear Weapons']"
Mickey Boardman: Keeping Up With His Followers,2013-10-23,article,News,,"['Social Media', 'News and News Media', 'Magazines']"
Nicola Formichetti Pays Tribute to Diesel,2013-10-23,article,News,,"['Shopping and Retail', 'Fashion and Apparel']"
"Noel Harrison, Actor and Singer of ‘Windmills of Your Mind,’ Dies at 79",2013-10-23,article,Obituary (Obit),,"['ACTORS AND ACTRESSES', 'Music', 'Deaths (Obituaries)', 'Television']"
"Boy, 14, Is Arraigned as Adult in Killing of a Teacher Near Boston",2013-10-23,article,News,,"['Murders and Attempted Murders', 'Education (K-12)']"
The Rancor Against Roma in Europe,2013-10-23,article,Letter,,"['Romani People', 'Discrimination', 'Immigration and Emigration']"
Lights! Camera! Inaction! It’s Performance Art,2013-10-23,article,Letter,,['Performance Art']
Today’s Scuttlebot: Twitter’s Scary Names and Facebook’s Machines,2013-10-23,article,News,,[]
Bargaining With the Censors to Get Published in China,2013-10-24,article,Letter,,"['Censorship', 'Writing and Writers', 'Books and Literature']"
Brooklyn Academy of Music Announces Winter/Spring 2014 Season,2013-10-24,article,News,,[]
Honor Killings in India,2013-10-24,article,Letter,,"['Honor Killings', 'Hinduism', 'Religion and Belief']"
Assessing Chemical Risks,2013-10-24,article,Letter,,"['Hazardous and Toxic Substances', 'Regulation and Deregulation of Industry']"
"Pinterest Raises $225 Million, as Valuation Jumps to $3.8 Billion",2013-10-24,article,News,,['Social Media']
Better News in New Study That Assesses U.S. Students,2013-10-24,article,News,,"['Tests and Examinations', 'Education (K-12)', 'Mathematics', 'Science and Technology']"
"Young Women, Drinking and Rape",2013-10-24,article,News,,[]
"In a Major Departure, Google Shows Banner Ads in Search Results",2013-10-24,article,News,,"['Online Advertising', 'Search Engines']"
Case Explores Rights of Fetus Versus Mother,2013-10-24,article,News,,"['Pregnancy and Childbirth', 'Tests (Drug Use)', 'Suits and Litigation (Civil)', 'Child Abuse and Neglect', ""Women's Rights"", 'Drug Abuse and Traffic']"
"Twitter, Women and Power",2013-10-24,article,Op-Ed,,"['Women and Girls', 'Boards of Directors', 'Executives and Management (Theory)']"
Ad-Sponsored Editorial Content Draws Regulator’s Notice,2013-10-24,article,News,,"['ADVERTISING AND MARKETING', 'Regulation and Deregulation of Industry', 'Conflicts of Interest', 'Online Advertising']"
A More Nuanced de Blasio Emerges,2013-10-24,article,News,,"['Elections, Mayors']"
Some Iranians Seek to Renew an Old Chant,2013-10-24,article,News,,"['Slogans and Mottoes', 'Contests and Prizes']"
Signs of Life in Euro Zone Could Point to Recovery,2013-10-24,article,News,,"['Recession and Depression', 'Banking and Financial Institutions', 'Regulation and Deregulation of Industry', 'European Sovereign Debt Crisis (2010- )']"
"Boy, 13, Carrying Toy Guns Is Shot Dead by Deputies",2013-10-24,article,News,,"['Police Brutality, Misconduct and Shootings']"
Extravagant Wedding Raises Awkward Questions for a Beijing Official,2013-10-24,article,News,,"['Corruption (Institutional)', 'Olympic Games (2008)']"
Heated Start in the Trial on Detroit’s Fiscal Future,2013-10-24,article,News,,"['Bankruptcies', 'Organized Labor', 'Pensions and Retirement Plans', 'Government Employees']"
"Year After Hurricane Sandy, Victims Contest Christie’s Status as a Savior",2013-10-24,article,News,,"['Hurricane Sandy (2012)', 'Federal Aid (US)']"
"LinkedIn Gets the Message: More Mobile, Please",2013-10-24,article,News,,"['Mobile Applications', 'Social Media']"
"Eye-Catching Wingtips, but They Aren’t for Show",2013-10-24,article,News,,"['AIRLINES AND AIRPLANES', 'Fuel Efficiency', 'Oil (Petroleum) and Gasoline']"
Veteran Reliever Knows About Facing Heat,2013-10-24,article,News,,"['Baseball', 'World Series']"
"Republicans, Sensing Weakness in Health Law Rollout, Switch Tactics",2013-10-24,article,News,,"['Patient Protection and Affordable Care Act (2010)', 'United States Politics and Government', 'Computers and the Internet', 'Health Insurance and Managed Care']"
Boehner on Shutdown’s Fallout,2013-10-24,multimedia,Video,,"['Medicine and Health', 'Shutdowns (Institutional)']"
Skakel Gets New Trial in ’75 Killing of Teenager in Connecticut,2013-10-24,article,News,,"['Murders and Attempted Murders', 'Decisions and Verdicts']"
"Contractors Assign Blame, but Admit No Faults of Their Own, in Health Site",2013-10-24,article,News,,"['Patient Protection and Affordable Care Act (2010)', 'Health Insurance and Managed Care', 'United States Politics and Government', 'Computers and the Internet']"
"Amid Rising Discord Over Indian Images, F.S.U. Has Harmony",2013-10-24,article,News,,"['Football (College)', 'Seminole Indians', 'Native Americans', 'Mascots', 'Athletics and Sports', 'Names, Organizational']"
The Judge’s Decision on Skakel,2013-10-24,multimedia,Interactive Feature,,"['Murders and Attempted Murders', 'Decisions and Verdicts']"
Cardinals Are Sending Their Hot Rookie Pitcher to the Mound for Game 2,2013-10-24,article,News,,"['Baseball', 'World Series']"
"No Husband, No Friends",2013-10-24,article,News,,"['Grief (Emotion)', 'Widows and Widowers']"
Fantasy Football: Week 8 Matchup Breakdown,2013-10-24,article,News,,"['Football', 'Fantasy Sports']"
"Left to Languish, Costly Fire Trucks Present a Reminder of Thai Dysfunction",2013-10-24,article,News,,"['Corruption (Institutional)', 'Fires and Firefighters', 'Government Procurement']"
Twitter Illiterate? Mastering the @BC’s,2013-10-24,article,News,,"['Social Media', 'Computers and the Internet']"
Ted Cruz Takes On the F.C.C.,2013-10-24,article,Editorial,,"['United States Politics and Government', 'Political Advertising', 'Editorials']"
The Deaths of Innocents,2013-10-24,article,Editorial,,"['Drones (Pilotless Planes)', 'Civilian Casualties', 'Terrorism', 'Editorials']"
For District Attorney in Brooklyn,2013-10-24,article,Editorial,,"['Elections, District Attorneys', 'Endorsements', 'Editorials']"
Waiting for What Comes Next,2013-10-24,article,Editorial,,"['Rural Areas', 'Dogs', 'Autumn (Season)', 'Editorials']"
Outspoken Weir Will Be Quiet on Russian Law,2013-10-24,article,News,,"['Figure Skating', 'Olympic Games (2014)', 'Homosexuality']"
"Confession in ‘Baby Hope’ Killing Was Taped, but the Interrogation Was Not ",2013-10-24,article,News,,"['Confessions', 'Murders and Attempted Murders', 'Interrogations', 'Video Recordings and Downloads']"
"Powerball and Lottery Numbers for Oct. 23, 2013",2013-10-24,article,List,,['Lotteries']
Nicks Struggles as Free Agency Looms,2013-10-24,article,News,,['Football']
"Corrections: October 24, 2013",2013-10-24,article,News,,[]
"Wonder May Fade, but Lessons Linger",2013-10-24,article,Review,,['Theater']
Unwelcome Reversal,2013-10-24,article,News,,['Crossword Puzzles']
A Homely Relic on Wheels Awakens Nostalgia in Iran,2013-10-24,article,News,,"['Automobiles', 'Art']"
JPMorgan Faces Possible Penalty in Madoff Case,2013-10-24,article,News,,"['Banking and Financial Institutions', 'Ponzi and Pyramid Schemes']"
Every Game Brings an Extra-Large Challenge for Jets’ Allen,2013-10-24,article,News,,['Football']
"Quotation of the Day for Thursday, October 24, 2013",2013-10-24,article,Quote,,[]
J&R Alters the Blocklong Layout It’s Known For,2013-10-24,article,News,,"['Relocation of Business', 'Shopping and Retail']"
7-Year Low Reported in Piracy Off Somalia,2013-10-24,article,News,,"['Piracy at Sea', 'Ships and Shipping']"
"Health Care
Law Fails to
Lower Prices
for Rural Areas",2013-10-24,article,News,,"['Health Insurance and Managed Care', 'Patient Protection and Affordable Care Act (2010)', 'Rural Areas', 'Prices (Fares, Fees and Rates)']"
Thursday’s Matchup: Panthers (3-3) at Buccaneers (0-6),2013-10-24,article,News,,['Football']
"Tunisian Protests, by Islamist and Secular Groups, Delay Talks on Constitution",2013-10-24,article,News,,"['Middle East and North Africa Unrest (2010- )', 'Demonstrations, Protests, and Riots', 'Muslims and Islam', 'Constitutions']"
"Sued Over Pay, Condé Nast Ends Internship Program",2013-10-24,article,News,,"['Internships', 'Minimum Wage', 'Suits and Litigation (Civil)', 'Magazines', 'Wages and Salaries', 'Media']"
"From Small Fire, a Great Fried-Knish Famine",2013-10-24,article,News,,"['Knishes', 'Fires and Firefighters', 'Factories and Manufacturing', 'Food', 'Bakeries and Baked Products']"
"Pierce, Ex-Celtic and Current Net, Straddling Two Cities",2013-10-24,article,News,,['Basketball']
Pakistani Premier Meets Obama to Mend Ties,2013-10-24,article,News,,"['United States International Relations', 'Terrorism', 'Nuclear Weapons', 'Elections', 'Drones (Pilotless Planes)', 'Foreign Aid']"
Wise Dan’s Success Also Boosts Trainer,2013-10-24,article,News,,"['Horse Racing', 'Jockeys, Drivers and Trainers']"
Drownings Put Migration at Fore of European Meeting,2013-10-24,article,News,,"['Drownings', 'Immigration and Emigration', 'Refugees and Displaced Persons']"
Sebelius Finds a Friendly Crowd in Boston,2013-10-24,article,News,,['Patient Protection and Affordable Care Act (2010)']
White House to Tweak Tax-Penalty Deadline,2013-10-24,article,News,,['Patient Protection and Affordable Care Act (2010)']
"Allan Stanley, 87, Dies; Helped Maple Leafs Win 4 N.H.L. Titles",2013-10-24,article,Obituary (Obit),,"['Hockey, Ice', 'Deaths (Obituaries)']"
China Data Shows Uptick in Output at Factories,2013-10-24,article,News,,"['Economic Conditions and Trends', 'Factories and Manufacturing']"
The Demise of the Fashion Eccentric,2013-10-24,article,News,,[]
A Very Expensive Tea Party,2013-10-24,article,News,,"['Federal Budget (US)', 'National Debt (US)', 'Shutdowns (Institutional)', 'Tea Party Movement', 'United States Economy', 'United States Politics and Government', 'US Dollar (Currency)']"
Word of the Day | nomenclature,2013-10-24,article,News,,[]
Italy: Berlusconi Indicted in Corruption Case,2013-10-24,article,Brief,,['Corruption (Institutional)']
Fall for St. Louis; Classic for Boston,2013-10-24,article,News,,"['Baseball', 'World Series']"
Time Warner Cable Reaches Agreement to Distribute Al Jazeera America,2013-10-24,article,News,,"['News and News Media', 'Television', 'Cable Television', 'Prices (Fares, Fees and Rates)']"
Mali: Suicide Bombing Kills 2 U.N. Peacekeepers,2013-10-24,article,Brief,,"['Terrorism', 'Bombs and Explosives']"
An Even Tougher Start for the Cardinals Than in 2004,2013-10-24,article,News,,"['Baseball', 'World Series']"
Dominicans of Haitian Descent Cast Into Legal Limbo by Court,2013-10-24,article,News,,"['Citizenship and Naturalization', 'Immigration and Emigration']"
Syria: Government Releases Some Female Detainees,2013-10-24,article,Brief,,['Detainees']
Stripped of Statehood,2013-10-24,multimedia,Slideshow,,"['Immigration and Emigration', 'Citizenship and Naturalization']"
Week 8 N.F.L. Game Probabilities,2013-10-24,article,An Appraisal,,['Football']
What’s on Thursday,2013-10-24,article,Schedule,,[]
"News Quiz | October 24, 2013",2013-10-24,article,News,,[]
The Last Jews of Kolkata,2013-10-24,article,News,,"['Archives and Records', 'Books and Literature', 'Colleges and Universities', 'Jews and Judaism', 'Muslims and Islam', 'Synagogues', 'United States Economy']"
Credit Suisse to Streamline and Shrink,2013-10-24,article,News,,"['Company Reports', 'Executive Compensation']"
Challenging the Chinese Government to Disclose Its Aid to North Korea,2013-10-24,article,News,,[]
"Test Yourself | English, Oct. 24, 2013",2013-10-24,article,News,,[]
French Contemporary Art Fair Opens In Paris,2013-10-24,article,News,,['Art']
6 Q’s About the News | StoryCorps Turns 10,2013-10-24,article,News,,[]
McKesson in $8.3 Billion Deal With German Drug Wholesaler,2013-10-24,article,News,,"['Drugs (Pharmaceuticals)', 'Mergers, Acquisitions and Divestitures']"
Preview: “Running From Crazy”,2013-10-24,multimedia,Video,,['Documentary Films and Programs']
Picturing the Gowanus Above the Muck,2013-10-24,article,News,,"['Canals', 'Hazardous and Toxic Substances', 'Photography', 'Waste Materials and Disposal', 'Water']"
The Importance of Not Being Ernest,2013-10-24,article,News,,"['Documentary Films and Programs', 'Movies']"
Has Baseball Lost Its Cool?,2013-10-24,article,News,,[]
"U.S. Envoy Is
Summoned by
Germany Over
Spying Report",2013-10-24,article,News,,"['United States International Relations', 'Surveillance of Citizens by Government']"
Increase in Activity Reported at North Korean Nuclear Test Site,2013-10-24,article,News,,"['Nuclear Weapons', 'United States Defense and Military Forces']"
"With Winter Ahead, Can China’s Smog Get Anything But Worse?",2013-10-24,article,News,,"['Air Pollution', 'Coal', 'Heating']"
New York Today: Send in the Ghouls,2013-10-24,article,News,,[]
A Chinese Newspaper Restates its Call for a Reporter’s Release,2013-10-24,article,News,,[]
"Small, Steady Growth for Europe’s Economy",2013-10-24,article,News,,"['European Sovereign Debt Crisis (2010- )', 'Recession and Depression', 'Euro (Currency)']"
Santander Profit Rises as It Sets Aside Less to Cover Bad Loans,2013-10-24,article,News,,['Company Reports']
Daily Report: London Works to Raise Profile as European Tech Hub,2013-10-24,article,News,,"['Computers and the Internet', 'Start-ups']"
Ford Maintains Earnings Streak and Raises Profit Forecast for the Year ,2013-10-24,article,News,,"['Automobiles', 'Company Reports']"
North Korea to Release 6 South Korean Detainees,2013-10-24,article,News,,['Foreign Investments']
Ireland Vows to Review Cases of Roma Children Removed From Their Families,2013-10-24,article,News,,"['Romani People', 'Racial Profiling', 'Children and Childhood']"
