headline,date,doc_type,material_type,section,keywords
The Legacy of Timothy Geithner,2013-01-17,article,News,,"['Banking and Financial Institutions', 'Regulation and Deregulation of Industry']"
Another Hard Day of Trying to Stay Alive,2013-01-17,multimedia,Slideshow,,"['Afghanistan War (2001- )', 'Defense and Military Forces']"
Which Way Did the Taliban Go?,2013-01-17,article,News,,"['Afghanistan War (2001- )', 'Defense and Military Forces']"
Pakistani Preacher Ends Protest in Government Deal,2013-01-17,article,News,,"['Corruption (Institutional)', 'Decisions and Verdicts', 'Demonstrations, Protests, and Riots']"
Jordan Says It Won’t Accept New Refugees if Syria Falls,2013-01-17,article,News,,"['Middle East and North Africa Unrest (2010- )', 'Refugees and Displaced Persons']"
Part 4: Answers to Your Questions About the Fafsa,2013-01-17,article,News,,"['ADMISSIONS STANDARDS', 'Financial Aid (Education)']"
A Delicate Mating Game of Partners for Mixed Doubles,2013-01-17,article,News,,[]
"Keep Kelly Atop Police Department, New Yorkers Say in Poll",2013-01-17,article,News,,"['Elections, Mayors', 'Police', 'Polls and Public Opinion']"
Officials Say Checks Won’t Be in the Mail,2013-01-17,article,News,,"['Banking and Financial Institutions', 'Elderly', 'Social Security (US)']"
France Sends Reinforcements to Confront Islamist Forces in Mali,2013-01-17,article,News,,['Defense and Military Forces']
"In Thailand, a Broader Definition of Insulting Royalty",2013-01-17,article,News,,"['Decisions and Verdicts', 'Royal Family']"
How Good Does Karaoke Have to Be to Qualify as Art?,2013-01-17,article,News,,"['Karaoke', 'Music']"
What I Sang on My Epic Karaoke Odyssey,2013-01-17,article,News,,['Karaoke']
Maybe There Is Such a Thing as Bad Publicity,2013-01-17,article,News,,"['Public Relations and Publicity', 'Small Business']"
Louisville Slugger,2013-01-17,article,News,,"['Cooking and Cookbooks', 'Sauces', 'Meat', 'Beef']"
Jan. 17 Updates on the Gun Violence Debate,2013-01-17,article,News,,"['Gun Control', 'Newtown, Conn, Shooting (2012)']"
"Conference Title Game Probabilities, and the Kaepernick Effect",2013-01-17,article,News,,['Football']
"How We Come Up With Our Big, Important Chart",2013-01-17,article,News,,['Comedy and Humor']
The Countersettlement,2013-01-17,article,News,,"['Israeli Settlements', 'Palestinians']"
All Your Base Are Belong To Us: What Is the Question?,2013-01-17,article,News,,[]
A Mending Spain Finds Willing Bond Buyers,2013-01-17,article,News,,['European Sovereign Debt Crisis (2010- )']
Daily Report: Europe Weighs Requiring Firms to Disclose Data Breaches,2013-01-17,article,News,,[]
On the Non-equivalence of Greenhouse Gases and Entitlement Spending,2013-01-17,article,News,,[]
Profit Drops 63% at Bank of America After Mortgage Settlements,2013-01-17,article,News,,"['Banking and Financial Institutions', 'Company Reports', 'Mortgages']"
Test for Tomic After a Year of Tumult,2013-01-17,article,News,,"['Tennis', 'Australian Open (Tennis)']"
Q&A: How to Move from Hotmail to Outlook.com,2013-01-17,article,News,,['E-Mail']
Facebook’s Other Big Disruption,2013-01-17,article,News,,"['Data Centers', 'Enterprise Computing', 'Social Networking (Internet)']"
Opinion Report: India and Pakistan,2013-01-17,article,News,,[]
Time and Other Collaborators,2013-01-17,article,News,,['Art']
Bat Fungus Spreads in Kentucky,2013-01-17,article,News,,[]
Robert Stone to Publish First Novel in Decade,2013-01-17,article,News,,"['Books and Literature', 'National Book Awards', 'Writing and Writers']"
BlackRock Posts Record Profit as Investors Take On More Risk,2013-01-17,article,News,,['Company Reports']
"Facing Legal Costs, Citigroup Disappoints in 4th Quarter",2013-01-17,article,News,,"['Banking and Financial Institutions', 'Company Reports']"
New Delhi Gang-Rape Case Is Expected to Move to Fast-Track Court,2013-01-17,article,News,,[]
"The Breakfast Meeting: Levity Gets a Screening at Sundance, and Questions for Armstrong",2013-01-17,article,News,,[]
Boeing’s 787,2013-01-17,article,News,,['AIRLINES AND AIRPLANES']
A Grandma’s Defense,2013-01-17,article,News,,"['Buttons', 'Children and Childhood', 'Elevators and Escalators', 'Grandparents']"
"Thursday Reading: A Flu Shot, Even if You’ve Had the Flu?",2013-01-17,article,News,,[]
Mortgage Woes Weigh on Bank of America,2013-01-17,article,News,,[]
Breaking the Mold | Takuro Kuwata,2013-01-17,article,News,,"['Art', 'Ceramics and Pottery']"
Measuring the Success of Online Education,2013-01-17,article,News,,['E-Learning']
Jihadist Kingpin Suspected in Hostage Seizure,2013-01-17,article,News,,['Hostages']
Canada Pension Plan Unit to Join K.K.R. Merchant Banking Venture,2013-01-17,article,News,,"['Pensions and Retirement Plans', 'Private Equity']"
Rick Owens: Fall 2013 Menswear,2013-01-17,multimedia,Slideshow,,"[""Men's Fashion Week"", 'Fashion and Apparel']"
New Barclays Chief Tells Staff to Accept Changes or Leave,2013-01-17,article,News,,"['Banking and Financial Institutions', 'Libor (London Interbank Offered Rate)']"
Rick Owens,2013-01-17,multimedia,Slideshow,,"['Fashion and Apparel', ""Men's Fashion Week""]"
What to See in 2013,2013-01-17,article,News,,"['Art', 'Museums', 'Reviews']"
Ken Salazar’s Legacy,2013-01-17,article,News,,"['Hydraulic Fracturing', 'Offshore Drilling and Exploration', 'Regulation and Deregulation of Industry', 'Wind Power']"
The Cleric in the Container,2013-01-17,article,News,,"['Demonstrations, Protests, and Riots', 'Economic Conditions and Trends', 'Elections']"
Republicans May Offer Short-Term Extension of Borrowing Limit,2013-01-17,article,News,,"['United States Politics and Government', 'Federal Budget (US)']"
A Spot-On Impression of a Stubborn Survivor,2013-01-17,article,News,,"['Comedy and Humor', 'Theater']"
Knicks’ Wallace Says He’ll Play Again This Season,2013-01-17,article,News,,['Basketball']
What We’re Reading,2013-01-17,article,News,,[]
Poetry Pairing | ‘Pentatina for Five Vowels’,2013-01-17,article,News,,[]
Fighting for Light Amid Urban Noir,2013-01-17,article,Review,,['Movies']
Difficult Choices on Debt if the U.S. Hits the Ceiling,2013-01-17,article,News,,"['National Debt (US)', 'United States Economy', 'Credit Ratings and Credit Rating Agencies', 'United States Politics and Government', 'Federal Budget (US)']"
"Outsize Personality Joins, and Jostles, Mayor’s Race",2013-01-17,article,News,,"['Elections, Mayors']"
Lying Becomes an Official Sport,2013-01-17,article,News,,"['Football', 'Lying', 'Athletics and Sports']"
Louis Vuitton: Fall 2013 Menswear,2013-01-17,multimedia,Slideshow,,"[""Men's Fashion Week"", 'Fashion and Apparel']"
Gun Control and Suicide,2013-01-17,article,News,,['Gun Control']
Excerpt: 'Newsreaders',2013-01-17,multimedia,Video,,[]
‘Reporting’ the News for Adult Swim,2013-01-17,article,Question,,['Television']
Louis Vuitton,2013-01-17,multimedia,Slideshow,,"['Fashion and Apparel', ""Men's Fashion Week"", 'Paris Fashion Week']"
Flu Season Strikes Again ... and Again,2013-01-17,multimedia,Video,,"['Influenza', 'Medicine and Health']"
"Ben Affleck, Resurgent Yet Again",2013-01-17,article,News,,[]
Jared Diamond: By the Book,2013-01-17,article,Question,,"['Books and Literature', 'Writing and Writers']"
The Fallout of a Chance Medical Finding,2013-01-17,article,News,,"['Doctors', 'Medicine and Health', 'Radiation', 'Tests (Medical)']"
Why Am I Getting Mellower?,2013-01-17,article,News,,"['Baby Boomers', 'Anxiety and Stress', 'Age, Chronological']"
Drinking Like a Poet,2013-01-17,article,News,,"['Whiskey', 'Poetry and Poets']"
The Road to Bamian,2013-01-17,article,News,,"['AFGHAN-AMERICANS', 'Afghanistan War (2001- )', 'Roads and Traffic']"
Mali's Challenge for Washington,2013-01-17,multimedia,Video,,['Influenza']
Image of the Day: Jan. 17,2013-01-17,article,News,,[]
Wheelies: The Booming Business Edition,2013-01-17,article,News,,"['Automobiles', 'Electric and Hybrid Vehicles']"
SurveyMonkey Raises Nearly $800 Million While Staying Private,2013-01-17,article,News,,[]
An Inquiry Into Discolored Snow,2013-01-17,article,News,,"['City Councils', 'Skiing', 'Snow and Snowstorms']"
U.S. Weighing Policy Options in Mali,2013-01-17,multimedia,Video,,"['Muslims and Islam', 'United States International Relations', 'Terrorism']"
Seth MacFarlane on Hosting: ‘It Could Be a Disaster. Who Knows?’,2013-01-17,article,News,,['Academy Awards (Oscars)']
Monument to a City,2013-01-17,article,News,,['Monuments and Memorials (Structures)']
Young People Paying Off Card Debt More Slowly,2013-01-17,article,News,,"['Credit and Debt', 'Credit Cards', 'Personal Bankruptcies']"
Philadelphia Vandalism of Quaker Building Is Seen by Some as Union Intimidation,2013-01-17,article,News,,"['Quakers', 'Organized Labor', 'Vandalism']"
Memories of a Kid on a Hot Tin Roof,2013-01-17,article,News,,"['Theater', 'ACTORS AND ACTRESSES']"
Ratings for “American Idol” Premiere Are Down Again,2013-01-17,article,News,,"['ADVERTISING AND MARKETING', 'Ratings (Audience Measurement)', 'Seasons and Months', 'Television']"
Solving Bus Strike’s Impact on Special Needs Students Isn’t Simple,2013-01-17,article,News,,"['Buses', 'Children and Childhood', 'Education (K-12)', 'Parenting', 'Special Education', 'Strikes']"
A Gentle Giant of a Catfish Fades From Sight,2013-01-17,article,News,,"['Boats and Boating', 'Catfish', 'Fish and Other Marine Life', 'Rivers']"
Arizona Congresswoman Hires Immigrant Activist After She Details Raid,2013-01-17,article,News,,"['Dream Act (Development, Relief and Education for Minors Act)', 'Immigration and Emigration', 'Law and Legislation']"
From Sketch to Stage: ‘The House of von Macramé',2013-01-17,multimedia,Slideshow,,"['Theater', 'Costumes', 'Design']"
Armstrong Stripped of 2000 Olympic Medal,2013-01-17,article,News,,"['Doping (Sports)', 'Olympic Games', 'Bicycles and Bicycling', 'Cycling, Road']"
Officials Seek Energy Drink Information,2013-01-17,article,News,,"['Energy and Sports Drinks', 'United States Politics and Government', 'Regulation and Deregulation of Industry', 'Caffeine']"
"Double Duty Tests Serena Williams’s Ankle, And it Holds Up",2013-01-17,article,News,,[]
Museum of Arts and Design Director Announces Departure,2013-01-17,article,News,,[]
The Long Wait,2013-01-17,multimedia,Video,,['Disabilities']
Orbitz Videos Hope Lookers Become Bookers,2013-01-17,article,News,,['Travel and Vacations']
No Comment Necessary: Conspiracy Nation,2013-01-17,article,News,,['Polls and Public Opinion']
Russian Comforts on Antarctic Ice,2013-01-17,article,News,,"['Ice', 'Saunas and Sweat Lodges', 'Weather']"
Gun Violence Is a Topic of Discussion at Sundance,2013-01-17,article,News,,"['Documentary Films and Programs', 'Gun Control', 'Hate Crimes', 'Newtown, Conn, Shooting (2012)', 'School Shootings', 'Sundance Film Festival (Park City, Utah)']"
MoMA Names Winner of 14th Young Architects Program,2013-01-17,article,News,,['ARCHITECTURE']
‘The Long Wait’,2013-01-17,article,Op-Ed,,"['Transit Systems', 'Disabilities']"
"Dining, Discs and More in Durham, N.C.",2013-01-17,multimedia,Slideshow,,['Travel and Vacations']
"36 Hours in Durham, N.C.",2013-01-17,article,News,,['Travel and Vacations']
3 Tips for Finding Rental Car Deals,2013-01-17,article,News,,"['Automobile Renting and Leasing', 'Travel and Vacations']"
Restaurant Report: The Grove in Toronto,2013-01-17,article,News,,"['Restaurants', 'Travel and Vacations']"
The Story of Hip-Hop,2013-01-17,article,News,,"['Music', 'Rap and Hip-Hop']"
Winfrey’s Channel Is Set to Break Through,2013-01-17,article,News,,['Cable Television']
"Pauline Phillips, Flinty Adviser to Millions as Dear Abby, Dies at 94",2013-01-17,article,Obituary (Obit),,"['Newspapers', 'Deaths (Obituaries)', 'Customs, Etiquette and Manners']"
Facebook App Adds Free Voice Calls. Will Anyone Care?,2013-01-17,article,News,,['Mobile Applications']
U.S. Calls for ‘Cooler Heads’ in Dispute Over Asian Islands,2013-01-17,article,News,,['United States International Relations']
Wedding Q. and A.,2013-01-17,article,News,,"['Weddings and Engagements', 'Customs, Etiquette and Manners']"
Preoccupying My Mind With Summer Plans as Colleges Decide My Fate,2013-01-17,article,News,,"['ADMISSIONS STANDARDS', 'Colleges and Universities', 'Foreign Students (in US)']"
7-Year-Old Takes Gun to School,2013-01-17,article,News,,"['Education (K-12)', 'School Shootings', 'Firearms']"
Rendering a City With a Blowtorch,2013-01-17,article,Review,,"['Theater', 'Under the Radar Festival']"
"Life, Interrupted: Brotherly Love",2013-01-17,article,News,,"['Bone Marrow', 'Cancer', 'Leukemia', 'Transplants']"
"Reporting in The Times on Football Star’s Nonexistent Girlfriend Was Glancing, but Still Troubling",2013-01-17,article,News,,[]
Tanoshi,2013-01-17,multimedia,Slideshow,,['Restaurants']
Car-Seat Installation in the Real World: Harder Than It Looks,2013-01-17,article,News,,"['Automobiles', 'Babies and Infants', 'Child Car Seats', 'Children and Childhood', 'Parenting']"
Web Hunt for DNA Sequences Leaves Privacy Compromised,2013-01-17,article,News,,"['DNA (Deoxyribonucleic Acid)', 'Privacy', 'Genetics and Heredity']"
Sushi That Delights in the Details,2013-01-17,article,Review,,['Restaurants']
Photos of The Moment | 3.1 Phillip Lim,2013-01-17,article,News,,"['Fashion and Apparel', 'Paris Fashion Week']"
A Simpler Form for Home Office Deductions,2013-01-17,article,News,,"['Federal Taxes (US)', 'Real Estate and Housing (Residential)', 'Tax Credits, Deductions and Exemptions']"
The Appetite Workout,2013-01-17,article,News,,"['Calories', 'Exercise', 'Hormones', 'Medicine and Health']"
Channel Surfing: Faking It With ‘Newsreaders’,2013-01-17,article,News,,['Television']
New York City Elections Are Becoming Ever More Costly,2013-01-17,article,News,,['Budgets and Budgeting']
"Quirks of the Game: For Coaches, a Tough Road Back to Super Bowl",2013-01-17,article,News,,"['Coaches and Managers', 'Football', 'Super Bowl']"
Dell’s Ups and Downs With Options,2013-01-17,article,News,,"['Stock Options and Purchase Plans', 'Executive Compensation', 'ACCOUNTING AND ACCOUNTANTS']"
Three Windows 8 Features Worth Celebrating,2013-01-17,article,News,,['Windows (Operating System)']
No Deal on Teacher Evaluations; City Risks Losing $450 Million,2013-01-17,article,News,,"['Performance Evaluations (Labor)', 'Teachers and School Employees']"
Dries Van Noten: Fall 2013 Menswear,2013-01-17,multimedia,Slideshow,,"['Fashion and Apparel', ""Men's Fashion Week""]"
Robson Does the Dirty Work in Beating Kvitova,2013-01-17,article,News,,[]
Dries Van Noten,2013-01-17,multimedia,Slideshow,,"['Fashion and Apparel', 'Paris Fashion Week']"
Lance Armstrong’s Other Career: Auto Pitchman,2013-01-17,article,News,,"['ADVERTISING AND MARKETING', 'Automobiles', 'Bicycles and Bicycling', 'Tour de France (Bicycle Race)']"
Few Silver Linings in Gloomy Bank Reports,2013-01-17,article,News,,"['Banking and Financial Institutions', 'Company Reports']"
Livestrong and the Perils of Corporate Sponsorships,2013-01-17,article,News,,"['Soccer', 'Stadiums and Arenas']"
A Smattering of Food Links,2013-01-17,article,News,,"['Farm Bill (US)', 'Fast Food Industry', 'Obesity', 'Sexually Transmitted Diseases']"
What Was Dear Abby’s Most Helpful Advice?,2013-01-17,article,News,,[]
Look of The Moment | Marion Cotillard,2013-01-17,article,News,,[]
"At Republican Retreat, Ryan Urges Unity on Fiscal Issues",2013-01-17,article,News,,['United States Politics and Government']
‘The Barbarous Years’,2013-01-17,article,Letter,,['Books and Literature']
The R’s Have It,2013-01-17,article,Letter,,['Books and Literature']
Cats,2013-01-17,article,Letter,,['Books and Literature']
Meredith Vieira Said to Be in Talks for Daytime Show,2013-01-17,article,News,,['Television']
News and ‘News Analysis': Navigating Fact and Opinion in The Times,2013-01-17,article,News,,[]
Digital Notes: Amazon Enters Apple’s Phones to Compete on Music Downloads,2013-01-17,article,News,,"['Audio Recordings and Downloads', 'Computers and the Internet', 'Music', 'Shopping and Retail']"
Rosa Parks Statue to Be Added to the Capitol,2013-01-17,article,News,,"['Capitol Building (Washington, DC)', 'Civil Rights and Liberties']"
Drawing Upon Diverse Interviews,2013-01-17,article,Review,,['Art']
"A Beat Poet’s Colorful Crew, in Black and White",2013-01-17,article,Review,,"['Art', 'Poetry and Poets', 'Photography']"
A. Scott Berg to Publish Biography of Woodrow Wilson,2013-01-17,article,News,,"['Awards, Decorations and Honors', 'Books and Literature', 'National Book Awards', 'Pulitzer Prizes', 'Writing and Writers']"
Few Possibilities for Prosecution at JPMorgan,2013-01-17,article,News,,['Company Reports']
"16.2 Million Vehicles Recalled in 2012, Safety Agency Says",2013-01-17,article,News,,"['Automobile Safety Features and Defects', 'Automobiles', 'Recalls and Bans of Products']"
Russia Warns of Retaliation Over U.S. Ruling on a Jewish Collection,2013-01-17,article,News,,"['United States International Relations', 'Jews and Judaism']"
A Popularity Present for Michelle Obama,2013-01-17,article,News,,['Polls and Public Opinion']
Biden Getting an Autobiography From The Onion (Whether He Wants It or Not),2013-01-17,article,News,,"['Amazon Kindle', 'E-Books and Readers']"
Thompson Says He Wouldn’t Raise Taxes if Elected Mayor,2013-01-17,article,News,,"['Elections, Mayors', 'Taxation']"
What Issue? Stern Wants More Audio Taping at N.B.A. Games,2013-01-17,article,News,,['Basketball']
Highlights and Analysis: Knicks Defeat Pistons in London,2013-01-17,article,News,,['Basketball']
Gun Debate Moves to Capitol Hill,2013-01-17,multimedia,Video,,['Gun Control']
A Swollen Stream of Consciousness,2013-01-17,article,Review,,['Books and Literature']
Anna Deavere Smith Wins Gish Prize,2013-01-17,article,News,,"['Awards, Decorations and Honors', 'Theater']"
Eyes Wide Shut,2013-01-17,article,Review,,['Books and Literature']
Red Bulls Take Midfielder in Draft,2013-01-17,article,News,,"['Draft and Recruitment (Sports)', 'Soccer']"
Crowds Gather in Turkey to Honor 3 Kurds Killed in Paris,2013-01-17,article,News,,"['Kurds', 'Funerals and Memorials', 'Murders and Attempted Murders']"
An Uneasy Turn at the G.O.P. Retreat,2013-01-17,article,News,,[]
TimesCast Politics: Gun Debate Moves to Capitol Hill,2013-01-17,article,News,,[]
"Rock, Paper, Scissors, Guitar and Sound",2013-01-17,article,Review,,"['Music', 'Guitars']"
"Irish Hostage Is ‘Safe and Free’ in Algeria, but Britons Are Told to Brace for Bad News",2013-01-17,article,News,,"['Hostages', 'Muslims and Islam']"
E*Trade Names Former Barclays Executive as New Chief,2013-01-17,article,News,,"['Appointments and Executive Changes', 'Banking and Financial Institutions']"
2 Reports on Oil Sands Paint a Dire Picture,2013-01-17,article,News,,"['Air Pollution', 'Global Warming', 'Greenhouse Gas Emissions', 'Keystone Pipeline System', 'Oil (Petroleum) and Gasoline', 'Oil Sands']"
An Evening of Finnish Pride and Germanic Brio,2013-01-17,article,Review,,"['Classical Music', 'Music']"
Intel’s Profit Falls 27% as PC Sales Drop,2013-01-17,article,News,,"['Computers and the Internet', 'Computer Chips', 'Company Reports']"
Photo Replay: Jan. 17,2013-01-17,multimedia,Slideshow,,"['Australian Open (Tennis)', 'Dog Sledding', 'Team Handball', 'Basketball', 'Abu Dhabi Golf Championship']"
"Maybe Naked, Curvy or Clumsy, and Probably Socially Unorthodox",2013-01-17,article,Review,,"['Dancing', 'American Realness Festival']"
"Meet Dave Grohl, Film Promoter",2013-01-17,article,News,,"['Movies', 'Sundance Film Festival (Park City, Utah)']"
The Past Is Haunting Them,2013-01-17,article,Review,,['Movies']
"Inquiry Questions Actions of N.B.A. Union Chief, but Finds No Criminality",2013-01-17,article,News,,"['Basketball', 'Conflicts of Interest', 'Appointments and Executive Changes']"
‘Beat Memories’,2013-01-17,multimedia,Slideshow,,"['Art', 'Photography']"
Perennial Crowd Pleasers,2013-01-17,multimedia,Slideshow,,"['Books and Literature', 'Art']"
This Year’s Jazz & Heritage Festival Leans Heavily on Pop,2013-01-17,article,News,,['Music']
Old All-Stars Who Still Dazzle the Eye,2013-01-17,article,News,,"['Art', 'Books and Literature']"
"Alejandra Villagra, Jason van Dalen",2013-01-17,article,News,,"['Weddings and Engagements', 'Mountain Climbing', 'Vows (Times Column)']"
Former Bookkeeper Accused of Stealing From Masa,2013-01-17,article,News,,"['Restaurants', 'Robberies and Thefts']"
"Test Run: Maura Magazine, an iPad Mini-Mag",2013-01-17,article,News,,"['iPad', 'Magazines', 'Mobile Applications']"
It’s as Good as Glue: Mending Shattered China,2013-01-17,article,News,,"['Art', 'ANTIQUES', 'Ceramics and Pottery', 'Textiles', 'Carpets and Rugs']"
White House Posts Videos of Children Asking Obama to Address Gun Violence,2013-01-17,article,News,,"['Gun Control', 'Newtown, Conn, Shooting (2012)']"
Will Congress Approve Obama's Gun Plan?,2013-01-17,multimedia,Video,,"['Gun Control', 'United States Politics and Government']"
A Place to Put All Those Curiosities,2013-01-17,article,Review,,"['Art', 'Collectors and Collections', 'Books and Literature']"
A New Obama Cabinet Takes Shape,2013-01-17,multimedia,Video,,['United States Politics and Government']
New Showcase for a Neglected Era,2013-01-17,article,News,,"['Art', 'High Line (NYC)']"
2014 Corvette Stingray Has Its New York Coming-Out Party,2013-01-17,article,News,,[]
Comedy Listings for Jan. 18-24,2013-01-17,article,Schedule,,['Comedy and Humor']
Movie Listings for Jan. 18-24,2013-01-17,article,Schedule,,['Movies']
The Caucus Click: Finishing Touches,2013-01-17,article,News,,[]
Bob Mizer: ‘Artifacts’,2013-01-17,article,Review,,"['Art', 'Homosexuality']"
Pop Listings for Jan. 18-24,2013-01-17,article,Schedule,,['Music']
Paul Laffoley: ‘The Boston Visionary Cell’,2013-01-17,article,Review,,['Art']
"For Such a Little Trailer, There’s a Lot Going On",2013-01-17,article,Review,,['Dancing']
George Maciunas: ‘Anything Can Substitute Art: Maciunas in SoHo’,2013-01-17,article,Review,,['Art']
Loans for Fixer-Uppers,2013-01-17,article,News,,"['Mortgages', 'Real Estate and Housing (Residential)', 'Restoration and Renovation']"
Theater Listings for Jan. 18-24,2013-01-17,article,Schedule,,['Theater']
Nathaniel Robinson: ‘Outer Air’,2013-01-17,article,Review,,['Art']
Mixing Solemn With Snappy,2013-01-17,article,Review,,['Music']
Daniel Buren: ‘Electricity Fabric Paint Paper Vinyl ...’,2013-01-17,article,Review,,['Art']
Twists and Turns in Becoming a Man: A Day in Baltimore,2013-01-17,article,Review,,['Movies']
Society Membership Proposed for Yale Club,2013-01-17,article,News,,"['Historic Buildings and Sites', 'Area Planning and Renewal']"
Fury of a Woman Scorned? Multiply That by Three,2013-01-17,article,Review,,"['Classical Music', 'Music']"
Fitness Center in a Hotel Room,2013-01-17,article,News,,"['Exercise', 'Travel and Vacations', 'Hotels and Travel Lodgings']"
Jazz Listings for Jan. 18-24,2013-01-17,article,Schedule,,"['Jazz', 'Music']"
Classical Music and Opera Listings for Jan. 18-24,2013-01-17,article,Schedule,,"['Music', 'Classical Music', 'Opera']"
Pictures of the Day: Pakistan and Elsewhere,2013-01-17,article,News,,['Photography']
Dance Listings for Jan. 18-24,2013-01-17,article,Schedule,,['Dancing']
The Spirits Are Back in Force in Brooklyn,2013-01-17,article,Review,,['Art']
Museum and Gallery Listings for Jan. 18-24,2013-01-17,article,Schedule,,"['Art', 'Museums']"
This Week’s Movies | Jan. 18,2013-01-17,multimedia,Video,,[]
Spare Times for Jan. 18-24,2013-01-17,article,Schedule,,"['Art', 'Culture (Arts)']"
Spare Times for Children for Jan. 18-24,2013-01-17,article,Schedule,,['Culture (Arts)']
"With Crowd on Their Side, Anthony and the Knicks Romp in London",2013-01-17,article,News,,['Basketball']
Minimalism Wrapped in a Mystery,2013-01-17,article,Review,,['Movies']
"Shellfire From Myanmar Enters China, Drawing a Rebuke",2013-01-17,article,News,,['Defense and Military Forces']
"City Jobs Lost in Storm Are Returning, but Unemployment Rate Is Flat",2013-01-17,article,News,,"['Hurricane Sandy (2012)', 'Labor and Jobs', 'Unemployment']"
"Today’s Scuttlebot: Writing Siri’s Lines, and Ray Kurzweil’s Future",2013-01-17,article,News,,[]
"‘Life, Death and Transformation in the Americas’",2013-01-17,multimedia,Slideshow,,['Art']
Where Dread Throbs and Little Girls Scuttle,2013-01-17,article,Review,,['Movies']
"Blackstone’s Latest Hired Help? No, Just Two Well-Dressed Visitors",2013-01-17,article,News,,"['AMUSEMENT AND THEME PARKS', 'Penguins', 'Private Equity']"
When They Hammered Out Justice in the ’60s,2013-01-17,article,Review,,"['Movies', 'Folk Music', 'Documentary Films and Programs']"
Rubio Outlines Elements of His New Immigration Plan,2013-01-17,article,News,,"['Illegal Immigrants', 'Immigration and Emigration', 'Visas']"
"The Smartphone Frontiers: India, Russia, Brazil",2013-01-17,article,News,,['Smartphones']
2 Papa Smurfs: A Reputed Wise Guy and a Reputed Wiseguy,2013-01-17,article,News,,"['Names, Personal', 'Organized Crime']"
"Barely Literate, Roma Pupils Struggle for Schooling",2013-01-17,article,Review,,"['Movies', 'Documentary Films and Programs']"
What I Love |  Dr. Fredric Brandt,2013-01-17,multimedia,Slideshow,,"['Interior Design and Furnishings', 'Real Estate and Housing (Residential)']"
A Home Convenient to Both Art and Clouds,2013-01-17,article,News,,"['Real Estate and Housing (Residential)', 'Interior Design and Furnishings']"
Norwegian Cruise Line Prices I.P.O. at $19 a share,2013-01-17,article,News,,"['Cruises', 'Initial Public Offerings']"
From Real-Life Governor to Small-Town Sheriff,2013-01-17,article,Review,,['Movies']
Inside the Lives of Somali Pirates,2013-01-17,article,Review,,"['Movies', 'Documentary Films and Programs']"
A Hacker Says Smart Grid Can Be Penetrated,2013-01-17,article,News,,['Cyberattacks and Hackers']
