headline,date,doc_type,material_type,section,keywords
BlackRock’s Profit Rose 14% in Third Quarter,2013-10-16,article,News,,['Company Reports']
A Fishing Community Recounts Evacuation Experience During Phailin,2013-10-16,article,News,,"['Cyclones', 'Evacuations and Evacuees', 'Fishing, Commercial', 'Floods']"
Earnings Jump at Bank of America,2013-10-16,article,News,,[]
Bookshelf | Where Design Comes First,2013-10-16,article,News,,[]
"Republicans Back Down, Ending Crisis Over Shutdown and Debt Limit",2013-10-16,article,News,,"['National Debt (US)', 'Patient Protection and Affordable Care Act (2010)', 'Federal Budget (US)', 'Law and Legislation', 'Shutdowns (Institutional)', 'Health Insurance and Managed Care']"
2 Top Executives Are Ousted at Troubled Brazilian Oil Firm,2013-10-16,article,News,,['Oil (Petroleum) and Gasoline']
It’s Not Easy Being Green,2013-10-16,article,Review,,['Books and Literature']
Vanishing Signs,2013-10-16,multimedia,Slideshow,,"['Signs and Signage', 'ADVERTISING AND MARKETING', 'Small Business']"
Finalists for National Book Awards Announced,2013-10-16,article,News,,"['Books and Literature', 'National Book Awards']"
Tracking ‘Privilege Signs’ as They Vanish,2013-10-16,article,News,,"['Signs and Signage', 'Small Business', 'ADVERTISING AND MARKETING', 'Collectors and Collections']"
A Regulator Cuts New Teeth on JPMorgan in ‘London Whale’ Case,2013-10-16,article,News,,"['Banking and Financial Institutions', 'Dodd-Frank Wall Street Reform and Consumer Protection Act (2010)', 'Regulation and Deregulation of Industry', 'Securities and Commodities Violations']"
Investors Cheer Deal to End Shutdown but Worry About Reruns,2013-10-16,article,News,,"['Government Bonds', 'National Debt (US)', 'Shutdowns (Institutional)', 'Stocks and Bonds', 'United States Politics and Government']"
A Web Site That Helps Shoppers Find Brick-and-Mortar Stores,2013-10-16,article,News,,"['ADVERTISING AND MARKETING', 'E-Commerce', 'Small Business']"
"The Gun Report: October 16, 2013",2013-10-16,article,News,,[]
Former Hungarian Official Charged With War Crimes in 1956 Uprising,2013-10-16,article,Brief,,"['War Crimes, Genocide and Crimes Against Humanity']"
Image of the Day: October 16,2013-10-16,article,News,,[]
A Default Play Appears Too Risky for Hedge Funds,2013-10-16,article,News,,[]
"After Talks on Iran’s Nuclear Program, Officials Highlight the Positive",2013-10-16,article,News,,"['Nuclear Weapons', 'Embargoes and Economic Sanctions', 'United States International Relations']"
Improving School Lunch by Design,2013-10-16,article,News,,"['Children and Childhood', 'Diet and Nutrition', 'Education (K-12)', 'Food']"
Sampling New York’s Musical Buffet,2013-10-16,article,Question,,"['Travel and Vacations', 'Music']"
"In a Florence Neighborhood, a Personal Touch",2013-10-16,article,News,,"['Travel and Vacations', 'Shopping and Retail']"
"Amtrak: Not a Money Pit, After All",2013-10-16,article,News,,['Hurricane Sandy (2012)']
Player Ratings: United States (3) vs. Panama (2),2013-10-16,article,News,,['Soccer']
Avalanche Kills Four Near Everest,2013-10-16,article,Brief,,"['Avalanches', 'Camps and Camping', 'Deaths (Fatalities)']"
Real Estate in Northern Ireland,2013-10-16,multimedia,Slideshow,,['Real Estate and Housing (Residential)']
House Hunting in ... Northern Ireland,2013-10-16,article,News,,['Real Estate and Housing (Residential)']
"Advice About Assisted Living for Aging Relatives, Part 1",2013-10-16,article,Question,,"['Elder Care', 'Nursing Homes', 'Retirement Communities and Assisted Living', 'Baby Boomers', ""Alzheimer's Disease"", 'Home Health Care', 'Group Homes', 'Dementia']"
Tips on Talking to and Tapping Potential Investors ,2013-10-16,article,News,,"['Venture Capital', 'Entrepreneurship', 'Start-ups', 'Small Business']"
"Homes for $600,000",2013-10-16,multimedia,Slideshow,,['Real Estate and Housing (Residential)']
"What You Get for... $600,000",2013-10-16,article,News,,['Real Estate and Housing (Residential)']
Fallacies of Immaculate Causation,2013-10-16,article,News,,[]
"Catching, and Releasing, Monarchs as They Flutter Down to Mexico",2013-10-16,article,News,,['Butterflies and Moths']
Plane Crash in Laos Kills 49,2013-10-16,article,News,,"['Aviation Accidents and Safety', 'Deaths (Fatalities)']"
In Our Pages: October 17,2013-10-16,article,News,,['Opera']
App Smart: Managing Your Passwords,2013-10-16,multimedia,Video,,"['Mobile Applications', 'Computer Security', 'Android (Operating System)']"
Britain Starts Formal Inquiry of Currency Trading,2013-10-16,article,News,,[]
Prize-Laden Cast Is Set for ‘Realistic Joneses’ on Broadway,2013-10-16,article,News,,['Theater']
"In the Senate, All Eyes on Cruz",2013-10-16,article,News,,['United States Politics and Government']
The Backfire Effect,2013-10-16,article,News,,[]
Apps to Protect Your Array of Passwords,2013-10-16,article,News,,"['Computer Security', 'Mobile Applications']"
House Republicans Consider Their Options,2013-10-16,article,News,,[]
"For South Carolina Senator, a House Vote Would Have Been Different",2013-10-16,article,News,,['United States Politics and Government']
Dutch Cable Company Rejects Liberty Global’s Buyout Offer,2013-10-16,article,News,,"['Cable Television', 'Mergers, Acquisitions and Divestitures']"
Jazz & Colors Returns to Central Park,2013-10-16,article,News,,['Jazz']
"CMJ, Day 1",2013-10-16,multimedia,Slideshow,,[]
Observing Grizzlies at a Canadian Resort,2013-10-16,article,News,,"['Bears', 'Travel and Vacations']"
CMJ: Seesawing Between the Past and a Forward-Looking Present,2013-10-16,article,News,,['Music']
"Warren Buffett on Driving Violations, Baseball and Jamie Dimon",2013-10-16,article,News,,['Securities and Commodities Violations']
Cruz Won’t Block Senate Deal,2013-10-16,article,News,,['United States Politics and Government']
Senate Leaders Announce Deal,2013-10-16,article,News,,[]
Hunting the Perfect Logo,2013-10-16,multimedia,Slideshow,,[]
Share Your Emergency Room Experience,2013-10-16,article,News,,[]
"Remaking Tavern on the Green, One Fork at a Time",2013-10-16,article,News,,['Restaurants']
The Octopus That Almost Ate Seattle,2013-10-16,article,News,,"['Octopus', 'Local Food', 'Restaurants']"
Some Republicans Question Cost of Outcome,2013-10-16,article,News,,['United States Politics and Government']
White House Supports Deal and Urges Quick Passage,2013-10-16,article,News,,[]
"When Nets Salute Kidd, Thorn Should Receive an Assist",2013-10-16,article,News,,['Basketball']
Is the Right Winning?,2013-10-16,article,News,,[]
"Nazis, the American Revolution and 9/11",2013-10-16,article,News,,[]
Mitch McConnell on Fiscal Deal,2013-10-16,multimedia,Video,,"['Shutdowns (Institutional)', 'United States Politics and Government']"
"Rowing With Esther Lofgren, Olympian",2013-10-16,multimedia,Video,,['Rowing']
"The Workout: Rowing With Esther Lofgren, Olympian",2013-10-16,article,News,,['Rowing']
"Gridlock Has Cost U.S. Billions, and the Meter Is Still Running",2013-10-16,article,News,,"['United States Economy', 'United States Politics and Government', 'Shutdowns (Institutional)', 'National Debt (US)', 'Federal Budget (US)']"
Anatomy of a Scene | 12 Years a Slave,2013-10-16,multimedia,Video,,['Movies']
"Black Marks Routinely Expunged From Brokers’ Records, Report Finds",2013-10-16,article,News,,"['ARBITRATION, CONCILIATION AND MEDIATION', 'Financial Brokers', 'Regulation and Deregulation of Industry', 'Suits and Litigation (Civil)']"
Paper That Backed Cruz for Senate Now Wishes He Weren’t There,2013-10-16,article,News,,['United States Politics and Government']
T FALL DESIGN,2013-10-16,multimedia,Interactive Feature,,[]
"Private Stock, Paying Hard to Get",2013-10-16,article,News,,"['Fashion and Apparel', 'Luxury Goods and Services', 'Shopping and Retail']"
"Chris Kittrell, Frontman for the Band Baby Alpaca",2013-10-16,article,News,,"['Music', 'Fashion and Apparel']"
Is It Harder to Pitch a Professional or a Family Member?,2013-10-16,article,News,,"['Small Business', 'Venture Capital']"
Anatomy of a Scene: Video of ‘12 Years a Slave’,2013-10-16,article,News,,['Slavery']
Hill & Dale: Lounge on Lower East Side,2013-10-16,article,News,,['Bars and Nightclubs']
A Splashy Art Party at Philip Johnson’s Glass House,2013-10-16,article,News,,['Historic Buildings and Sites']
Suicide Bomber in Pakistan Kills a Provincial Official,2013-10-16,article,News,,"['Terrorism', 'Assassinations and Attempted Assassinations']"
Greece’s Parliament Clears Way for More Charges Against 6 Right-Wing Lawmakers,2013-10-16,article,News,,"['Legislatures and Parliaments', 'Murders and Attempted Murders', 'Assaults', 'Fringe Groups and Movements']"
Reid Thanks GOP Leader for Cooperation,2013-10-16,multimedia,Video,,"['Shutdowns (Institutional)', 'United States Politics and Government']"
Acrostic,2013-10-16,multimedia,Interactive Feature,,"['Acrostic Puzzles', 'Crossword Puzzles']"
Cruz Says He Won’t Block Shutdown Deal,2013-10-16,multimedia,Video,,"['Shutdowns (Institutional)', 'United States Politics and Government']"
Sum Worth More Than the Parts in Advance Auto Deal,2013-10-16,article,News,,[]
Awards,2013-10-16,article,News,,[]
"Senate to Act First, Followed by House",2013-10-16,article,News,,"['Law and Legislation', 'United States Politics and Government']"
"On E.U. Carbon Emissions Rule, First the Announcement, Then the Uproar",2013-10-16,article,News,,"['Automobiles', 'Carbon Dioxide', 'Environment', 'Fuel Efficiency', 'Greenhouse Gas Emissions']"
Dollhouse Made Them Do It,2013-10-16,article,News,,['Real Estate and Housing (Residential)']
Helpless and Contemptible,2013-10-16,article,News,,['United States Politics and Government']
Acrostic Answer,2013-10-16,multimedia,Interactive Feature,,"['Acrostic Puzzles', 'Crossword Puzzles']"
"House Conservatives Blame Moderates, Not Boehner",2013-10-16,article,News,,[]
Judge Rejects Suit to Block Vote on Casinos,2013-10-16,article,News,,"['Casinos', 'Referendums', 'Constitutional Amendments', 'Suits and Litigation (Civil)', 'Gambling']"
Wheelies: The Take a Deep Breath Edition,2013-10-16,article,News,,"['APNEA (SLEEP DISORDER)', 'Automobile Safety Features and Defects', 'Automobiles']"
Christie Flips on an Immigration Bill,2013-10-16,article,News,,['Immigration and Emigration']
The Government’s Coming Shortfall,2013-10-16,multimedia,Interactive Feature,,['National Debt (US)']
América Móvil Drops Bid for KPN,2013-10-16,article,News,,[]
"In Thailand, Redefining the Tastes of Childhood",2013-10-16,article,News,,"['Children and Childhood', 'Cooking and Cookbooks', 'Food', 'Parenting', 'Thai Food (Cuisine)']"
The Art and Craft of ‘Privilege Signs’,2013-10-16,multimedia,Interactive Feature,,[]
The Coca-Cola Goldline Program,2013-10-16,multimedia,Interactive Feature,,[]
"Max Irons: Out of Character, but in His Element",2013-10-16,article,News,,"['ACTORS AND ACTRESSES', 'Television']"
'Can't Go Back',2013-10-16,multimedia,Video,,[]
Original Review: ‘Fiddler on the Roof’,2013-10-16,multimedia,Interactive Feature,,['Theater']
Knight Capital to Pay $12 Million Fine on Trading Violations,2013-10-16,article,News,,"['Fines (Penalties)', 'High-Frequency and Flash Trading', 'Nasdaq Composite Index', 'Securities and Commodities Violations', 'Whistle-Blowers']"
"On the Verge | Trousdale, Los Angeles’s Forgotten Architectural Mecca, Makes a Comeback",2013-10-16,article,News,,"['ARCHITECTURE', 'Real Estate and Housing (Residential)']"
New York Guitar Festival to Return in January,2013-10-16,article,News,,[]
"Boehner Supports Deal, but Says G.O.P. ‘Fight Will Continue’",2013-10-16,article,News,,"['Patient Protection and Affordable Care Act (2010)', 'United States Politics and Government']"
Facebook Eases Privacy Rules for Teenagers,2013-10-16,article,News,,"['Privacy', 'Teenagers and Adolescence', 'ADVERTISING AND MARKETING']"
Even a Doomed Queen Just Wants to Have Fun,2013-10-16,article,Review,,['Television']
The Golden Years of Tavern on the Green,2013-10-16,article,News,,['Restaurants']
Cyrus’s ‘Bangerz’ Hits No. 1,2013-10-16,article,News,,['Music']
Jury Rules for Mark Cuban in Setback for S.E.C.,2013-10-16,article,News,,"['Insider Trading', 'Stocks and Bonds']"
"At the New York Premiere of ‘Her,’ a Party Makes Do Without Its Voice",2013-10-16,article,News,,"['Movies', 'New York Film Festival', 'Parties (Social)']"
A Lesson in Time Management for a Wagner Coach,2013-10-16,article,News,,"['Basketball (College)', 'Coaches and Managers', 'Education (K-12)']"
Gadgets to Help the Party Host,2013-10-16,article,News,,"['Parties (Social)', 'Home Appliances', 'Robots and Robotics']"
Life on Ships That Make World Go Round,2013-10-16,article,Review,,"['Ships and Shipping', 'Books and Literature']"
Times Reporter Plans to Take Fight to the Supreme Court,2013-10-16,article,News,,['Freedom of the Press']
How to Get Your Last Name Posted After You Win a Learning Network Student Contest,2013-10-16,article,News,,[]
On Glowing Pickles and Undiscovered Galaxies: Student STEM Contest Winners,2013-10-16,article,News,,[]
An Assassin Abroad: Peter Savodnik Talks About ‘The Interloper’,2013-10-16,article,News,,['Books and Literature']
Robert Rauschenberg and Photography,2013-10-16,multimedia,Slideshow,,"['Art', 'Photography']"
Taking Flight Without Taking Off,2013-10-16,article,News,,"['Pilots', 'Travel and Vacations']"
"Aggression Unleashed, and Moderated Too, in Pumped-Up Touring Return",2013-10-16,article,Review,,['Music']
A ‘Wild’ Book Tour With a Soundtrack,2013-10-16,article,News,,"['ARCTIC NATIONAL WILDLIFE REFUGE', 'Books and Literature', 'Endangered and Extinct Species', 'Environment', 'Hunting and Trapping', 'Polar Bears', 'Turtles and Tortoises', 'Wildlife Sanctuaries']"
Pictures of the Day: Washington and Elsewhere,2013-10-16,article,News,,['Photography']
Case Pits Freezing Assets Against Hiring Lawyers,2013-10-16,article,News,,"['Crime and Criminals', 'Legal Profession', 'Search and Seizure', 'Assets, Frozen']"
110 Seconds With Pogue: Windows 8.1,2013-10-16,multimedia,Video,,"['Windows (Operating System)', 'Tablet Computers', 'Computers and the Internet']"
Ronan Farrow to Host Show on MSNBC,2013-10-16,article,News,,"['News and News Media', 'Cable Television']"
Reconciling 2 Worlds With Windows 8.1,2013-10-16,article,News,,"['Windows (Operating System)', 'Desktop Computers', 'Tablet Computers']"
House Republicans Gearing Up for Round 2,2013-10-16,article,News,,"['Patient Protection and Affordable Care Act (2010)', 'United States Politics and Government']"
"Roundup at the Chelsea Hall, With Flinging, Stumbling, Collapsing",2013-10-16,article,Review,,['Dancing']
Rhapsody in Deal to Expand in Latin America,2013-10-16,article,News,,"['Music', 'Computers and the Internet']"
"Forget the Spoonful of Sugar: It’s Uncle Walt, Uncensored",2013-10-16,article,News,,['Movies']
Be as Creative as a Kindergartner,2013-10-16,article,News,,"['Computers and the Internet', 'Creativity', 'Hats and Caps']"
Milder Accounts of Hardships Under Mao Arise as His Birthday Nears,2013-10-16,article,News,,"['Famine', 'Deaths (Fatalities)']"
Muscle and Speed Win a Crowd’s Adulation,2013-10-16,article,Review,,"['Music', 'Classical Music']"
Urban Living,2013-10-16,multimedia,Slideshow,,['Area Planning and Renewal']
States Report Health Insurance Application Numbers,2013-10-16,article,News,,[]
Reflections on a Couple of Boston Homers,2013-10-16,article,News,,[]
An Artist Who Gets a Lift From Gravity,2013-10-16,article,News,,[]
Building a Better City,2013-10-16,article,News,,"['Area Planning and Renewal', 'Elections, Mayors']"
A Computer Championship in Indonesia,2013-10-16,article,News,,"['Cards and Card Games', 'Bridge (Card Game)', 'Computers and the Internet']"
Making Opera of Art and Vice Versa,2013-10-16,article,News,,"['Opera', 'Classical Music', 'Art']"
One Met Isn’t Enough,2013-10-16,article,News,,['Art']
"Today’s Scuttlebot: Shutdown Dysfunction, and Smile, You’re Being Tracked",2013-10-16,article,News,,[]
"Thierry-Maxime Loriot, Curator of the Jean Paul Gaultier Exhibition",2013-10-16,article,News,,"['Fashion and Apparel', 'Art', 'Museums']"
Kim Kardashian’s Ex Sells the Engagement Ring,2013-10-16,article,News,,"['Auctions', 'Reality Television', 'Jewels and Jewelry']"
New York Department Stores Revamp Cosmetics and Fragrance Sections,2013-10-16,article,News,,"['Cosmetics and Toiletries', 'Perfumes and Fragrances']"
Furor Over Yahoo Mail Changes,2013-10-16,article,News,,['E-Mail']
Columbia to House a Trove of Prokofiev’s Items,2013-10-16,article,News,,"['Classical Music', 'Archives and Records', 'Music', 'Colleges and Universities']"
"Two Longtime Gossip Columnists Share Their Secrets (Well, Some of Them)",2013-10-16,article,News,,"['Newspapers', 'Gossip', 'Books and Literature']"
A Line of Luxe Basics Made for Dancing,2013-10-16,article,News,,['Fashion and Apparel']
Settlement Report Finds Banks Giving Timely Mortgage Relief,2013-10-16,article,News,,"['Mortgages', 'Banking and Financial Institutions', 'Foreclosures', 'Real Estate and Housing (Residential)', 'Credit and Debt', 'Subprime Mortgage Crisis']"
"Lifted From a Russian Lake, a Big, if Fragile, Space Rock",2013-10-16,article,News,,"['Meteors and Meteorites', 'Space and Astronomy']"
"After Decades, a Water Tunnel Can Now Serve All of Manhattan",2013-10-16,article,News,,"['Water', 'Infrastructure (Public Works)']"
Beauty Is Its Own Excuse,2013-10-16,multimedia,Slideshow,,['Collectors and Collections']
Wine Accessories,2013-10-16,multimedia,Slideshow,,"['Shopping and Retail', 'Wines']"
When the Saint Came Marching In,2013-10-16,article,News,,['Collectors and Collections']
Wine Accessories: Palette Pleasers,2013-10-16,article,News,,"['Wines', 'ARCHITECTURE', 'Tableware']"
"Discounts at Jonathan Adler, Garnet Hill and Others",2013-10-16,article,News,,"['Pillows', 'Furniture', 'Glassware', 'Interior Design and Furnishings']"
Waltzing With the Stars,2013-10-16,article,News,,"['Shopping and Retail', 'Interior Design and Furnishings']"
Don’t Try This in Yoga Class,2013-10-16,article,News,,"['Light-Emitting Diodes', 'Lamps and Lampshades']"
"If You Could Make It There, You Were Made",2013-10-16,article,News,,"['Real Estate and Housing (Residential)', 'Historic Buildings and Sites']"
Bonnie Prints,2013-10-16,article,News,,"['Interior Design and Furnishings', 'Wallpaper']"
Chip Kidd: Start Making Sense,2013-10-16,article,Question,,"['Books and Literature', 'Children and Childhood', 'Design']"
The Renovation Was Overdue,2013-10-16,multimedia,Slideshow,,"['Interior Design and Furnishings', 'Real Estate and Housing (Residential)']"
Putting Their Stamp on It,2013-10-16,article,News,,"['Interior Design and Furnishings', 'Real Estate and Housing (Residential)', 'Restoration and Renovation']"
"China, Spitting and Global Tourism",2013-10-16,article,News,,['Social Conditions and Trends']
The Armani Experience,2013-10-16,article,News,,"['Fashion and Apparel', 'Design']"
"Scattered by War, Syrians Struggle to Start Over",2013-10-16,article,News,,"['Refugees and Displaced Persons', 'Middle East and North Africa Unrest (2010- )']"
The Historic Scale of Syria’s Refugee Crisis,2013-10-16,multimedia,Interactive Feature,,"['Refugees and Displaced Persons', 'Middle East and North Africa Unrest (2010- )']"
The Cost of Gridlock,2013-10-16,multimedia,Interactive Feature,,"['Gross Domestic Product', 'Politics and Government']"
A Prairie of the Imagination,2013-10-16,multimedia,Slideshow,,"['Flowers and Plants', 'Gardens and Gardening']"
The Good-for-Nothing Garden,2013-10-16,article,News,,"['Gardens and Gardening', 'Flowers and Plants']"
Designer Wine Accessories,2013-10-16,multimedia,Video,,['Wines']
"To Get Through His Day, These Soothe His Ears",2013-10-16,article,List,,['Music']
"Theater, Dance, Film, Pop: Don’t Pin Him Down",2013-10-16,article,News,,"['Culture (Arts)', 'Music']"
‘Two Boys’ and One Composer,2013-10-16,article,News,,['Opera']
In Performance: Nico Muhly,2013-10-16,multimedia,Video,,['Opera']
James Golden’s Picks,2013-10-16,article,News,,[]
When the Gold Dust Settles,2013-10-16,article,Review,,"['Books and Literature', 'Man Booker Prize']"
Cameron Criticizes The Guardian for Publishing Secrets,2013-10-16,article,News,,"['Surveillance of Citizens by Government', 'Classified Information and State Secrets']"
"Finally Back in the East, the Rangers Seem at Home",2013-10-16,article,News,,"['Hockey, Ice']"
Shopping Events in New York Beginning Oct. 17,2013-10-16,article,News,,"['Fashion and Apparel', 'Shopping and Retail']"
Flying Close to the Law,2013-10-16,multimedia,Video,,"['Art', 'Pigeons']"
"Avian Artistry, With Smuggled Cigars",2013-10-16,article,News,,"['Pigeons', 'Art', 'Smuggling']"
Massachusetts: Bomb Suspects’ Sister in Court,2013-10-16,article,Brief,,"['Boston Marathon Bombings (2013)', 'Counterfeit Money and Financial Instruments']"
Iran's Nuclear Talks in Geneva,2013-10-16,multimedia,Video,,"['Nuclear Weapons', 'Embargoes and Economic Sanctions']"
Massachusetts Schools Dial Back on Obesity Reports,2013-10-16,article,Brief,,"['Obesity', 'Education (K-12)']"
Man Gets 30-Year Sentence for Raping Bird-Watcher in Central Park,2013-10-16,article,News,,"['Sex Crimes', 'Sentences (Criminal)']"
"In Greece, the Banking Chief Draws Scrutiny",2013-10-16,article,News,,"['Banking and Financial Institutions', 'Regulation and Deregulation of Industry', 'European Sovereign Debt Crisis (2010- )']"
Body of Nazi War Criminal Moved to Airport in Rome After Clashes,2013-10-17,article,News,,"['Demonstrations, Protests, and Riots', 'Holocaust and the Nazi Era', 'War Crimes, Genocide and Crimes Against Humanity']"
British Police on Defensive Over Downing Street Clash,2013-10-17,article,News,,"['Police Brutality, Misconduct and Shootings', 'Video Recordings and Downloads']"
Senate Passes Measure to End Fiscal Impasse,2013-10-17,article,News,,[]
"Maxine Powell, Motown’s Maven of Style, Dies at 98",2013-10-17,article,Obituary (Obit),,"['Music', 'Deaths (Obituaries)']"
An Activist Investor Is Urging Darden to Break Itself Up,2013-10-17,article,News,,['Real Estate Investment Trusts']
Ex-Coach Says Greatness Remains Within Federer’s Reach,2013-10-17,article,News,,['Tennis']
World Trade Center Contractor Is Said to Be Focus of Inquiry Into Misuse of Funds,2013-10-17,article,News,,"['World Trade Center (Manhattan, NY)', 'Frauds and Swindling', '1 World Trade Center (Manhattan, NY)']"
"In New Book, Cheney Recalls 5 Heart Attacks and His Brush With Death",2013-10-17,article,News,,"['Books and Literature', 'Heart', 'United States Politics and Government']"
"Thin at Running Back, the Giants Sign Hillis",2013-10-17,article,News,,['Football']
"Larry Benoit, ‘Babe Ruth for Hunters,’ Is Dead at 89",2013-10-17,article,Obituary (Obit),,"['Deer', 'Deaths (Obituaries)', 'Hunting and Trapping']"
Obama Addresses Deal to End Fiscal Dispute,2013-10-17,article,News,,[]
Assault of Dutch Diplomat in Moscow Frays Ties Between Russia and the Netherlands,2013-10-17,article,News,,"['Assaults', 'Diplomatic Service, Embassies and Consulates', 'International Relations']"
Hugh White on ‘The China Choice’,2013-10-17,article,News,,"['Defense and Military Forces', 'United States International Relations']"
Stumbling Blocks in Reducing Balance on a Student Loan,2013-10-17,article,News,,"['Student Loans', 'Interest Rates', 'Credit and Debt']"
Ending the Shutdown,2013-10-17,multimedia,Slideshow,,"['Federal Budget (US)', 'Shutdowns (Institutional)', 'United States Politics and Government']"
Case Against Michigan Ban on Gay Unions Is Sent to Trial,2013-10-17,article,News,,"['Same-Sex Marriage, Civil Unions and Domestic Partnerships']"
De Blasio Lashes Out at Lhota Over a Television Ad,2013-10-17,article,News,,"['Political Advertising', 'Elections, Mayors', 'Debates (Political)']"
Dodgers Get Out of Jam and Back Into Series,2013-10-17,article,News,,['Baseball']
Sebelius Stands Firm Despite Calls to Resign,2013-10-17,article,News,,"['Patient Protection and Affordable Care Act (2010)', 'Health Insurance and Managed Care', 'United States Politics and Government']"
Second Thoughts on Voter ID,2013-10-17,article,Editorial,,"['Voter Registration and Requirements', 'Voting and Voters', 'Minorities', 'Editorials']"
The Disappearing Moose,2013-10-17,article,Editorial,,"['Moose', 'Global Warming', 'Editorials']"
Europe Cracks Down on Tobacco,2013-10-17,article,Editorial,,"['Smoking and Tobacco', 'Labeling and Labels', 'Law and Legislation', 'Menthol', 'Regulation and Deregulation of Industry', 'Editorials']"
The Republican Surrender,2013-10-17,article,Editorial,,"['Federal Budget (US)', 'Patient Protection and Affordable Care Act (2010)', 'National Debt (US)', 'Shutdowns (Institutional)', 'United States Politics and Government', 'Editorials']"
Photography in Service to Humanity,2013-10-17,article,News,,"['Awards, Decorations and Honors', 'Photography']"
Effort to Evacuate Syrian Civilians Is Thwarted by Shelling,2013-10-17,article,News,,"['Evacuations and Evacuees', 'Civilian Casualties', 'Deaths (Fatalities)', 'Defense and Military Forces', 'Middle East and North Africa Unrest (2010- )']"
A Tree Grows in Canada,2013-10-17,article,Op-Ed,,"['Constitutions', 'Women and Girls', 'Voting Rights Act (1965)', 'Defense of Marriage Act (1996)']"
Republican Collapse,2013-10-17,article,Op-Ed,,"['United States Politics and Government', 'Polls and Public Opinion', 'Shutdowns (Institutional)', 'National Debt (US)', 'Federal Budget (US)']"
This Is Your Brain on Toxins,2013-10-17,article,Op-Ed,,"['Hazardous and Toxic Substances', 'Children and Childhood', 'Lead', 'Regulation and Deregulation of Industry', 'Hormones', 'Poisoning and Poisons']"
"At Brooklyn’s Domino Sugar Site, Waning Opposition to Prospect of Luxury Towers",2013-10-17,article,News,,"['Real Estate and Housing (Residential)', 'Historic Buildings and Sites']"
