headline,date,doc_type,material_type,section,keywords
Hispanics in East Haven Are Wary of Kinder Tone,2013-01-24,article,News,,"['Racial Profiling', 'Hispanic-Americans', 'Police', 'Race and Ethnicity', 'Police Brutality and Misconduct']"
A Howard Trade Rumor? The Nets’ Lopez Has Heard It All Before,2013-01-24,article,News,,['Basketball']
‘Broccoli Again?’,2013-01-24,article,News,,['Crossword Puzzles']
"Corrections: January 24, 2013",2013-01-24,article,Correction,,[]
"Cleared of One ’95 Murder, 3 Men Have Conviction Vacated in a 2nd ",2013-01-24,article,News,,"['False Arrests, Convictions and Imprisonments', 'Murders and Attempted Murders']"
"A Debt Crisis Averted, for Now",2013-01-24,article,Editorial,,"['Federal Budget (US)', 'National Debt (US)', 'Editorials']"
Lottery Numbers,2013-01-24,article,List,,['Lotteries']
Syracuse’s Democratic Mayor Gets Under Governor’s Skin,2013-01-24,article,News,,"['Local Government', 'Budgets and Budgeting']"
Air Force Leaders Testify on Culture That Led to Sexual Assaults of Recruits,2013-01-24,article,News,,"['Sex Crimes', 'Women and Girls', 'Sexual Harassment', 'United States Defense and Military Forces']"
An M.T.A. Hearing Asks: Is Everyone O.K. With This Service Increase? ,2013-01-24,article,News,,"['Transit Systems', 'Railroads', 'Stations and Terminals (Passenger)']"
Anthony Shoots More as Knicks Win Less,2013-01-24,article,News,,['Basketball']
"His Conviction Overturned, Man Is Let Out of Prison After 23 Years",2013-01-24,article,News,,"['Decisions and Verdicts', 'Murders and Attempted Murders', 'False Arrests, Convictions and Imprisonments']"
Cameron’s Speech a Gamble for Tories as Much as for Europe,2013-01-24,article,News,,['European Sovereign Debt Crisis (2010- )']
Egypt: Polio Virus Is Found in Cairo’s Sewers,2013-01-24,article,Brief,,"['Poliomyelitis', 'Vaccination and Immunization']"
Venezuela: Officials Say Plot Targeted Vice President,2013-01-24,article,Brief,,['Assassinations and Attempted Assassinations']
A Mulligan by Mickelson on Tax Talk,2013-01-24,article,News,,"['Taxation', 'Golf']"
Rockets’ White Says He’s Close to Returning,2013-01-24,article,News,,['Basketball']
Tracking Battery Problems,2013-01-24,multimedia,Interactive Feature,,"['Aviation Accidents and Safety', 'Batteries', 'Lithium (Metal)']"
China: Former Powerful Official Hires Lawyers,2013-01-24,article,News,,['Murders and Attempted Murders']
Cardinal Jozef Glemp of Poland Is Dead at 83,2013-01-24,article,Obituary (Obit),,"['Cardinals (Roman Catholic Prelates)', 'Deaths (Obituaries)', 'ANTI-SEMITISM']"
Lopez Continues All-Star-Caliber Season as the Nets Keep Winning,2013-01-24,article,News,,['Basketball']
Japanese Trade Deficit Was $78 Billion in 2012,2013-01-24,article,News,,"['International Trade and World Market', 'Economic Conditions and Trends']"
Gaborik’s Big Night Finally Does Trick,2013-01-24,article,News,,"['Hockey, Ice']"
Word of the Day | anonymity,2013-01-24,article,News,,[]
"To Raise Graduation Rate, Colleges Are Urged to Help a Changing Student Body",2013-01-24,article,News,,"['Colleges and Universities', 'Graduation Rates', 'Labor and Jobs']"
N.A.A.C.P. in Support of Soda Industry,2013-01-24,multimedia,Interactive Feature,,"['Soft Drinks', 'Suits and Litigation']"
Azarenka to Meet Li in Women’s Final,2013-01-24,article,News,,"['Australian Open (Tennis)', 'Tennis']"
"Klinsmann Explains, and Keeps Explaining, His Use of ’24/7’",2013-01-24,article,News,,['Soccer']
What’s On Thursday,2013-01-24,article,Schedule,,[]
Cat Rescues in China Raise Host of New Questions,2013-01-24,article,News,,"['Birds', 'Cats', 'Cruelty to Animals', 'Roads and Traffic', 'Traffic Accidents and Safety']"
North Korea Issues Blunt New Threat to United States,2013-01-24,article,News,,"['Nuclear Tests', 'Nuclear Weapons', 'International Relations']"
"News Quiz | January 24, 2013",2013-01-24,article,News,,[]
Paris Opera Ballet Picks Outsider for New Director,2013-01-24,article,News,,['Dancing']
What Made ‘Dabangg 2’ a Hit?,2013-01-24,article,News,,"['ACTORS AND ACTRESSES', 'Movies', 'Muslims and Islam']"
IHT Quick Read: Jan. 24,2013-01-24,article,News,,[]
"Test Yourself | English, Jan. 24, 2013",2013-01-24,article,News,,[]
Florida’s Python Hunting Contest,2013-01-24,article,News,,[]
A Conversation With: Bar Council of India Chairman Manan Kumar Mishra,2013-01-24,article,News,,"['Courts and the Judiciary', 'Crime and Criminals', 'Hiring and Promotion', 'Legal Profession', 'Sex Crimes']"
The Debt Ceiling and Playing With Fire,2013-01-24,article,News,,"['National Debt (US)', 'United States Economy', 'United States Politics and Government']"
Should Women Be Allowed to Fight on the Front Lines Alongside Men?,2013-01-24,article,News,,[]
Getting to Know You,2013-01-24,article,News,,[]
SFJazz Center Opens in California,2013-01-24,article,News,,['Jazz']
Lessons From a College Student: Finding Your Fit on Campus,2013-01-24,article,News,,"['ADMISSIONS STANDARDS', 'Colleges and Universities']"
The Early Word: On the Front,2013-01-24,article,News,,[]
"Senior Bowl’s Surprises, Polarizing Prospects and Small-School Standouts",2013-01-24,article,News,,['Football']
Britain May Quit E.U.,2013-01-24,article,Op-Ed,,['European Sovereign Debt Crisis (2010- )']
Britain’s Prime Minister Defends Decision to Seek Vote on European Union,2013-01-24,article,News,,[]
Grief Over New Depression Diagnosis,2013-01-24,article,News,,"['Depression (Mental)', 'Elderly', 'Grief (Emotion)', 'Mental Health and Disorders']"
"Commerzbank to Cut Up to 6,000 Jobs",2013-01-24,article,News,,['Layoffs and Job Reductions']
When Employees Wonder What’s Going On,2013-01-24,article,News,,"['Small Business', 'Start-ups']"
The Price of a Stolen Childhood,2013-01-24,article,News,,"['Child Pornography', 'Child Abuse and Neglect', 'Sex Crimes', 'Reparations and Restitution', 'Sentences (Criminal)']"
"Save a Tree, Use Real Cork",2013-01-24,article,News,,"['Cork', 'Forests and Forestry']"
Does the Concept of Forgiveness Have a Place in the Courtroom?,2013-01-24,article,News,,['Sentences (Criminal)']
Bad Education,2013-01-24,article,News,,"['Economic Conditions and Trends', 'Education (K-12)', 'Private and Sectarian Schools']"
Rocky Balboa and Ranking Joe Flacco,2013-01-24,article,News,,"['Football', 'Super Bowl']"
Wanelo: Social Commerce Site Is Big With Young Shoppers,2013-01-24,article,News,,"['E-Commerce', 'Shopping and Retail']"
Opinion Report: Yair Lapid,2013-01-24,article,News,,[]
Sternlicht’s Starwood to Buy Distressed Debt Manager for $1.05 Billion,2013-01-24,article,News,,[]
Republican Governors Open New Front in Tax Debate,2013-01-24,article,News,,"['Corporate Taxes', 'Federal Taxes (US)', 'Governors (US)', 'Income Tax', 'Sales and Excise Taxes', 'States (US)']"
Daily Report: Apple’s Stock Drops Despite Huge Profit,2013-01-24,article,News,,[]
Old Technology Modernizes a Camera Sensor,2013-01-24,article,News,,"['Cameras', 'Photography', 'Sensors']"
Inside A.I.G.’s Decision Not to Sue,2013-01-24,article,News,,[]
India Rape Trial Starts With Renewed Ban on Media Coverage,2013-01-24,article,News,,"['Juvenile Delinquency', 'Murders and Attempted Murders', 'Sex Crimes', 'Women and Girls']"
"The Breakfast Meeting: Assange Assails ‘Propaganda’ Film, and Netflix Surges",2013-01-24,article,News,,['Reality Television']
A Memorable Concert,2013-01-24,article,News,,"['Music', 'Taxicabs and Taxicab Drivers']"
"Directors Favored, Directors Snubbed: What’s Going On?",2013-01-24,article,News,,"['Movies', 'Academy Awards (Oscars)']"
Photos of The Moment | Bouchra Jarrar,2013-01-24,article,News,,"['Couture (Fashion)', 'Fashion and Apparel', 'Photography']"
A Signal to Wall Street In Obama’s Pick For Regulators,2013-01-24,article,News,,"['Appointments and Executive Changes', 'Regulation and Deregulation of Industry', 'United States Politics and Government']"
Thursday Reading: Revised Rules for Depression Diagnoses,2013-01-24,article,News,,[]
Denying American Scots Their Holiday Haggis,2013-01-24,article,News,,['Cooking and Cookbooks']
An Insurance Company With an Army,2013-01-24,article,News,,[]
Supernatural Tales: Manuel Gonzales Talks About ‘The Miniature Wife’,2013-01-24,article,News,,"['Books and Literature', 'Writing and Writers']"
Kaepernick Fans Can Now Look the Part,2013-01-24,article,News,,"['Super Bowl', 'Tattoos']"
Alan Blinder on the Lessons of the Financial Crisis,2013-01-24,article,News,,"['Books and Literature', 'Economics (Theory and Philosophy)']"
Adele Joins the Ranks of Tom Jones and a-ha,2013-01-24,article,News,,['Academy Awards (Oscars)']
Suspect in Killing Escapes Police Station in Brooklyn,2013-01-24,article,News,,"['Police', 'Murders and Attempted Murders', 'Prison Escapes']"
What We’re Reading,2013-01-24,article,News,,[]
Alain de Botton: By the Book,2013-01-24,article,Question,,"['Books and Literature', 'Writing and Writers']"
Octogenarian Opens Jaipur Lit Fest With Rousing Speech,2013-01-24,article,News,,"['Books and Literature', 'Writing and Writers']"
Video of Kerry’s Confirmation Hearing,2013-01-24,article,News,,['United States Politics and Government']
On Our Radar: Salt Lake Smog,2013-01-24,article,News,,[]
The Chávez Constitutional,2013-01-24,article,News,,"['Censorship', 'Constitutions', 'Freedom of the Press']"
Dalai Lama Stresses Science and Secularism in Jaipur,2013-01-24,article,News,,"['Buddhism', 'Religion and Belief']"
Living With Cancer: The Good Patient Syndrome,2013-01-24,article,News,,"['Doctors', 'Medicine and Health']"
Nokia Reports Profit but Fails to Soothe Investors,2013-01-24,article,News,,"['Company Reports', 'Cellular Telephones', 'Telephones and Telecommunications']"
U.S. and 3 European Countries Warn That Westerners Are Facing Threats in Libya,2013-01-24,article,News,,[]
"Surprises, Slip-Ups and Questionable Strategy",2013-01-24,article,News,,"['College Athletics', 'Australian Open (Tennis)']"
"36 Hours in Marin County, Calif.",2013-01-24,article,News,,['Travel and Vacations']
"Marin County, Calif.",2013-01-24,multimedia,Slideshow,,['Travel and Vacations']
Luggage to Your Doorstep,2013-01-24,article,News,,[]
Talking Talent | Laurie Metcalf,2013-01-24,article,News,,['Theater']
The Bristol Palin Effect vs. The Roe Effect,2013-01-24,article,News,,['ABORTION']
A Slump for Japanese Sumo Wrestlers,2013-01-24,multimedia,Video,,['Sumo Wrestling']
AT&T Says U-Verse Failure Is Almost Over,2013-01-24,article,News,,"['Cable Television', 'Customer Relations']"
Pork Buns Steamed in Bluster,2013-01-24,article,Review,,"['Books and Literature', 'Race and Ethnicity', 'Food']"
"Simple, Low-Cost Surveillance Drones Provide Advantage for U.S. Military",2013-01-24,article,News,,"['Drones (Pilotless Planes)', 'Defense and Military Forces']"
Band of Sisters,2013-01-24,multimedia,Video,,"['Pentagon Building', 'United States Defense and Military Forces', 'Music', 'Skiing']"
Video: Baking With a ‘Beasts’ Star,2013-01-24,article,News,,['Movies']
Faction Splits From Islamist Group in Northern Mali,2013-01-24,article,News,,[]
Puritans vs. Cavaliers,2013-01-24,article,News,,"['Civil War (US) (1861-65)', 'Race and Ethnicity']"
Image of the Day: Jan. 24,2013-01-24,article,News,,[]
E.P.A. Directs New York to Act on Muddy Waterway,2013-01-24,article,News,,"['Reservoirs', 'Water Pollution']"
Those Cute Spies Around the Corner,2013-01-24,article,News,,['Television']
Ban Lifted on Women in Combat Roles,2013-01-24,multimedia,Video,,"['United States Defense and Military Forces', 'Women and Girls', 'United States Politics and Government']"
Design Unveiled for the National Center for Civil and Human Rights,2013-01-24,article,News,,['Museums']
The Spy Who Married Me: Keri Russell and Matthew Rhys on ‘The Americans’,2013-01-24,article,News,,['Television']
Kerry Links Economics to Foreign Policy,2013-01-24,article,News,,"['United States International Relations', 'United States Politics and Government']"
Red Bulls Name Petke Coach,2013-01-24,article,News,,['Soccer']
Photos of The Moment | Maison Martin Margiela,2013-01-24,article,News,,"['Couture (Fashion)', 'Fashion and Apparel', 'Photography']"
The Personal Side of a Presidential Election,2013-01-24,article,News,,"['Presidential Election of 2012', 'Sleep']"
The Drawn Out Process of the Medical Lawsuit,2013-01-24,article,News,,"['Doctors', 'Malpractice', 'Medicine and Health', 'Suits and Litigation']"
"Reimagining a Classic, Goo Included",2013-01-24,article,News,,['Theater']
"For Investors, Apple Not as Shiny",2013-01-24,multimedia,Video,,['Stocks and Bonds']
Surf and Turf Revisited,2013-01-24,article,News,,"['Seafood', 'Cooking and Cookbooks', 'Oysters', 'Clams', 'Mussels']"
"Carb-Loving Dogs, DNA Storage and a Pool Full of Jelly",2013-01-24,article,News,,"['DNA (Deoxyribonucleic Acid)', 'Dogs', 'Pesticides', 'Sun', 'Persian Gulf War', 'Measles', 'Birth Control and Family Planning']"
Theater Talkback: Defying Expectations Off Broadway,2013-01-24,article,News,,"['Blindness', 'Coil Festival', 'Deafness', 'Disabilities', 'Theater', 'Under the Radar Festival']"
Kissinger: Political Threats to Global Economy Abound,2013-01-24,article,News,,['Economic Conditions and Trends']
Eyes Turn to Antarctica as Study Shows Greenland’s Ice Has Endured Warmer Climates,2013-01-24,article,News,,"['Glaciers', 'Global Warming', 'Ice']"
"In Davos, Meetings Behind Closed Doors",2013-01-24,article,News,,"['Banking and Financial Institutions', 'Blogs and Blogging (Internet)']"
Hornets’ Switch to Pelicans Marks Latest Name Game,2013-01-24,article,News,,"['Basketball', 'Names, Organizational']"
White House Supports Lifting Combat Ban for Women,2013-01-24,article,News,,"['Appointments and Executive Changes', ""Women's Rights""]"
"Video: For Investors, Apple Not as Shiny",2013-01-24,article,News,,[]
Hiring Outside Advisers Is as Important as Hiring Employees,2013-01-24,article,News,,"['Hiring and Promotion', 'Small Business']"
More Marriotts in Latin America,2013-01-24,article,News,,['Travel and Vacations']
"In Doubles Final, Bryans Will Play Haase and Sijsling",2013-01-24,article,News,,[]
Bigelow on the Offensive,2013-01-24,article,News,,"['Academy Awards (Oscars)', 'Movies']"
Collateral Damage in an Adult World,2013-01-24,article,News,,"['Photography', 'Art', 'Children and Childhood']"
Children and War,2013-01-24,multimedia,Slideshow,,"['Art', 'Photography', 'War and Revolution', 'Children and Childhood']"
Jack White and Carrie Underwood Join Lineup of Grammy Performers,2013-01-24,article,News,,"['Grammy Awards', 'Music']"
Look of The Moment | Kate Bosworth,2013-01-24,article,News,,['Fashion and Apparel']
Partnership Gives Web Surfers More Than Just Images,2013-01-24,article,News,,"['ADVERTISING AND MARKETING', 'Computers and the Internet', 'Photography']"
"Boeing 787 Battery Wasn’t Overcharged, Japanese Investigators Say",2013-01-24,article,News,,"['Batteries', 'AIRLINES AND AIRPLANES', 'Accidents and Safety']"
On the Hunt for a New Mattress,2013-01-24,article,News,,"['Mattresses', 'Shopping and Retail']"
Assembly Leader Softens on Placing Casino in New York City,2013-01-24,article,News,,['Casinos']
Border Outpost,2013-01-24,multimedia,Video,,['Illegal Immigrants']
Djokovic Relentless in Defeat of Ferrer,2013-01-24,article,News,,"['Australian Open (Tennis)', 'Tennis']"
"In Desert Outposts, Border Agents Keep Watch",2013-01-24,article,News,,"['Illegal Immigrants', 'Smuggling', 'Drug Abuse and Traffic']"
"With All Votes in, Netanyahu Assesses the Damage",2013-01-24,article,News,,[]
How Cold Is It?,2013-01-24,article,News,,['Temperature']
Ask Well: Long-Term Use of Nicotine Gum,2013-01-24,article,News,,"['Chewing Gum', 'Medicine and Health', 'Nicotine']"
Confessions of a Former Ballboy,2013-01-24,article,News,,['Soccer']
How to Make Women’s Service in Combat Roles a Success,2013-01-24,article,News,,"['Gender', 'United States Defense and Military Forces', 'Women and Girls']"
Student Contest Winners | The 2012 Year in Rap,2013-01-24,article,News,,[]
A Prototype Coupe de Ville Resurfaces,2013-01-24,article,News,,"['Antique and Classic Cars', 'Automobiles']"
"Scouting Terry: Good Jump Shot, Lucky Pajamas",2013-01-24,article,News,,"['Basketball', 'Superstitions', 'Uniforms']"
A Rallying Cry for Naming All Species on Earth,2013-01-24,article,News,,"['Biodiversity', 'Research']"
Just So You Know: ‘John Dies at the End’,2013-01-24,article,News,,['Movies']
Mutations Found in Melanomas May Shed Light on How Cancers Grow,2013-01-24,article,News,,"['Genetics and Heredity', 'Melanomas', 'Tumors', 'Skin Cancer']"
The Dual Duties of the Next S.E.C. Chief,2013-01-24,article,News,,"['Appointments and Executive Changes', 'Dodd-Frank Wall Street Reform and Consumer Protection Act (2010)', 'Insider Trading', 'Regulation and Deregulation of Industry']"
Women in Combat,2013-01-24,article,News,,"['Same-Sex Marriage, Civil Unions and Domestic Partnerships']"
"In Bus Drivers’ Strike, a Windfall for Livery Cabs",2013-01-24,article,News,,"['Car Services and Livery Cabs', 'Strikes', 'Buses', 'Education (K-12)']"
Senator Unveils Bill to Limit Semiautomatic Arms,2013-01-24,article,News,,"['Gun Control', 'Law and Legislation', 'United States Politics and Government']"
Guest Lesson | Reading ‘One Today’ and Other Inaugural Poems,2013-01-24,article,News,,[]
‘Manilow on Broadway’ Opening Postponed Because of Illness,2013-01-24,article,News,,['Music']
A Soldier in a Skeleton Scarf in Mali,2013-01-24,article,News,,"['Computer and Video Games', 'Computers and the Internet', 'Defense and Military Forces', 'News and News Media', 'Photography']"
Keeping Score: Tough Conference May Keep Grizzlies Down,2013-01-24,article,News,,['Basketball']
"Day Care and Behavior Problems, Unlinked",2013-01-24,article,News,,"['Child Care', 'Children and Childhood', 'Day Care Centers', 'Families and Family Life', 'Parenting', 'Research', 'Work-Life Balance']"
"ASAP Yams, a Hip-Hop Spirit Guide",2013-01-24,multimedia,Video,,"['Rap and Hip-Hop', 'Music', 'Celebrities']"
Critics of State’s Campaign Finance Laws Seek Philanthropists’ Help,2013-01-24,article,News,,"['Campaign Finance', 'Elections, State Legislature', 'Philanthropy']"
"Sharing a Surname, a Team and an Outfield",2013-01-24,article,News,,"['Baseball', 'Trades (Sports)']"
Tim Geithner Is Wrong,2013-01-24,article,News,,[]
Benjamin Millepied Answers Questions About His New Post With Paris Opera Ballet,2013-01-24,article,News,,[]
The Race Grows Sweeter Near Its Final Lap,2013-01-24,article,News,,"['Love (Emotion)', 'Marriages', 'Dating and Courtship', 'Elderly', 'Modern Love (Times Column)']"
Updates on the Katie Couric Interview With Manti Te’o,2013-01-24,article,News,,[]
Why Am I Making So Many Pit Stops?,2013-01-24,article,News,,"['Baby Boomers', 'Urinary Tract', 'Age, Chronological']"
Commissioner Overseeing MF Global Inquiry at C.F.T.C. Abruptly Quits,2013-01-24,article,News,,"['Regulation and Deregulation of Industry', 'Suspensions, Dismissals and Resignations']"
Thy Neighbor’s Flag,2013-01-24,article,Question,,"['Vegetarianism', 'Veganism', 'Customs, Etiquette and Manners', 'Flags, Emblems and Insignia', 'Parties (Social)']"
Rangers’ Asham Will Miss Second Consecutive Game,2013-01-24,article,News,,[]
Model-Morphosis | Cora Emmanuel at Jean Paul Gaultier,2013-01-24,article,News,,"['Fashion and Apparel', 'Models (Professional)']"
McKellen and Stewart Will Bring Pinter and Beckett to Broadway in the Fall,2013-01-24,article,News,,['Theater']
"In a French Case, a Battle to Unmask Twitter Users",2013-01-24,article,News,,"['ANTI-SEMITISM', 'Freedom of Speech and Expression', 'Social Networking (Internet)', 'Discrimination']"
‘Dr. Phil’ Renewed Through 2017,2013-01-24,article,News,,['Television']
Stargazing: Sundance Film Festival,2013-01-24,multimedia,Slideshow,,"['Sundance Film Festival (Park City, Utah)', 'Fashion and Apparel', 'Celebrities']"
Ukraine Signs Drilling Deal With Shell for Shale Gas,2013-01-24,article,News,,"['Shale', 'Natural Gas']"
"Roughing It, Antarctic Style",2013-01-24,article,News,,"['Research', 'Science and Technology']"
New Senate Rules to Curtail the Excesses of a Filibuster,2013-01-24,article,News,,"['Filibusters and Debate Curbs', 'United States Politics and Government']"
Push for Gender Balance on Boards Gains Steam,2013-01-24,article,News,,"['Gender', 'Women and Girls', 'Boards of Directors', 'Law and Legislation']"
Challenges for U.S. in Foreign Policy,2013-01-24,multimedia,Video,,"['United States International Relations', 'United States Politics and Government']"
Kerry's Confirmation Hearing,2013-01-24,multimedia,Video,,[]
ArcelorMittal to Close Parts of Belgium Plant,2013-01-24,article,News,,"['Layoffs and Job Reductions', 'Steel and Iron']"
Han Joo,2013-01-24,multimedia,Slideshow,,[]
Cuomo Bows to Mother Nature,2013-01-24,article,News,,['Hurricane Sandy (2012)']
The Führer’s Visit Can’t Suppress This Friendship,2013-01-24,article,Review,,['Theater']
Housing Offers Hope of Strength in the Economy,2013-01-24,article,News,,"['United States Economy', 'Real Estate and Housing (Residential)']"
Mets Acquiring Marcum but Losing Hairston,2013-01-24,article,News,,['Baseball']
"There’s No Smoke, but You’ll Find Fire",2013-01-24,article,Review,,['Restaurants']
"Obama as the Liberal Reagan, Revisited",2013-01-24,article,News,,['United States Politics and Government']
Milestone Looms for Farm-Raised Fish,2013-01-24,article,News,,"['Agriculture and Farming', 'Factory Farming', 'Fish Farming', 'Fishing, Commercial', 'Food Contamination and Poisoning', 'Labor and Jobs']"
Protracted Fire Inquiry Keeping 787 on Ground,2013-01-24,article,News,,"['AIRLINES AND AIRPLANES', 'Regulation and Deregulation of Industry', 'Aviation Accidents and Safety', 'Lithium (Metal)', 'Batteries']"
Greenhill Results a Positive Omen for M.&A. Boutiques,2013-01-24,article,News,,"['Mergers, Acquisitions and Divestitures']"
The New Guy at the Barre,2013-01-24,article,News,,['Dancing']
"As California Bounces Back, Governor Calls For Lofty Goals ",2013-01-24,article,News,,"['Budgets and Budgeting', 'Speeches and Statements', 'High-Speed Rail Projects', 'Water', 'Infrastructure (Public Works)']"
‘Making Room’ in the City,2013-01-24,article,News,,['Real Estate and Housing (Residential)']
"In Davos, Merkel Presses Leaders to Keep Focus on Economy",2013-01-24,article,News,,['European Sovereign Debt Crisis (2010- )']
So Much for Filibuster Reform,2013-01-24,article,News,,['Filibusters and Debate Curbs']
Photos of The Moment | Elie Saab,2013-01-24,article,News,,[]
TimesOpen 2012: Behind the Music,2013-01-24,article,News,,[]
Wheelies: The Global Collaboration Edition,2013-01-24,article,News,,"['Automobiles', 'Electric and Hybrid Vehicles']"
Struggling in Bronze: Figures Visit Central Park,2013-01-24,article,News,,"['Art', 'Sculpture', 'European Fine Art Fair']"
Rangers’ Kreider Faces Questions About Development,2013-01-24,article,News,,[]
An Early Start on 2014 Super Bowl in New York,2013-01-24,article,News,,['Super Bowl']
"Anita Hill, Sundance Star",2013-01-24,article,News,,"['Documentary Films and Programs', 'Sundance Film Festival (Park City, Utah)']"
"Twitter Introduces Vine, a New Video Feature, but With Privacy Snags",2013-01-24,article,News,,"['Social Networking (Internet)', 'Video Recordings and Downloads']"
How to Read Like a Blog Boss,2013-01-24,article,News,,[]
Military Chiefs’ Personal Encounters Influenced Lifting Women’s Combat Ban,2013-01-24,article,News,,"['United States Defense and Military Forces', 'Women and Girls']"
"Charting a Dreamlike Journey, With Travels Both Outside and In",2013-01-24,article,Review,,['Theater']
Cities Urge Public Pension Funds to Divest From Gun Makers,2013-01-24,article,News,,"['Gun Control', 'Pensions and Retirement Plans', 'Banking and Financial Institutions', 'Newtown, Conn, Shooting (2012)']"
The Greenest and Meanest Cars in 2013,2013-01-24,article,News,,[]
Biden Pushes Gun Control Proposals in ‘Fireside Hangout’,2013-01-24,article,News,,['Gun Control']
New Senate Rules Designed to Speed Things Up,2013-01-24,article,News,,"['Filibusters and Debate Curbs', 'United States Politics and Government']"
Pensions and Hurricane Sandy Hurt AT&T’s Earnings,2013-01-24,article,News,,"['Company Reports', 'Wireless Communications']"
Mary Jo White’s Greatest Hits,2013-01-24,article,News,,['Appointments and Executive Changes']
Microsoft Reports Drop in Profit,2013-01-24,article,News,,['Company Reports']
How the Poll Was Conducted,2013-01-24,article,News,,"['Gun Control', 'Newtown, Conn, Shooting (2012)']"
How We Fight,2013-01-24,article,Review,,"['United States Defense and Military Forces', 'Books and Literature', 'Iraq War (2003-11)', 'Afghanistan War (2001- )']"
"Of Goethe’s Land, Romantic and Full-Throated",2013-01-24,article,Review,,"['Classical Music', 'Music']"
Spanish Newspaper Apologizes for Printing Fake Photo of Chávez,2013-01-24,article,News,,"['Photography', 'News and News Media']"
Moving From Wall Street to the Tech Sector Proves Tricky,2013-01-24,article,News,,"['Banking and Financial Institutions', 'Careers and Professions', 'Start-ups', 'Venture Capital']"
From Slovenia’s Ancient Hills,2013-01-24,article,Review,,['Wines']
‘Handled With Care’,2013-01-24,article,Letter,,"['Books and Literature', 'Libraries and Librarians']"
Game Change,2013-01-24,article,Letter,,['Books and Literature']
What’s in a Name?,2013-01-24,article,Letter,,['Books and Literature']
"Ascendant and Ambitious, a Pianist Honors the Masters",2013-01-24,article,Review,,"['Classical Music', 'Music']"
The Great Outdoors,2013-01-24,article,Review,,['Art']
"Older, but Not Yet Retired",2013-01-24,article,News,,"['Baby Boomers', 'Elderly', 'Labor and Jobs']"
From Homespun to Hallucinogenic in Two Fairs,2013-01-24,article,Review,,"['Art', 'Conventions, Fairs and Trade Shows', 'ANTIQUES', 'Book Fairs']"
Pop Listings for Jan. 25-31,2013-01-24,article,Schedule,,[]
