headline,date,doc_type,material_type,section,keywords
Would Ending Tenure Help Schools?,2014-08-22,article,Letter,,"['Tenure', 'Education (K-12)', 'Performance Evaluations (Labor)', 'Teachers and School Employees']"
Congress and Iraq,2014-08-22,article,Letter,,"['Constitution (US)', 'United States Defense and Military Forces']"
Syria’s Moderate Opposition,2014-08-22,article,Letter,,"['Terrorism', 'Foreign Aid', 'United States Defense and Military Forces']"
De Blasio and Expectations,2014-08-22,article,Letter,,[]
"Agyness Deyn’s Return to Fashion, Tickets to Victoria’s Secret Fashion Show and Gisele’s Yearly Income",2014-08-22,article,News,,['Fashion and Apparel']
Paying Homage to a Homespun Troubadour,2014-08-22,article,Review,,['Theater']
More Affordable Textbooks,2014-08-22,article,Letter,,"['Colleges and Universities', 'Textbooks', 'Prices (Fares, Fees and Rates)']"
Nikki Finke Goes Silent in Reported Legal Dispute With Penske Media,2014-08-22,article,News,,['Computers and the Internet']
Unrest in the Midwest,2014-08-22,article,News,,"['Civil War (US) (1861-65)', 'Espionage and Intelligence Services']"
Arvind Subramanian Said to Be Top Pick for India’s Chief Economic Adviser,2014-08-22,article,News,,"['Appointments and Executive Changes', 'Economic Conditions and Trends']"
T Women’s Fall Fashion Issue,2014-08-23,article,News,,[]
Efforts to Revive Rich California Mine Hit Strong Resistance,2014-08-23,article,News,,"['Gold', 'Mines and Mining', 'Water']"
Deborah Sussman Dies at 83; Dressed Buildings in Vivid Colors and Shapes,2014-08-23,article,Obituary (Obit),,"['Deaths (Obituaries)', 'Design', 'ARCHITECTURE', 'Signs and Signage', 'Olmpic Games (1984)']"
A Preview of the U.S. Open,2014-08-23,multimedia,Video,,"['Tennis', 'United States Open (Tennis)']"
The Danger of Combustible Dust,2014-08-23,article,Op-Ed,,"['Accidents and Safety', 'Explosions (Accidental)', 'Factories and Manufacturing', 'Labor and Jobs', 'Regulation and Deregulation of Industry']"
Goldman to Pay $3.15 Billion to Settle Mortgage Claims,2014-08-23,article,News,,"['Mortgages', 'Subprime Mortgage Crisis', 'Suits and Litigation (Civil)']"
Blood Industry Shrinks as Transfusions Decline,2014-08-23,article,News,,"['Blood', 'Surgery and Surgeons', 'Blood Donation']"
"Building on U.S. Tradition, Camp for Hindu Children Strengthens Their Identity",2014-08-23,article,News,,"['Camps and Camping', 'Hinduism', 'Indian-Americans', 'Immigration and Emigration', 'Religion and Belief']"
Saudis Must Stop Exporting Extremism,2014-08-23,article,Op-Ed,,"['Muslims and Islam', 'Sunni Muslims', 'Shariah (Islamic Law)']"
A Prominent Location to Remember Veterans Who Were Wounded,2014-08-23,article,News,,"['Veterans', 'Monuments and Memorials (Structures)', 'Disabilities']"
The Invisible Ink That Wasn’t: A Player Pleads Guilty to Marking Cards at a Casino,2014-08-23,article,News,,"['Casinos', 'Gambling', 'Cheating']"
Giving Email a Holiday,2014-08-23,article,Editorial,,"['Work-Life Balance', 'Editorials', 'E-Mail']"
Questions for the Patent Office,2014-08-23,article,Editorial,,"['Inventions and Patents', 'United States Politics and Government', 'Telecommuting', 'Editorials']"
"As Arizona Primary Nears, Governor Candidates Turn Eyes to Border",2014-08-23,article,News,,"['Elections, Governors', 'Primaries and Caucuses', 'Political Advertising', 'Illegal Immigration', 'Midterm Elections (2014)']"
Sri Lanka’s Intransigence,2014-08-23,article,Editorial,,"['Editorials', 'War Crimes, Genocide and Crimes Against Humanity', 'Human Rights and Human Rights Violations', 'Tamils (Ethnic Group)']"
Reform Conservatism From All Over,2014-08-23,article,News,,['Conservatism (US Politics)']
B.C.S. Makes Way for College Football Playoff (and New Debates),2014-08-23,article,News,,"['Football (College)', 'Playoff Games', 'Bowl Games']"
Two New Cases of Ebola Stem From Secondhand Contact,2014-08-23,article,News,,"['Ebola Virus', 'Deaths (Fatalities)', 'Airport Security']"
U.S. Faces Suit Over Tactics at Immigrant Detention Center,2014-08-23,article,News,,"['Illegal Immigration', 'Deportation', 'Immigration Detention', 'Civil Rights and Liberties', 'Children and Childhood', 'Suits and Litigation (Civil)']"
Cashing In Could Compromise Eligibility,2014-08-23,article,News,,"['Baseball', 'Little League World Series', 'Athletics and Sports']"
"In a New York State Park, a Rustic Summer Camp for the Whole Family",2014-08-23,article,News,,"['Camps and Camping', 'Summer (Season)', 'Parks and Other Recreation Areas', 'Series', 'Families and Family Life']"
Key Factor in Police Shootings: ‘Reasonable Fear’,2014-08-23,article,News,,"['Police Brutality, Misconduct and Shootings']"
U.S. Officials and Experts at Odds on Threat Posed by ISIS,2014-08-23,article,News,,"['United States Defense and Military Forces', 'Terrorism']"
Gift Horses Gone Wild,2014-08-23,article,Op-Ed,,"['Bribery and Kickbacks', 'Gifts to Public Officials']"
Red Sox Win Bidding Contest in Deal With Cuban Outfielder,2014-08-23,article,News,,['Baseball']
"To the Elevators, and Then to the Pit",2014-08-23,article,News,,"['Restaurants', 'Elevators and Escalators']"
New York Process Servers Lose a Suit on New Rules,2014-08-23,article,News,,"['Suits and Litigation (Civil)', 'Law and Legislation', 'Regulation and Deregulation of Industry']"
A March for a Safer City,2014-08-23,article,Editorial,,"['Demonstrations, Protests and Riots', 'Police Brutality, Misconduct and Shootings', 'Editorials']"
New Trial Sought in Death of Man Pulled From Cell,2014-08-23,article,News,,"['Prisons and Prisoners', 'Asphyxiation, Choking, and Suffocation', 'Murders and Attempted Murders', 'Guards', 'Suits and Litigation (Civil)']"
Stars Struggle to Make Barclays Cut,2014-08-23,article,News,,['Golf']
Gaza Talks Build at U.N.,2014-08-23,article,News,,"['Palestinians', 'International Relations', 'United States International Relations', 'Defense and Military Forces']"
Lessons Not Learned,2014-08-23,article,Op-Ed,,"['Subprime Mortgage Crisis', 'Banking and Financial Institutions', 'Savings and Loan Associations', 'Regulation and Deregulation of Industry', 'Glass-Steagall Act (1933)']"
Florida Judge Deals a Blow to Democrats on Districting,2014-08-23,article,News,,"['Redistricting and Reapportionment', 'United States Politics and Government', 'State Legislatures', 'Decisions and Verdicts']"
Blackouts in Egypt Prompt Accusations,2014-08-23,article,News,,"['Power Failures and Blackouts', 'Oil (Petroleum) and Gasoline']"
First Part of a Hit,2014-08-23,article,News,,['Crossword Puzzles']
"Despite Similar Shooting, Los Angeles’s ‘Bank of Trust’ Tempers Reaction ",2014-08-23,article,News,,"['Blacks', 'Black People', 'Demonstrations, Protests and Riots', 'Police Brutality, Misconduct and Shootings', 'Murders and Attempted Murders']"
American’s Star Power Unrivaled in Japan,2014-08-23,article,Biography,,"['Television', 'Comedy and Humor']"
A Grim Week of Executions and Racial Strife,2014-08-23,article,Op-Ed,,"['Police Brutality, Misconduct and Shootings', 'Kidnapping and Hostages', 'Murders and Attempted Murders', 'Race and Ethnicity', 'International Relations']"
Stars’ Rackets: Not Just Like Ours,2014-08-23,article,News,,"['Tennis', 'Sporting Goods and Equipment']"
"Robert Sherrill, Author Who Skewered Right and Left, Dies at 89",2014-08-23,article,Obituary (Obit),,"['Deaths (Obituaries)', 'Books and Literature', 'News and News Media', 'Writing and Writers']"
"Winning Lottery Numbers for Aug. 22, 2014",2014-08-23,article,List,,['Lotteries']
A Tale of de Blasio’s Neighborhoods: Park Slope and Yorkville,2014-08-23,article,News,,['Real Estate and Housing (Residential)']
Talented Field for Travers Stakes Will Also Be Missing Some Names ,2014-08-23,article,News,,['Horse Racing']
Recent Acquisition Gives Yankees’ Playoff Hopes a Lift,2014-08-23,article,News,,['Baseball']
‘The Knick’ Recap: The Rogue Clinic  in the Hospital Basement,2014-08-23,article,News,,['Television']
"Jean Redpath, Prolific Scottish Folk Singer, Dies at 77",2014-08-23,article,Obituary (Obit),,"['Deaths (Obituaries)', 'Folk Music']"
Legal Woes of Owners Help Put the Plaza Back in Play,2014-08-23,article,News,,"['Hotels and Travel Lodgings', 'Real Estate and Housing (Residential)']"
Emails Show Bigger Fund-Raising Role for Wisconsin Leader,2014-08-23,article,News,,"['Campaign Finance', 'Political Action Committees', 'Ethics and Official Misconduct']"
"Quotation of the Day for Saturday, August 23, 2014",2014-08-23,article,Quote,,[]
"Sand and Surf, Speedos and Spirits",2014-08-23,article,News,,['ALCOHOLIC BEVERAGES']
Large Dams Just Aren’t Worth the Cost,2014-08-23,article,Op-Ed,,"['Levees and Dams', 'Infrastructure (Public Works)', 'Hydroelectric Power', 'Environment']"
Weekend Ho!,2014-08-23,article,News,,['Subways']
"Chung Eun-yong,Who Helped Expose U.S. Killings of Koreans, Dies at 91",2014-08-23,article,Obituary (Obit),,"['Korean War', 'Deaths (Obituaries)', 'United States Defense and Military Forces']"
"Onstage, a Ghost and a Swordsman",2014-08-23,article,Review,,['Theater']
Case File on Fund-Raising for a Group Helping Gov. Scott Walker,2014-08-23,multimedia,Interactive Feature,,"['Polls and Public Opinion', 'Blacks', 'Black People', 'Race and Ethnicity', 'Police Brutality, Misconduct and Shootings', 'Demonstrations, Protests and Riots']"
New York Council Vote to Pay School Bus Drivers More Is Criticized,2014-08-23,article,News,,"['Buses', 'Wages and Salaries', 'Organized Labor', 'Education (K-12)', 'Budgets and Budgeting']"
Two Arrested as New York City Focuses on Deed Fraud,2014-08-23,article,News,,"['Frauds and Swindling', 'Real Estate and Housing (Residential)']"
"Coming Off a Strong Performance, Smith Is Named the Jets’ Starter",2014-08-23,article,News,,['Football']
"In Japan, Another Leader Takes Heat for Golfing During a Crisis",2014-08-23,article,News,,"['Landslides and Mudslides', 'Golf', 'Kidnapping and Hostages']"
"After Season of Despair, All the Pressure Is on the Coach",2014-08-23,article,News,,['Football (College)']
What’s on TV Saturday,2014-08-23,article,Schedule,,[]
"Errors Make for Comedy, but the Mets Aren’t Amused",2014-08-23,article,News,,['Baseball']
"Corrections: August 23, 2014",2014-08-23,article,News,,[]
Analytics: How Readers Reacted to Our Cover Story About Libertarians,2014-08-23,article,News,,[]
The Growing Blue-State Diaspora,2014-08-23,article,Op-Ed,,"['United States Politics and Government', 'States (US)', 'Population', 'Presidential Elections (US)', 'Census']"
Germany Pledges Aid for Ukraine as Russia Hails a Returning Convoy,2014-08-23,article,News,,['Humanitarian Aid']
"Two Countries, Two Vastly Different Phone Bills",2014-08-23,article,News,,"['Cellular Telephones', 'Prices (Fares, Fees and Rates)']"
"Julie Myers Wood: Eat Your Sushi, and Expand Your Horizons",2014-08-23,article,Question,,"['Executives and Management (Theory)', 'Hiring and Promotion']"
How to Polish a Baseball Diamond,2014-08-23,article,Question,,"['Baseball', 'Lawns', 'Careers and Professions', 'Labor and Jobs']"
Another Night In Brooklyn,2014-08-23,article,News,,[]
"Yes, Flexible Hours Ease Stress. But Is Everyone on Board?",2014-08-23,article,News,,"['Work-Life Balance', 'Working Hours', 'Workplace Environment', 'Telecommuting', 'Research']"
One Way to Fix the Corporate Tax: Repeal It,2014-08-23,article,News,,"['Corporate Taxes', 'Tax Shelters', 'Value-Added Tax', 'Taxation', 'Relocation of Business', 'United States Economy', 'Income Tax', 'Federal Taxes (US)']"
Draghi at Deflation Gulch,2014-08-23,article,News,,[]
An Unfinished Chapter at Countrywide,2014-08-23,article,News,,"['Mortgages', 'Subprime Mortgage Crisis']"
1914: Kitchener Congratulates British Troops in France,2014-08-23,article,News,,"['Defense and Military Forces', 'World War I (1914-18)']"
Home on the West Side Range,2014-08-23,article,Question,,"['Real Estate and Housing (Residential)', 'Rent Control and Stabilization', 'Renting and Leasing (Real Estate)']"
Raising a Glass to American Upstart Distillers,2014-08-23,article,News,,"['ALCOHOLIC BEVERAGES', 'International Trade and World Market', 'Gin (Liquor)', 'Whiskey']"
"At Hotels, Hearing the Scream for Ice Cream",2014-08-23,article,News,,"['Food Trucks and Vendors', 'Hotels and Travel Lodgings', 'Ice Cream and Frozen Desserts', 'Travel and Vacations']"
Coverage of Eric Garner Rally on Staten Island,2014-08-23,article,News,,"['Demonstrations, Protests and Riots', 'Police Brutality, Misconduct and Shootings']"
Attack of the Crazy Centrists,2014-08-23,article,News,,[]
Katie Ledecky Improves on Her World Record in the 400 Freestyle,2014-08-23,article,News,,"['Swimming', 'Pan Pacific Swimming Championships']"
A Star’s Bumpy Trail to Oregon,2014-08-23,article,News,,['Football (College)']
Latvia’s Tensions With Russians at Home Persist in Shadow of Ukraine Conflict ,2014-08-23,article,News,,"['Russian Language', 'Citizenship and Naturalization', 'Language and Languages']"
Michael Bloomberg’s Harder Sell,2014-08-23,article,News,,"['Philanthropy', 'Smoking and Tobacco', 'Obesity']"
Variety: An Acrostic That Takes Work,2014-08-23,article,News,,"['Acrostic Puzzles', 'Crossword Puzzles']"
Bid to Expand Medical Marijuana Business Faces Federal Hurdles,2014-08-23,article,News,,"['Medical Marijuana', 'States (US)', 'Marijuana', 'Medicine and Health', 'Epilepsy', 'Hemp']"
"Michael Phelps, Unfazed by Poor Weather, Wins Gold Medal in the 100 Butterfly",2014-08-23,article,News,,"['Swimming', 'Pan Pacific Swimming Championships']"
Devoted to Rural America,2014-08-23,multimedia,Video,,"['Rural Areas', 'Cable Television']"
Unions Face Backlash for Joining March on Staten Island,2014-08-23,article,News,,"['Organized Labor', 'Demonstrations, Protests and Riots', 'Police Brutality, Misconduct and Shootings']"
Timeline for a Body: 4 Hours in the Middle of a Ferguson Street,2014-08-23,article,News,,"['Demonstrations, Protests and Riots', 'Murders and Attempted Murders', 'Police Brutality, Misconduct and Shootings']"
A Matchup of Unsinkable Spirits,2014-08-23,article,News,,"['Tennis', 'United States Open (Tennis)', 'Titanic (Ship)']"
"In Washington, Second Thoughts on Arming Police",2014-08-23,article,News,,"['Police Brutality, Misconduct and Shootings', 'Police', 'Demonstrations, Protests and Riots', 'Firearms', 'ARMOR']"
"With a Bit More Polish, Geno Smith Takes the Controls",2014-08-23,article,News,,['Football']
The One-Handed Backhand Has All but Disappeared,2014-08-23,multimedia,Interactive Feature,,[]
"Moving East, an Artist Doubles His Productivity",2014-08-23,article,News,,"['Cartoons and Cartoonists', 'Writing and Writers', 'Graphic Novels']"
Henry’s Artistry Inspires His Latest Strike Partner ,2014-08-23,article,News,,['Soccer']
Imagine a Foul Ball as Strike 3,2014-08-23,article,Letter,,['Baseball']
Those Who Serve Ebola Victims Soldier On,2014-08-23,article,News,,"['Ebola Virus', 'Epidemics', 'Nursing and Nurses', 'Deaths (Fatalities)']"
A Familiar Figure on the Santo Domingo Waterfront,2014-08-23,multimedia,Slideshow,,"['Sex Crimes', 'Priests']"
"For Nuncio Accused of Abuse, Dominicans Want Justice at Home, Not Abroad",2014-08-23,article,News,,"['Sex Crimes', 'Priests', 'Child Abuse and Neglect']"
U.S. Court to Hear Case on Voting Restrictions as Arizona Prepares for Polls,2014-08-23,article,News,,"['Voter Registration and Requirements', 'Immigration and Emigration']"
Putting Aside X’s and O’s to Ponder Life and Death ,2014-08-23,article,News,,"['Football', 'Blacks', 'Black People', 'Police Brutality, Misconduct and Shootings']"
Burial Boys of Ebola,2014-08-23,multimedia,Video,,"['Ebola Virus', 'Deaths (Fatalities)']"
"Anthony Davis, Now on the World Stage, Is the Next Superstar",2014-08-23,article,News Analysis,,['Basketball']
"In Afghan Election, Signs of Systemic Fraud Cast Doubt on Many Votes",2014-08-23,article,News,,"['Elections', 'Frauds and Swindling', 'Corruption (Institutional)', 'Polls and Public Opinion']"
"Someday Soon, There May Be No Such Thing as a Free Pass",2014-08-23,article,News,,['Baseball']
A Better Credit Card,2014-08-23,article,Editorial,,"['Credit Cards', 'Frauds and Swindling', 'Editorials', 'Computer Security', 'Identity Theft', 'Cyberattacks and Hackers', 'Computer Chips', 'Banking and Financial Institutions', 'Shopping and Retail']"
The Climate Swerve,2014-08-23,article,Op-Ed,,"['Global Warming', 'Psychology and Psychologists', 'Greenhouse Gas Emissions', 'Air Pollution', 'Polls and Public Opinion', 'Weather']"
Teaching’s Human Touch,2014-08-23,article,Letter,,"['Teachers and School Employees', 'Education (K-12)', 'Performance Evaluations (Labor)', 'Children and Childhood']"
How the Carolinas Fixed Their Blurred Lines,2014-08-23,article,Op-Ed,,"['Maps', 'States (US)']"
Rethinking Eating,2014-08-23,article,News Analysis,,"['Food', 'Venture Capital', 'Meat']"
"An Unusual Hire, for Uncommon Times",2014-08-23,article,Op-Ed,,"['Public Editor (Times Column)', 'Appointments and Executive Changes', 'News and News Media', 'Social Media']"
"Black, White and Baseball",2014-08-23,article,Op-Ed,,"['Baseball', 'Little League World Series']"
Our Thoroughly Modern Enemies,2014-08-23,article,Op-Ed,,"['Speeches and Statements', 'War Crimes, Genocide and Crimes Against Humanity', 'Holocaust and the Nazi Era', 'World War II (1939-45)', 'Terrorism']"
Thomas W. Geisbert,2014-08-23,article,Op-Ed,,"['Vaccination and Immunization', 'Ebola Virus']"
"The Debate on Salty Foods, Continued",2014-08-23,article,Editorial,,"['Editorials', 'Diet and Nutrition', 'Salt', 'Research']"
The Golf Address,2014-08-23,article,Op-Ed,,"['Demonstrations, Protests and Riots', 'Kidnapping and Hostages', 'Travel and Vacations']"
"Order vs. Disorder, Part 3",2014-08-23,article,Op-Ed,,"['Books and Literature', 'United States International Relations', 'Refugees and Displaced Persons', 'Income Inequality']"
Dealing With Digital Cruelty,2014-08-23,article,News Analysis,,"['Computers and the Internet', 'Cyberharassment', 'Psychology and Psychologists', 'Writing and Writers', 'Blogs and Blogging (Internet)']"
Bug Love,2014-08-23,article,Op-Ed,,"['Insects', 'Pesticides', 'Forests and Forestry', 'Endangered and Extinct Species']"
"My Daughter, Her Rat",2014-08-23,article,News,,"['Anxiety and Stress', 'Pets', 'Rats']"
Why Interest Rates Need to Stay Low,2014-08-23,article,Editorial,,"['Editorials', 'Interest Rates', 'Inflation (Economics)', 'Banking and Financial Institutions']"
On Not Writing,2014-08-23,article,News,,"['Exercise', 'Writing and Writers']"
Underdogs Who Make the Most of a Chance,2014-08-23,article,News,,['Baseball']
Populist’s Brash Tactics Stir Fears of Crisis in Pakistan,2014-08-23,article,News,,"['Demonstrations, Protests and Riots']"
Pakistan and India Trade Fire,2014-08-23,article,News,,['Civilian Casualties']
A Driving School in France Hits a Wall of Regulations,2014-08-23,article,News,,"['Drivers Licenses', 'Regulation and Deregulation of Industry', 'Tests and Examinations', 'Drivers Education']"
"Sunday Breakfast Menu, Aug. 24",2014-08-23,article,News,,[]
Marchers Demand Justice for Eric Garner,2014-08-23,multimedia,Video,,"['Demonstrations, Protests and Riots', 'Police Brutality, Misconduct and Shootings']"
China Denies Confrontation With U.S. Surveillance Plane,2014-08-23,article,News,,"['United States Defense and Military Forces', 'Military Aircraft']"
Cavaliers Complete Deal to Acquire Kevin Love From Timberwolves,2014-08-23,article,News,,['Basketball']
Dozens Rally for Officer in Ferguson Killing as Funds Are Raised Online,2014-08-23,article,News,,"['Crowdfunding (Internet)', 'Demonstrations, Protests and Riots', 'Police Brutality, Misconduct and Shootings']"
"On Staten Island, Thousands Protest Police Tactics",2014-08-23,article,News,,"['Demonstrations, Protests and Riots', 'Police Brutality, Misconduct and Shootings']"
Gay-Themed Events Part of the Game,2014-08-23,article,News,,"['Baseball', 'Homosexuality and Bisexuality', 'Discrimination']"
"John F. Akers, 79, Dies; Led IBM as PCs Ascended",2014-08-23,article,Obituary (Obit),,"['Computers and the Internet', 'Deaths (Obituaries)']"
"After Joe Torre Is Honored, the Yankees Gain a Win",2014-08-23,article,News,,['Baseball']
"A Challenging Dinner, Layer by Layer",2014-08-23,article,Review,,['Restaurants']
Venturing Beyond the Usual Bar Food,2014-08-23,article,Review,,['Restaurants']
A Bit of the Bosporus,2014-08-23,article,Review,,['Restaurants']
TV Chief Takes 2-by-4 to a Proposed Cable Merger,2014-08-23,article,News,,"['Cable Television', 'Mergers, Acquisitions and Divestitures', 'Rural Areas']"
Second Shift,2014-08-23,article,News,,['Crossword Puzzles']
Best Woman to Ever Play Chess Retires From Competition,2014-08-23,article,News,,['Chess']
The Flow of Money and Equipment to Local Police,2014-08-23,multimedia,Interactive Feature,,['Police']
Papier-Mâché Heads and a Surprise Guest,2014-08-23,article,Review,,['Music']
Response to Attack Reflects Iraq’s Sectarian Divide,2014-08-23,article,News,,"['Muslims and Islam', 'Sunni Muslims', 'Shiite Muslims', 'Legislatures and Parliaments']"
Thousands in Texas Lose Cars Amid Calls for Loan Restrictions,2014-08-23,article,News,,"['Automobile Financing', 'Credit and Debt', 'Consumer Protection', 'Automobiles']"
A Waste Solution May Lean Again on a Low-Income Area,2014-08-23,article,News,,"['Waste Materials and Disposal', 'Recycling of Waste Materials']"
Israeli Strike Destroys Apartment Tower in Gaza,2014-08-23,article,News,,"['Palestinians', 'Defense and Military Forces']"
"County Casts Long Shadow, Even to Perry",2014-08-23,article,News,,"['Corruption (Institutional)', 'District Attorneys']"
An Opera Comes to El Paso by Way of Bhutan,2014-08-23,article,News,,['Opera']
Homage to the Flavors of Far Southern Italy,2014-08-23,article,Review,,['Restaurants']
The New Man Bringing the Bard to Boscobel,2014-08-23,article,News,,['Theater']
Scenes From Saturday’s March,2014-08-24,multimedia,Slideshow,,"['Demonstrations, Protests and Riots', 'Police Brutality, Misconduct and Shootings']"
Novak Djokovic Says Family Is Now His No. 1 Focus,2014-08-24,article,News,,"['Tennis', 'United States Open (Tennis)']"
"After His Mother Gives Him a Lift to the Course, a Player Makes a Leap",2014-08-24,article,News,,['Golf']
"Winning Lottery Numbers for Aug. 23, 2014",2014-08-24,article,List,,['Lotteries']
"In a Tight Travers Finish, a Trainer Can’t Lose",2014-08-24,article,News,,['Horse Racing']
"Quotation of the Day for Sunday, August 24, 2014",2014-08-24,article,Quote,,[]
Hundreds in Washington Protest Missouri Shooting,2014-08-24,article,News,,"['Demonstrations, Protests and Riots', 'Police Brutality, Misconduct and Shootings']"
Identity and Youth,2014-08-24,article,News,,[]
The Business of Style,2014-08-24,article,News,,['Fashion and Apparel']
Isis Ward and Austin Kivett-Ripmaster,2014-08-24,article,News,,['Weddings and Engagements']
Celene Menschel and Alexander Egan,2014-08-24,article,News,,['Weddings and Engagements']
"Genavieve Shingle, Jordana Jaffe",2014-08-24,article,News,,['Weddings and Engagements']
Michael McGovern and Gregory Alcock,2014-08-24,article,News,,['Weddings and Engagements']
"Ashley Valliere, Keith Margulis",2014-08-24,article,News,,['Weddings and Engagements']
"Elizabeth Tunick, Andrew Cedar",2014-08-24,article,News,,['Weddings and Engagements']
"Lauren Shockey, Ross Fabricant",2014-08-24,article,News,,['Weddings and Engagements']
"Sarah Filous, Benjamin Spector",2014-08-24,article,News,,['Weddings and Engagements']
"Goedenmooi Monds, Matthew Medina",2014-08-24,article,News,,['Weddings and Engagements']
How Could She Refuse Billy Idol?,2014-08-24,article,News,,['Weddings and Engagements']
"Jodie Valade, Nate Ryan",2014-08-24,article,News,,['Weddings and Engagements']
"Erum Jilani, Gregory Whitten",2014-08-24,article,News,,['Weddings and Engagements']
"Brittany Jesser, Peter Bellard",2014-08-24,article,News,,['Weddings and Engagements']
Jenna McCann and Gil Messer,2014-08-24,article,News,,['Weddings and Engagements']
"Katharine Modisett, Kevin Lander",2014-08-24,article,News,,['Weddings and Engagements']
"Parisa Haghshenas, Steven Seitz",2014-08-24,article,News,,['Weddings and Engagements']
"Andrea Mauro, Evan Gotlob",2014-08-24,article,News,,['Weddings and Engagements']
"Nicole Ruffini, Jordan Liss",2014-08-24,article,News,,['Weddings and Engagements']
"Whitney Eulich, Matthew Walter",2014-08-24,article,News,,['Weddings and Engagements']
"Cate Candland, Craig Clancy",2014-08-24,article,News,,['Weddings and Engagements']
"Kristel Adler, John Cote",2014-08-24,article,News,,['Weddings and Engagements']
"Katherine Gribble, William Motley",2014-08-24,article,News,,['Weddings and Engagements']
A Connection Before the Connection,2014-08-24,article,News,,['Weddings and Engagements']
"Anne Butler, Michael Duncan",2014-08-24,article,News,,['Weddings and Engagements']
"Whitney Fogle, Chequan Lewis",2014-08-24,article,News,,['Weddings and Engagements']
"Hayley Phelan, Christopher Black",2014-08-24,article,News,,['Weddings and Engagements']
"Rebecca Gridley, Derek Wikstrom",2014-08-24,article,News,,['Weddings and Engagements']
"Elizabeth Fleming, Ryan O’Connor",2014-08-24,article,News,,['Weddings and Engagements']
"Jessica Paindiris, Anderson Libert",2014-08-24,article,News,,['Weddings and Engagements']
"Katherine Gensheimer, David Friedman",2014-08-24,article,News,,['Weddings and Engagements']
"Sari Schneidman, Jordan Rosenblum",2014-08-24,article,News,,['Weddings and Engagements']
"Krista Caiazza, Shawn Hoffman",2014-08-24,article,News,,['Weddings and Engagements']
"Laurie Campanella, Patrick Crockett Jr.",2014-08-24,article,News,,['Weddings and Engagements']
"Valentine Lysikatos, Erich Carey",2014-08-24,article,News,,['Weddings and Engagements']
Kimberly Ong and Ian Marcus Amelkin,2014-08-24,article,News,,['Weddings and Engagements']
"Pauline Yu, John Charles",2014-08-24,article,News,,['Weddings and Engagements']
