headline,date,doc_type,material_type,section,keywords
"Goal, Goal, Goal, Goal, Goal, Goal, Goal, and Brazil’s Day Goes Dark",2014-07-08,article,News,,"['World Cup 2014 (Soccer)', 'Soccer']"
"An Odd Couple Returns, Still Bound by a Border",2014-07-08,article,Review,,['Television']
What We’re Reading,2014-07-08,article,News,,"['Computers and the Internet', 'Magazines', 'Maps']"
Astronaut’s Re-Entry Is Bumpy,2014-07-08,article,Review,,['Television']
Pictures of the Day: Gaza City and Elsewhere,2014-07-08,article,News,,['Photography']
"Hovering Ghost, Plunging Water",2014-07-08,article,Review,,"['Theater', 'Lincoln Center Festival', 'Kabuki (Japanese Theater)']"
Younger Rajaratnam Finally Out of His Brother’s Shadow,2014-07-08,article,News,,['Insider Trading']
It Takes a Village (and a Composer and a Writer),2014-07-08,article,News,,"['Theater', 'New York Musical Theater Festival']"
Photojournalists Push Project in Spain,2014-07-08,multimedia,Slideshow,,[]
Three’s a Trend | Cloudlike Confections at Couture,2014-07-08,article,News,,"['Couture (Fashion)', 'Dresses', 'Fashion and Apparel']"
An Allegory Steeped in Enigmas,2014-07-08,article,Review,,['Movies']
Replica,2014-07-08,multimedia,Slideshow,,['Music']
"So Much Worth Fighting for, Both on the Stage and Off It",2014-07-08,article,Review,,['Music']
"World Cup 2014: Argentina Defeats Netherlands in Shootout, Advancing to Final",2014-07-08,multimedia,Interactive Feature,,"['World Cup 2014 (Soccer)', 'Soccer']"
Ryder Ripps: An Artist of the Internet,2014-07-08,article,News,,"['Computers and the Internet', 'Art', 'ADVERTISING AND MARKETING', 'Fashion and Apparel']"
Publishing ‘Mein Kampf’ in Germany,2014-07-08,article,Letter,,"['Holocaust and the Nazi Era', 'World War II (1939-45)', 'Jews and Judaism', 'Books and Literature', 'ANTI-SEMITISM']"
School Cafeteria Fight: What’s for Lunch?,2014-07-08,article,Letter,,"['Food', 'Education (K-12)', 'Lunch and Breakfast Programs']"
Blueprints for Taming the Climate Crisis,2014-07-08,article,News,,"['Greenhouse Gas Emissions', 'United Nations Framework Convention on Climate Change', 'Carbon Dioxide', 'Carbon Capture and Sequestration', 'Global Warming', 'Environment']"
Germany’s Five First-Half Goals Against Brazil,2014-07-08,multimedia,Interactive Feature,,['World Cup (Soccer)']
Cuomo’s Goal on AIDS,2014-07-08,article,Letter,,['Acquired Immune Deficiency Syndrome']
A Piece of Pioneer Florida,2014-07-08,article,Letter,,['Historic Buildings and Sites']
Honda Expands Takata Air Bag Inflator Recall,2014-07-08,article,News,,"['Automobiles', 'Recalls and Bans of Products']"
World Cup: Germany vs. Brazil,2014-07-08,multimedia,Slideshow,,[]
Another Digital Move,2014-07-08,article,News,,"['Appointments and Executive Changes', 'Social Media']"
If Tuberculosis Spreads ...,2014-07-08,article,Op-Ed,,"['Tuberculosis', 'Medicine and Health', 'Epidemics', 'Prisons and Prisoners']"
"In Deal to Cut Corporate Taxes, Shareholders Pay the Price",2014-07-08,article,News,,"['Corporate Taxes', 'Mergers, Acquisitions and Divestitures', 'Relocation of Business']"
"Textbooks or Not, You Never Outgrow Your Backpack",2014-07-08,article,News,,"['Fashion and Apparel', 'Shopping and Retail', 'Handbags and Purses']"
Recent Commercial Real Estate Transactions,2014-07-08,article,News,,['Real Estate (Commercial)']
Does Evolution Explain Religious Beliefs?,2014-07-08,article,News,,"['Evolution (Biology)', 'Philosophy', 'Religion and Belief']"
Concord Music Buys Catalog of Vee-Jay Records,2014-07-08,article,News,,"['Music', 'Mergers, Acquisitions and Divestitures']"
Britain Confronts Not-in-My-Backyard Attitude,2014-07-08,article,News,,"['Historic Buildings and Sites', 'Real Estate and Housing (Residential)', 'Land Use Policies']"
"After Arrest of Accused Hacker, Russia Accuses U.S. of Kidnapping",2014-07-08,article,News,,"['Cyberattacks and Hackers', 'United States International Relations']"
Itinerant Statue of Ex-Mayor Finds a Home at Foley Square,2014-07-09,article,News,,"['Monuments and Memorials (Structures)', 'Mayors', 'Parks and Other Recreation Areas']"
"Umaru Dikko, Ex-Nigerian Official Who Was Almost Kidnapped, Dies",2014-07-09,article,Obituary (Obit),,"['Kidnapping', 'Deaths (Obituaries)']"
Purity Vodka Banks on Some Comic Timing,2014-07-09,article,News,,"['ADVERTISING AND MARKETING', 'Video Recordings, Downloads and Streaming', 'Social Media', 'Vodka', 'Comedy and Humor']"
How to Stop the Surge of Migrant Children,2014-07-09,article,News,,[]
Senator Sees Cuban Role in Corruption Inquiry,2014-07-09,article,News,,"['Ethics and Official Misconduct', 'United States Politics and Government', 'Espionage and Intelligence Services']"
Invaluable and Infuriating All in One,2014-07-09,article,News,,"['World Cup 2014 (Soccer)', 'Soccer']"
Pharmacist Is Accused of Stealing Oxycodone,2014-07-09,article,News,,"['Robberies and Thefts', 'OxyContin (Drug)', 'Drug Abuse and Traffic']"
Profits Vanish in Venezuela After Currency Devaluation,2014-07-09,article,News,,"['Currency', 'Inflation (Economics)', 'International Trade and World Market']"
"Ex-Governor, Suing Over Book, Is Back in Minnesota’s Spotlight",2014-07-09,article,News,,"['Suits and Litigation (Civil)', 'Libel and Slander', 'Books and Literature']"
House Committee Takes Step Toward Renewing Highway Trust Fund,2014-07-09,article,News,,"['United States Politics and Government', 'Infrastructure (Public Works)', 'Roads and Traffic']"
U.S. Adjusts Court Flow to Meet Rise in Migrants,2014-07-09,article,News,,"['Illegal Immigration', 'Courts and the Judiciary', 'Deportation', 'Children and Childhood']"
"For Those in the Digital Dark, Enlightenment Is Borrowed From the Library",2014-07-09,article,News,,"['Computers and the Internet', 'Libraries and Librarians']"
Game That Shocked the World Leads to Joyous Disbelief in Germany,2014-07-09,article,News,,"['World Cup 2014 (Soccer)', 'Soccer']"
Hobby Lobby’s Disturbing Sequel,2014-07-09,article,Editorial,,"['Birth Control and Family Planning', 'Patient Protection and Affordable Care Act (2010)', 'Health Insurance and Managed Care', 'Religion-State Relations', 'Colleges and Universities', 'Editorials']"
"In Arizona, Dreamers Can Drive",2014-07-09,article,Editorial,,"['Drivers Licenses', 'Illegal Immigration', 'Dream Act (Development, Relief and Education for Minors Act)', 'Decisions and Verdicts', 'Editorials']"
Six Vials of Smallpox Discovered in Laboratory Near Washington,2014-07-09,article,News,,"['Smallpox', 'Laboratories and Scientific Equipment']"
Citigroup Is Said to Be Close to Settling Inquiry Into Mortgage Securities,2014-07-09,article,News,,"['Banking and Financial Institutions', 'Mortgage-Backed Securities', 'Securities and Commodities Violations']"
Brazilian Fans React to Loss,2014-07-09,multimedia,Video,,"['Soccer', 'World Cup 2014 (Soccer)']"
Lessons of a For-Profit College Collapse,2014-07-09,article,Editorial,,"['For-Profit Schools', 'Colleges and Universities', 'Federal Aid (US)', 'Editorials']"
Nation in Despair,2014-07-09,article,News,,"['World Cup 2014 (Soccer)', 'Soccer', 'Emotions']"
Using M.C.s and M.D.s to Promote Healthy Eating for Youths,2014-07-09,article,News,,"['Diet and Nutrition', 'Rap and Hip-Hop', 'Children and Childhood', 'Education (K-12)', 'Music']"
Faith Groups Seek Exclusion From Bias Rule,2014-07-09,article,News,,"['Religion-State Relations', 'Homosexuality and Bisexuality', 'Discrimination', 'Executive Orders and Memorandums', 'United States Politics and Government', 'Faith-Based Initiatives']"
The New Yorker Alters Its Online Strategy,2014-07-09,article,News,,"['Prices (Fares, Fees and Rates)', 'E-Commerce']"
"Winning Lottery Numbers for July 8, 2014",2014-07-09,article,List,,['Lotteries']
‘Cutting the Grass’ of Hamas’s Militancy,2014-07-09,multimedia,Video,,"['Palestinians', 'Bombs and Explosives', 'Defense and Military Forces', 'Terrorism']"
"Queens Woman, 22, Is Arrested in Killing of Infant Son",2014-07-09,article,News,,"['Asphyxiation, Choking, and Suffocation', 'Murders and Attempted Murders']"
Stunned Brazilians Try to Move On After Their Exalted Team Falls,2014-07-09,article,News,,"['World Cup 2014 (Soccer)', 'Soccer']"
The Crumbs Cupcake Boom and Bust,2014-07-09,multimedia,Video,,"['Cupcakes', 'Bankruptcies']"
Big Holder Gives Up Entire Stake in American Apparel,2014-07-09,article,News,,['Fashion and Apparel']
More Officers at New York Public Housing Amid a Rise in Shootings,2014-07-09,article,News,,"['Public and Subsidized Housing', 'Crime and Criminals']"
"For Crumbs, Growth May Have Come Too Fast",2014-07-09,article,News,,"['Cupcakes', 'Shutdowns (Institutional)']"
NATO Chief Expresses Support for Ukraine,2014-07-09,multimedia,Video,,['Embargoes and Sanctions']
"With Talks Uncertain, Ukrainian Rebels Cling to Hope in Strongholds",2014-07-09,article,News,,['Defense and Military Forces']
"In Effort to Shift Abandoned NASA Craft, a Hiccup (or Burp)",2014-07-09,article,News,,['Space and Astronomy']
"América Móvil to Shed Assets, Loosening Grip",2014-07-09,article,News,,"['Antitrust Laws and Competition Issues', 'Telephones and Telecommunications']"
Testimony in Boston Bomb Trial Focuses on Backpack,2014-07-09,article,News,,['Boston Marathon Bombings (2013)']
Silicon Valley Sharknado,2014-07-09,article,Op-Ed,,"['Artificial Intelligence', 'Robots and Robotics']"
Departure of Official Is Sought by Teachers,2014-07-09,article,News,,"['Teachers and School Employees', 'Organized Labor', 'Tests and Examinations', 'Education (K-12)', 'Performance Evaluations (Labor)']"
Study Finds Racial Disparity in Criminal Prosecutions,2014-07-09,article,News,,"['Race and Ethnicity', 'Sentences (Criminal)', 'Blacks', 'Black People', 'Hispanic-Americans', 'Asian-Americans']"
Iran Sends 3 Attack Planes to Iraqi Government,2014-07-09,article,News,,"['Military Aircraft', 'Drones (Pilotless Planes)']"
Where Anything Can Happen and Usually Does,2014-07-09,article,Review,,"['Theater', 'ACROBATS AND ACROBATICS']"
Like the Oscars,2014-07-09,article,News,,"['Academy Awards (Oscars)', 'Crossword Puzzles', 'Stars and Galaxies']"
"Spying Case Left Obama in Dark, U.S. Officials Say",2014-07-09,article,News,,"['Espionage and Intelligence Services', 'United States International Relations']"
"Anne Hollander, Scholar Who Linked Art and Style, Dies at 83",2014-07-09,article,Obituary (Obit),,"['Books and Literature', 'Deaths (Obituaries)', 'Fashion and Apparel']"
Swiss Banks’ Tradition of Secrecy Clashes With Quests Abroad for Disclosure,2014-07-09,article,News,,"['Banking and Financial Institutions', 'Tax Evasion', 'International Relations']"
Tejada Fights His Way Back Into Mets’ Good Graces,2014-07-09,article,News,,['Baseball']
North Korea Fires 2 More Ballistic Missiles,2014-07-09,article,News,,"['Missiles and Missile Defense Systems', 'Nuclear Weapons']"
"Zalman Schachter-Shalomi, Jewish Pioneer, Dies at 89",2014-07-09,article,Obituary (Obit),,"['Jews and Judaism', 'Rabbis', 'Deaths (Obituaries)', 'Synagogues', 'Hasidism']"
No Word on Anthony as Knicks Get to Work,2014-07-09,article,News,,"['Basketball', 'Free Agents (Sports)']"
The First Cannabis Store in Seattle,2014-07-09,multimedia,Video,,['Marijuana']
Religious Groups’ Letter to Obama,2014-07-09,multimedia,Interactive Feature,,"['Discrimination', 'Homosexuality and Bisexuality', 'Religion and Belief', 'Law and Legislation']"
More Charges to Come Against Libyan Over Benghazi,2014-07-09,article,Brief,,"['Benghazi Attack (2012)', 'Diplomatic Service, Embassies and Consulates', 'International Relations']"
Afghanistan: Taliban Strike in Deadly Bombing,2014-07-09,article,Brief,,"['Terrorism', 'Afghanistan War (2001- )', 'Civilian Casualties', 'Bombs and Explosives']"
"At a New Michigan Club, a Touch of Wimbledon at Members’ Feet",2014-07-09,article,News,,"['Tennis', 'Grass', 'Wimbledon Tennis Tournament']"
Fallen Firefighter Is Mourned,2014-07-09,article,News,,"['Deaths (Fatalities)', 'Fires and Firefighters', 'Funerals and Memorials']"
Report Says Debt Settlement Companies May Leave Clients Worse Off,2014-07-09,article,News,,['Credit and Debt']
"Yankees Ace Tanaka Has a Rare Off Day, and the Score Reflects It",2014-07-09,article,News,,['Baseball']
NATO Chief Warns of Duplicity by Putin on Ukraine,2014-07-09,article,News,,"['Defense and Military Forces', 'International Relations']"
European Effort for Computer-Simulated Brain Draws Fire,2014-07-09,article,News,,"['Brain', 'Supercomputers', 'Science and Technology']"
DeGrom Overpowers the Braves,2014-07-09,article,News,,['Baseball']
European Companies See Opportunity in the ‘Right to Be Forgotten’,2014-07-09,article,News,,"['Search Engines', 'Computers and the Internet', 'Privacy']"
Preet Bharara’s Key Insider Trading Cases,2014-07-09,multimedia,Interactive Feature,,"['Insider Trading', 'Hedge Funds']"
How Much Do Our Genes Influence Our Political Beliefs?,2014-07-09,article,Op-Ed,,"['Genetics and Heredity', 'Politics and Government', 'Psychology and Psychologists', 'Conservatism (US Politics)', 'Research', 'Liberalism (US Politics)']"
A Recent History of Chanel’s Couture Show Sets,2014-07-09,article,News,,[]
"Probing Brain’s Depth, Trying to Aid Memory",2014-07-09,article,News,,"['Memory', 'Brain', 'Traumatic Brain Injury', 'United States Defense and Military Forces', 'Epilepsy', 'Seizures (Medical)']"
Jay Z to Headline Global Citizen Festival in Central Park,2014-07-09,article,News,,['Music']
This Is Our Youth,2014-07-09,article,News,,"['Exercise', 'Medicine and Health', 'Youth']"
Word of the Day | fallow,2014-07-09,article,News,,[]
Comptroller Aims to Curb Personal-Injury Claims Against New York City,2014-07-09,article,News,,['Suits and Litigation (Civil)']
Seeking a Lift at the Site of a Career Peak,2014-07-09,article,Special Report,,"['Golf', ""Women's British Open (Golf)""]"
What’s On TV Wednesday,2014-07-09,article,Schedule,,[]
"Corrections: July 9, 2014",2014-07-09,article,News,,[]
"Quotation of the Day for Wednesday, July 9, 2014",2014-07-09,article,Quote,,[]
Brazilians Confront Defeat in World Cup,2014-07-09,multimedia,Video,,"['World Cup (Soccer)', 'World Cup 2014 (Soccer)', 'Soccer']"
"Populist Hopeful Says He’s Likely Winner in Indonesia, Defeating Ex-General",2014-07-09,article,News,,['Elections']
Student Crossword | Bodies of Water,2014-07-09,article,News,,[]
K.K.R. Takes Majority Stake in Scottish Oil Rig Equipment Supplier,2014-07-09,article,News,,"['Offshore Drilling and Exploration', 'Oil (Petroleum) and Gasoline', 'Private Equity']"
Tibetan Writer Says Invitation to U.S. Embassy Preceded House Arrest,2014-07-09,article,News,,[]
6 Q’s About the News | The Animal Whisperer,2014-07-09,article,News,,[]
Photojournalists Push Project in Spain,2014-07-09,article,News,,"['Documentary Films and Programs', 'Photography', 'Pulitzer Prizes']"
Macau Activists Plan Hong Kong-Style Poll on Greater Democracy,2014-07-09,article,News,,['Referendums']
Israeli Leader Vows to Intensify Gaza Attacks on Hamas,2014-07-09,article,News,,['Palestinians']
AbbVie Backtracks on Comments in Shire Bid,2014-07-09,article,News,,"['Corporate Taxes', 'Drugs (Pharmaceuticals)', 'Mergers, Acquisitions and Divestitures', 'Stocks and Bonds']"
Britain Pushes Hard on Nuclear Power,2014-07-09,article,News,,[]
Your Wednesday Briefing,2014-07-09,article,News,,[]
New York Today: A Marijuana-Friendly Borough,2014-07-09,article,News,,[]
Maison Martin Margiela: Winter 2014 Couture,2014-07-09,multimedia,Slideshow,,[]
"Ground Battles in Afghanistan Contribute to Surge in Civilian Casualties, U.N. Says",2014-07-09,article,News,,"['Afghanistan War (2001- )', 'Civilian Casualties']"
Iraqi Premier Blames Kurds for Advances by Militants,2014-07-09,article,News,,"['Murders and Attempted Murders', 'Sunni Muslims', 'Shiite Muslims', 'Kurds']"
Morning Views,2014-07-09,article,News,,"['Clean Air Act', 'Clean Water Act', 'Illegal Immigration', 'Immigration and Emigration']"
The French Do Buy Books. Real Books.,2014-07-09,article,Op-Ed,,"['Books and Literature', 'Book Trade and Publishing', 'E-Commerce']"
What I Learned From Firing My Employee of 20 Years,2014-07-09,article,News,,"['Executives and Management (Theory)', 'Small Business']"
Plan to Give Former King Immunity Splits Spain,2014-07-09,article,News,,"['Corruption (Institutional)', 'Paternity Suits', 'Law and Legislation']"
Does Birth Control Coverage Pay for Itself?,2014-07-09,article,News,,"['Birth Control and Family Planning', 'Health Insurance and Managed Care']"
"Yea, Oops, Nay: Voting Mistakes in Congress",2014-07-09,article,News,,"['United States Politics and Government', 'Voting Machines', 'Law and Legislation']"
Not Your Ordinary Bananas Foster,2014-07-09,article,News,,"['Cooking and Cookbooks', 'Bananas', 'Pudding']"
"10-Year Term on Graft Charges for C. Ray Nagin, Former Mayor of New Orleans",2014-07-09,article,News,,"['Sentences (Criminal)', 'Bribery and Kickbacks', 'Ethics and Official Misconduct', 'Hurricane Katrina (2005)']"
Morning Agenda: Prosecutors’ Perfect Streak Ends,2014-07-09,article,News,,[]
New Case of Spying Is Alleged by Germany,2014-07-09,article,News,,"['Espionage and Intelligence Services', 'Search and Seizure', 'Surveillance of Citizens by Government', 'United States International Relations']"
Daily Report: Yelp Joins Opposition to Google’s European Antitrust Settlement,2014-07-09,article,News,,"['Antitrust Laws and Competition Issues', 'Search Engines']"
1914: Aviators Attempt London-Paris Return Flight,2014-07-09,article,News,,['Pilots']
Revisiting His Arsenal of Misanthropy,2014-07-09,article,News,,"['Music', 'Rock Music']"
Li Chengpeng’s Social Media and Blog Accounts Suspended,2014-07-09,article,News,,"['Blogs and Blogging (Internet)', 'Computers and the Internet']"
Disappointed Fireworks Fans in Brooklyn,2014-07-09,article,News,,"['Fireworks', 'Independence Day (US) (July 4)']"
Paris Couture Week: Armani Privé Fall/Winter 2014,2014-07-09,article,News,,"['Couture (Fashion)', 'Fashion and Apparel']"
American Apparel Deal Gives Retailer a Lifeline,2014-07-09,article,News,,"['Fashion and Apparel', 'Factories and Manufacturing', 'Shopping and Retail']"
Finding Ways to Use Big Data to Help Small Shops,2014-07-09,article,News,,"['Computers and the Internet', 'Data-Mining and Database Marketing', 'Small Business', 'Entrepreneurship']"
Shielding Modems When Lightning Strikes,2014-07-09,article,Question,,"['Computers and the Internet', 'Lightning', 'Software']"
Elie Saab: Winter 2014 Couture,2014-07-09,multimedia,Slideshow,,[]
App Smart | Perfect Beach Day,2014-07-09,multimedia,Video,,"['Surfing', 'Beaches', 'Mobile Applications']"
"As New York Landlords Push Buyouts, Renters Resist",2014-07-09,article,News,,"['Evictions', 'Real Estate and Housing (Residential)', 'Landlords', 'Rent Control and Stabilization', 'Renting and Leasing (Real Estate)', 'Law and Legislation', 'Affordable Housing']"
"Before Slapping On the Sunscreen, Check the Phone",2014-07-09,article,News,,"['Mobile Applications', 'Android (Operating System)', 'iOS (Operating System)', 'Windows (Operating System)', 'BlackBerry (Handheld Device)', 'Beaches', 'Surfing', 'Travel and Vacations']"
Snowden Asks Russia to Extend Asylum,2014-07-09,article,News,,"['Surveillance of Citizens by Government', 'Asylum, Right of']"
"At 27,000 Feet, an Air Force Plea to Preserve Its Bombers",2014-07-09,article,News,,"['Military Aircraft', 'Federal Budget (US)', 'United States Defense and Military Forces']"
Making Fun,2014-07-09,article,Review,,['Books and Literature']
The Religious Penumbra Revisited,2014-07-09,article,News,,"['Christians and Christianity', 'Divorce, Separations and Annulments', 'Marriages', 'Protestant Churches', 'Teenagers and Adolescence', 'Youth']"
Cockpit Footage of Israeli Airstrikes,2014-07-09,multimedia,Video,,[]
"For Young Bankers, the Job Starts Now",2014-07-09,article,News,,[]
"Public Opinion Against Russia Hardens After Ukraine Intervention, Poll Finds",2014-07-09,article,News,,['Polls and Public Opinion']
"On the Road to Samarra, Glimpses of Iraq’s New Fractured Reality",2014-07-09,article,News,,['Shiite Muslims']
U.S. Program Can Take Heart in Germany’s Win,2014-07-09,article,News,,"['World Cup 2014 (Soccer)', 'Soccer']"
"Nearly 3,500 Years Old, an Egyptian Monument Gets a Laser Cleaning",2014-07-09,article,News,,"['Monuments and Memorials (Structures)', 'Restoration and Renovation', 'Laser (Light Amplification by Stimulated Emission of Radiation)', 'Rock and Stone']"
Argentina and the Netherlands: The Confident vs. the Humble,2014-07-09,article,News,,"['World Cup 2014 (Soccer)', 'Soccer', 'Polls and Public Opinion']"
What’s News in Washington: Obama to Meet With Perry,2014-07-09,article,News,,"['Immigration and Emigration', 'United States Politics and Government']"
Karlie Kloss Shares Her Summertime Fitness Tips,2014-07-09,article,News,,['Exercise']
Bedford-Stuyvesant: Diverse and Changing,2014-07-09,article,News,,['Real Estate and Housing (Residential)']
Microsoft Taking Steps to Comply With the Right to be Forgotten,2014-07-09,article,News,,"['Computers and the Internet', 'Privacy', 'Search Engines']"
FINalternatives Is Sold to Upstart Media Firm,2014-07-09,article,News,,['Stocks and Bonds']
Jean Paul Gaultier: Winter 2014 Couture,2014-07-09,multimedia,Slideshow,,[]
Staples vs. Sutures After C-Section,2014-07-09,article,News,,"['Caesarean Section', 'Medicine and Health', 'Pregnancy and Childbirth']"
The Next Step for Rengan Rajaratnam,2014-07-09,article,News,,"['Fifth Amendment (US Constitution)', 'Insider Trading', 'Securities and Commodities Violations', 'Suits and Litigation (Civil)']"
"What You Get for ... $2,500,000",2014-07-09,article,News,,['Real Estate and Housing (Residential)']
"Following Her Parents’ Lead, Chelsea Clinton Takes Stage as a Paid Speaker",2014-07-09,article,News,,['Speeches and Statements']
"Playing Dress-Up, the Musical",2014-07-09,article,News,,['Theater']
Aide to India’s New Prime Minister Gets Top Party Post,2014-07-09,article,News,,"['Politics and Government', 'Appointments and Executive Changes']"
Reduce Your Monthly Digital Bills,2014-07-09,multimedia,Video,,"['Personal Finances', 'Budgets and Budgeting', 'Video Recordings, Downloads and Streaming', 'Cable Television', 'Music', 'Data Storage', 'Computers and the Internet']"
When a Start-Up Creation Myth Hits Reality,2014-07-09,article,News,,[]
Cutting the High Cost of Digital Living,2014-07-09,article,News,,"['Personal Finances', 'Budgets and Budgeting', 'Cable Television', 'Computers and the Internet', 'Music', 'Video Recordings, Downloads and Streaming', 'Data Storage', 'Television']"
A Familiar Destiny to Photograph the New China,2014-07-09,multimedia,Slideshow,,[]
Show Could Be BBC’s Answer to ‘Game of Thrones’,2014-07-09,article,News,,[]
1920: The ‘World War’ Gets a Number,2014-07-09,article,News,,[]
Putting the Con in Reformicon,2014-07-09,article,News,,[]
Why a Merger of Pet Retailers Would Make Sense,2014-07-09,article,News,,"['Mergers, Acquisitions and Divestitures', 'Pets', 'Shareholder Rights and Activism']"
New Hampshire Residents: Did You Sign up for Insurance Through the Affordable Care Act?,2014-07-09,multimedia,Interactive Feature,,['Patient Protection and Affordable Care Act (2010)']
Salix Pharmaceuticals to Buy Irish Company and Reincorporate Overseas,2014-07-09,article,News,,"['Corporate Taxes', 'Drugs (Pharmaceuticals)', 'Mergers, Acquisitions and Divestitures']"
This Year’s Special Guest at Sun Valley? Word Is John Kerry,2014-07-09,article,News,,[]
"Stir-Fries, Mastered. Next Up, the Easy Vegetarian Gratin",2014-07-09,article,News,,"['Cooking and Cookbooks', 'Parenting', 'Vegetables', 'Vegetarianism']"
"Obama, on Texas Trip, Will Face Immigration Critics",2014-07-09,article,News,,"['Immigration and Emigration', 'Midterm Elections (2014)']"
Defending Champion Quits During a Stage of Chaos and Cobblestones,2014-07-09,article,News,,"['Tour de France (Bicycle Race)', 'Bicycles and Bicycling']"
"Classical Playlist: ‘West Side Story,’ Schubert, Haydn and More",2014-07-09,article,News,,['Classical Music']
Congress Unlikely to Step In as L.I.R.R. Strike Looms,2014-07-09,article,News,,"['Strikes', 'Organized Labor', 'Transit Systems', 'Railroads']"
Romance Is in the Air,2014-07-09,article,Review,,['Music']
Nike and Manchester United Set to End Equipment Partnership,2014-07-09,article,News,,"['Soccer', 'ADVERTISING AND MARKETING']"
More on Class and Monetary Policy,2014-07-09,article,News,,[]
U.S. Open Singles Champions to Earn $3 Million Apiece,2014-07-09,article,News,,"['Tennis', 'United States Open (Tennis)']"
"One Step From World Cup Final, Argentina Channels Di Stéfano",2014-07-09,article,News,,"['World Cup 2014 (Soccer)', 'Soccer']"
Today in Small Business: Paying Employees After a Fire,2014-07-09,article,News,,"['Small Business', 'Start-ups']"
"U.S. Spied on 5 American Muslims, a Report Says",2014-07-09,article,News,,"['Surveillance of Citizens by Government', 'Muslim Americans', 'Muslims and Islam', 'Foreign Intelligence Surveillance Act (FISA)']"
1939: Spinsters Block Tulsa Airport,2014-07-09,article,News,,['AIRPORTS']
James Patterson’s ‘Maximum Ride’ Books to Be a Series on YouTube,2014-07-09,article,News,,"['Books and Literature', 'Computers and the Internet', 'Video Recordings, Downloads and Streaming', 'Web-Original Programming']"
Wheelies: The Future Infiniti Edition,2014-07-09,article,News,,"['Automobiles', 'Electric and Hybrid Vehicles']"
Air Sirens Puncture Life in Affluent Tel Aviv Suburbs,2014-07-09,article,News,,['Palestinians']
Once in a Blue Moon,2014-07-09,article,News,,['Crossword Puzzles']
Paris Couture Week: Maison Martin Margiela Fall/Winter 2014,2014-07-09,article,News,,"['Couture (Fashion)', 'Fashion and Apparel']"
"Kenny Kingston, ‘Psychic to the Stars,’ Dies at 87",2014-07-09,article,Obituary (Obit),,"['Psychics and Psychic Phenomena', 'Celebrities', 'Deaths (Obituaries)']"
