headline,date,doc_type,material_type,section,keywords
"General Mills Is Serving Wheaties, the Breakfast of Champions, to Younger Consumers",2014-07-01,article,News,,"['Cereals', 'Online Advertising', 'ADVERTISING AND MARKETING', 'Computers and the Internet', 'Social Media', 'Mixed Martial Arts', 'Soccer']"
"At Walgreen, Renouncing Corporate Citizenship",2014-07-01,article,News,,[]
"Mergers Hit a 7-Year High, Propelled by a Series of Blockbuster Deals",2014-07-01,article,News,,"['Drugs (Pharmaceuticals)', 'Health Insurance and Managed Care', 'Mergers, Acquisitions and Divestitures', 'Telephones and Telecommunications']"
Texas: Panel Rules Agent Can Be Sued Over Shooting Teenager Across Border,2014-07-01,article,Brief,,"['Police Brutality, Misconduct and Shootings', 'Murders and Attempted Murders', 'Suits and Litigation (Civil)']"
Official Seeks Restored Trust in Military Care,2014-07-01,article,News,,"['Veterans', 'United States Defense and Military Forces', 'Hospitals', 'Medicine and Health', 'Accidents and Safety', 'Deaths (Fatalities)', 'Health Insurance and Managed Care']"
"UnitedHealth, an Insurer Switching Roles, Helps Hospitals on Medicare Billing",2014-07-01,article,News,,"['Health Insurance and Managed Care', 'Medicare', 'Hospitals', 'Regulation and Deregulation of Industry']"
Russian Hackers Targeting Oil and Gas Companies,2014-07-01,article,News,,"['Cyberwarfare', 'Industrial Espionage', 'Natural Gas', 'Oil (Petroleum) and Gasoline', 'Energy and Power']"
Argentina Faces a Deadline for Hedge Fund Payments,2014-07-01,article,News,,"['Government Bonds', 'Hedge Funds']"
Veteran Wages a New Fight: For His Home,2014-07-01,article,News,,"['Foreclosures', 'Mortgages']"
N.C.A.A. Is Reopening Inquiry Into Academic Violations at North Carolina,2014-07-01,article,News,,"['Basketball (College)', 'Football (College)', 'Colleges and Universities', 'College Athletics']"
Diocese of Kansas City-St. Joseph to Pay for Failure to Report Abuse,2014-07-01,article,News,,"['Priests', 'Sex Crimes', 'Child Abuse and Neglect', 'Child Pornography']"
Ukrainian President Ends Cease-Fire With Rebels,2014-07-01,article,News,,"['Defense and Military Forces', 'Embargoes and Sanctions', 'International Relations']"
"A Conduit for Russian Gas, Tangled in Europe’s Conflicts",2014-07-01,article,News,,"['Pipelines', 'Natural Gas', 'International Trade and World Market', 'Embargoes and Sanctions']"
"African Teams Head Home, Cash in Hand",2014-07-01,article,News,,"['Soccer', 'World Cup 2014 (Soccer)']"
"More Cases on Religion Await, With Eye on Opinion by Alito",2014-07-01,article,News,,"['Birth Control and Family Planning', 'Religion-State Relations', 'Corporations', 'Health Insurance and Managed Care', 'Suits and Litigation (Civil)']"
"For Iraq, Potential Leader With a Tarnished Past",2014-07-01,article,News,,[]
ISIS’ Goals for Iraq and Syria,2014-07-01,multimedia,Video,,"['Muslims and Islam', 'Social Media', 'World Cup 2014 (Soccer)']"
A Creative Algeria Surprises but Cannot Defeat Germany,2014-07-01,article,News,,"['World Cup 2014 (Soccer)', 'Soccer']"
V.A. Nominee McDonald Faced Criticism at Procter & Gamble,2014-07-01,article,News,,['Veterans']
A Long History of Rebellion in the Mountains of Pakistan,2014-07-01,article,News,,"['Pashtun (Ethnic Group)', 'Terrorism']"
ISIS Threatens Al Qaeda as Flagship Movement of Extremists,2014-07-01,article,News,,"['Terrorism', 'Muslims and Islam', 'Sunni Muslims']"
Christie Vetoes 2015 Pension-Paying Budget,2014-07-01,article,News,,"['Budgets and Budgeting', 'Pensions and Retirement Plans']"
"Winning Lottery Numbers for June 30, 2014",2014-07-01,article,List,,['Lotteries']
Obama Discusses Immigration Reform,2014-07-01,multimedia,Video,,"['Immigration', 'United States Politics and Government']"
"In Case of Shootout, Who Kicks for U.S.?",2014-07-01,article,List,,"['World Cup 2014 (Soccer)', 'Soccer']"
"World Cup 2014: Belgium Eliminates U.S.A., 2-1",2014-07-01,multimedia,Interactive Feature,,"['World Cup 2014 (Soccer)', 'Soccer']"
No Bombast (for Now) as Toronto Mayor Comes Back,2014-07-01,article,News,,"['Elections, Mayors', 'Therapy and Rehabilitation', 'Drug Abuse and Traffic', 'Alcohol Abuse', 'Mayors', 'Drunken and Reckless Driving', 'Politics and Government']"
Burden of Proof,2014-07-01,article,News,,['Crossword Puzzles']
The Evolution of Trust,2014-07-01,article,Op-Ed,,"['Regulation and Deregulation of Industry', 'Renting and Leasing (Real Estate)', 'Computers and the Internet', 'Social Conditions and Trends']"
"World Cup 2014: Argentina Defeats Switzerland, 1-0",2014-07-01,multimedia,Interactive Feature,,"['World Cup 2014 (Soccer)', 'Soccer']"
From 9/11 to BP to G.M.,2014-07-01,article,Op-Ed,,"['Reparations', 'Traffic Accidents and Safety', 'Suits and Litigation (Civil)', 'Automobile Safety Features and Defects', 'Recalls and Bans of Products']"
Limiting Rights: A Hit to Collective Bargaining,2014-07-01,article,Editorial,,"['Organized Labor', 'Collective Bargaining', 'Government Employees', 'First Amendment (US Constitution)', 'Editorials']"
Limiting Rights: Imposing Religion on Workers,2014-07-01,article,Editorial,,"['Birth Control and Family Planning', 'Discrimination', 'Women and Girls', 'Religion-State Relations', 'Freedom of Religion', 'Patient Protection and Affordable Care Act (2010)', 'Health Insurance and Managed Care', 'Editorials']"
Chilean Court Rules U.S. Had Role in Murders,2014-07-01,article,News,,"['Murders and Attempted Murders', ""Coups D'Etat and Attempted Coups D'Etat"", 'Espionage and Intelligence Services', 'United States Defense and Military Forces']"
G.M. Victim Compensation: How the Plan Works,2014-07-01,article,News,,"['Automobile Safety Features and Defects', 'Recalls and Bans of Products', 'Reparations']"
Mr. Obama’s Immigration Challenge,2014-07-01,article,Editorial,,"['Immigration and Emigration', 'Children and Childhood', 'Illegal Immigration', 'Deportation', 'United States Politics and Government', 'Editorials']"
Nancy Garden Dies at 76; Wrote Young-Adult Novel of Lesbians,2014-07-01,article,Obituary (Obit),,"['Homosexuality and Bisexuality', 'Deaths (Obituaries)', 'Books and Literature']"
Reduced Charge for Boy in Fatal Bronx Stabbing,2014-07-01,article,News,,['Murders and Attempted Murders']
"Whistle in Mouth, Target on Back",2014-07-01,article,News,,"['World Cup 2014 (Soccer)', 'Soccer', 'Officiating (Sports)', 'World Cup 2010 (Soccer)']"
Census Estimates Show Another Increase in New York City’s Non-Hispanic White Population,2014-07-01,article,News,,"['Race and Ethnicity', 'Census', 'Population', 'Hispanic-Americans']"
A Grieving Father Pulls a Thread That Unravels BNP’s Illegal Deals,2014-07-01,article,News,,"['Banking and Financial Institutions', 'Embargoes and Sanctions', 'Money Laundering']"
"Knicks’ Top Draft Selection Focuses on His Situation, Not on Anthony’s",2014-07-01,article,News,,"['Basketball', 'Draft and Recruitment (Sports)', 'Free Agents (Sports)']"
Holder Announces BNP Paribas Plea Deal,2014-07-01,multimedia,Video,,[]
"Apartment Inventory Is Up in Manhattan; Prices Are, Too",2014-07-01,article,News,,['Real Estate and Housing (Residential)']
Cashen’s Gift on the Mets Was Magic,2014-07-01,article,An Appraisal,,"['Baseball', 'Nineteen Hundred Eighties']"
Weekends at a Bronx Beach That Feature Backboards Instead of Surfboards,2014-07-01,article,News,,"['Basketball', 'Beaches', 'Series']"
"Arizona Town Recalls Wildfire, and 19 Who Died Battling It",2014-07-01,article,News,,"['Fires and Firefighters', 'Deaths (Fatalities)', 'Wildfires']"
A Ruling That Both Sides Can Run With,2014-07-01,article,News Analysis,,"['Women and Girls', 'Midterm Elections (2014)', 'Birth Control and Family Planning', 'Voting and Voters', 'Polls and Public Opinion', 'Health Insurance and Managed Care', 'Patient Protection and Affordable Care Act (2010)']"
Mets Waste Lead in Loss to Braves,2014-07-01,article,News,,['Baseball']
Mexican Soldiers Wage Bloody Battle With Gang,2014-07-01,article,News,,"['Organized Crime', 'Defense and Military Forces', 'Gangs', 'Firearms', 'Deaths (Fatalities)', 'Drug Abuse and Traffic', 'Kidnapping']"
"Job Seeker Wounds 2 Then Kills Himself at Brooklyn Workshop, Police Say",2014-07-01,article,News,,"['Hostages', 'Suicides and Suicide Attempts', 'Murders and Attempted Murders']"
"Blade, a Helicopter-Booking App, to Partner With Uber",2014-07-01,article,News,,"['Helicopters', 'Mobile Applications', 'Start-ups']"
Word of the Day | politic,2014-07-01,article,News,,[]
California Prosecutor Sues G.M. Over Sprawling Recall,2014-07-01,article,News,,['Automobile Safety Features and Defects']
Yankees Rally Twice but Fall Closer to .500,2014-07-01,article,News,,['Baseball']
17 Companies File Casino Plans With New York State in Push for 4 Gambling Licenses,2014-07-01,article,News,,"['Casinos', 'Gambling', 'Labor and Jobs']"
New York’s Happiest,2014-07-01,article,News,,[]
"Today’s World Cup Matches: July 1, 2014",2014-07-01,article,News,,"['World Cup 2014 (Soccer)', 'Soccer']"
What’s on Tuesday,2014-07-01,article,Schedule,,[]
Hong Kong Survey Finds Record Dissatisfaction With Beijing,2014-07-01,article,News,,['Polls and Public Opinion']
"Quotation of the Day for Tuesday, July 1, 2014",2014-07-01,article,Quote,,[]
"Corrections: July 1, 2014",2014-07-01,article,News,,[]
Officer’s Conviction in Cannibalism Case Overturned,2014-07-01,article,News,,"['Kidnapping', 'Police Brutality, Misconduct and Shootings']"
Student Crossword | Economics Basics,2014-07-01,article,News,,[]
"Huge Crowds Turn Out for Pro-Democracy March in Hong Kong, Defying Beijing",2014-07-01,article,News,,"['Demonstrations, Protests and Riots']"
"As Iraqi Violence Rages, Lawmakers Fail to Reach Deal on New Government",2014-07-01,article,News,,"['Legislatures and Parliaments', 'Deaths (Fatalities)', 'Civilian Casualties']"
China Reaches Out to Myanmar on Maritime Dispute,2014-07-01,article,News,,"['Embargoes and Sanctions', 'Human Rights and Human Rights Violations', 'Offshore Drilling and Exploration', 'United States International Relations']"
6 Q’s About the News | Key Supreme Court Decisions in 2014,2014-07-01,article,News,,[]
Short-Selling of Banco Espírito Santo Briefly Banned,2014-07-01,article,News,,"['Appointments and Executive Changes', 'Short Selling', 'Stocks and Bonds']"
How Would Chuck Norris Vote?,2014-07-01,article,News,,"['Endorsements', 'Tea Party Movement', 'Midterm Elections (2014)', 'Social Media', 'Political Advertising']"
Falling for the Photo in Staten Island,2014-07-01,article,News,,"['Bridges and Tunnels', 'Photography']"
"French Ex-Leader Questioned in Graft Inquiry, Imperiling Comeback Hopes",2014-07-01,article,News,,"['Campaign Finance', 'Corruption (Institutional)', 'Bribery and Kickbacks']"
BNP Paribas Is Confident It Can Absorb the Blow of a Record Fine,2014-07-01,article,News,,"['Embargoes and Sanctions', 'Fines (Penalties)']"
Your Tuesday Briefing,2014-07-01,article,News,,[]
U.S.A. and Belgium: A Long-Running Battle for Supremacy Continues ,2014-07-01,article,News,,"['World Cup 2014 (Soccer)', 'Soccer', 'Comic Books and Strips', 'Waffles', 'Tennis', 'Chocolate', 'ALCOHOLIC BEVERAGES']"
New York Today: Belgians Among Us,2014-07-01,article,News,,[]
Modest Euro Zone Growth Fails to Dent Unemployment Rate,2014-07-01,article,News,,"['European Sovereign Debt Crisis (2010- )', 'Unemployment']"
Putin Warns Again of Force as Ukraine Fighting Spreads,2014-07-01,article,News,,['Defense and Military Forces']
Morning Views,2014-07-01,article,News,,[]
Housing: Small Economic Sector With a Big Impact,2014-07-01,article,News,,"['United States Economy', 'Real Estate and Housing (Residential)', 'Gross Domestic Product', 'Recession and Depression']"
1969: A Warning on Global Warming,2014-07-01,article,News,,"['Global Warming', 'Water Pollution']"
When Data Can Do More Harm Than Good,2014-07-01,article,News,,"['Data-Mining and Database Marketing', 'Small Business']"
The Incredible Shrinking Tech Spending Projections,2014-07-01,article,News,,['Cloud Computing']
Obama and Iraq,2014-07-01,article,Op-Ed,,[]
1939: Joliot Seeks Uranium Advance,2014-07-01,article,News,,"['Chemistry', 'Science and Technology', 'Uranium']"
A Closer Look at Simplifying Financial Aid Applications,2014-07-01,article,News,,"['Financial Aid (Education)', 'Colleges and Universities', 'Federal Aid (US)', 'Tax Credits, Deductions and Exemptions']"
Sparse Turnout at Pro-China Rally in Hong Kong,2014-07-01,article,News,,"['Demonstrations, Protests and Riots', 'Luxury Goods and Services']"
A Trail of Clues Leading to Victims and Heartbreak,2014-07-01,article,News,,"['Kidnapping', 'Deaths (Fatalities)', 'Palestinians', 'Terrorism', 'Murders and Attempted Murders']"
Morning Agenda: The Road to BNP’s Guilty Plea,2014-07-01,article,News,,[]
"Seamy World of the Tabloid, Bared",2014-07-01,article,Review,,['Theater']
What’s News in Washington: The Politics of Women,2014-07-01,article,News,,[]
Sotheby’s to Auction Mellon’s Treasures,2014-07-01,article,News,,"['Art', 'Auctions']"
In Performance: Benjamin Scheuer of ‘The Lion’,2014-07-01,article,News,,['Theater']
‘Orange Is the New Black’ Recap: Of White Girls and Privilege,2014-07-01,article,News,,[]
When Spell-Check Can’t Help,2014-07-01,article,News,,[]
Japan Announces a Military Shift to Thwart China,2014-07-01,article,News,,"['Defense and Military Forces', 'Constitutions', 'International Relations']"
"In Testimony, Agent Calls Pistorius Caring",2014-07-01,article,News,,['Murders and Attempted Murders']
Limping in Solidarity and Leaping for Joy,2014-07-01,article,Review,,['Dancing']
"Turkish Premier Runs for President, an Office He Plans to Strengthen",2014-07-01,article,News,,['Elections']
European Union Reduces Cellphone Roaming Charges,2014-07-01,article,News,,"['Smartphones', 'Cellular Telephones', 'Prices (Fares, Fees and Rates)', 'Telephones and Telecommunications', 'Computers and the Internet']"
The Biological Grandparent Trap,2014-07-01,article,News,,"['ARTIFICIAL INSEMINATION', 'Grandparents', 'Homosexuality and Bisexuality', 'Parenting', 'Sperm']"
French Ban on Face Veils Upheld by European Rights Court,2014-07-01,article,News,,"['Muslim Veiling', 'Women and Girls']"
Longevity Insurance Joins the Menu of Retirement Plan Options,2014-07-01,article,News,,"['Retirement', 'ANNUITIES', 'Pensions and Retirement Plans', '401(k), 403(b) and 457 Plans', 'Income']"
An Art Review in the Subway,2014-07-01,article,News,,"['Art', 'Commuting', 'Subways']"
Cameroon Investigates Match-Fixing Charges,2014-07-01,article,News,,"['World Cup 2014 (Soccer)', 'Gambling', 'Ethics and Official Misconduct', 'Soccer']"
"By Design | Just North of Paris, A New Concept Store Where Everything Is White",2014-07-01,article,News,,['Shopping and Retail']
"Lazy, Hazy Days of Celebration",2014-07-01,article,News,,['Crossword Puzzles']
After Aereo,2014-07-01,article,News,,[]
Are Categories Like Immigrant Fiction and ‘New American’ Fiction Valid or Worthwhile?,2014-07-01,article,News,,"['Books and Literature', 'Writing and Writers']"
"Chronicler Recalls a Bridge’s Rising, 50 Years Later",2014-07-01,article,News,,"['Building (Construction)', 'Bridges and Tunnels', 'Series']"
Scenes of Protest in Hong Kong,2014-07-01,multimedia,Video,,['Democracy (Theory and Philosophy)']
An Even More Nuanced Breakdown of the Supreme Court,2014-07-01,article,News,,['Decisions and Verdicts']
Twitter Names Ex-Goldman Banker Anthony Noto as Chief Financial Officer,2014-07-01,article,News,,['Appointments and Executive Changes']
Amanda Knox Co-Defendant Changes Strategy,2014-07-01,article,News,,"['False Arrests, Convictions and Imprisonments', 'Murders and Attempted Murders']"
"Big Bowl With Spicy Brown Bean, Squash and Corn Succotash",2014-07-01,article,recipe,,"['Cooking and Cookbooks', 'Recipes', 'Diet and Nutrition', 'Beans']"
G.M. Sales Rise as Buyers Ignore Recalls,2014-07-01,article,News,,"['Automobiles', 'Company Reports']"
Ruling in Cannibal Case Revives Debate Over When a Fantasy Crosses a Criminal Line,2014-07-01,article,News,,"['Kidnapping', 'Decisions and Verdicts', 'Computers and the Internet', 'Police Brutality, Misconduct and Shootings']"
"Online, the Lying Is Easy",2014-07-01,article,Review,,['Books and Literature']
Learned Macroeconomic Helplessness,2014-07-01,article,News,,[]
Two-Bean and Tuna Salad,2014-07-01,article,recipe,,"['Tuna', 'Salads', 'Beans', 'Recipes']"
1964: Luebke Is Re-elected in Berlin,2014-07-01,article,News,,['Elections']
"Tostadas With Smashed Black Beans or Vaqueros, Salsa Fresca and Avocado",2014-07-01,article,recipe,,"['Beans', 'Recipes', 'Diet and Nutrition', 'Tortillas']"
G.O.P. Power Broker in Albany Accused of Lying to F.B.I.,2014-07-01,article,News,,"['State Legislatures', 'Tax Evasion', 'Perjury']"
Argentina vs. Switzerland: World Cup 2014 Live Blog,2014-07-01,article,News,,"['Soccer', 'World Cup 2014 (Soccer)']"
Teenager Topples Top-Ranked Nadal in Round of 16,2014-07-01,article,News,,"['Tennis', 'Wimbledon Tennis Tournament']"
I Am the Real Nick Cave,2014-07-01,article,News,,"['Music', 'Documentary Films and Programs', 'Movies']"
In Store | A.P.C. Sets Up Shop at the Wythe Hotel,2014-07-01,article,News,,[]
Arugula and Corn Salad With Roasted Red Peppers and White Bean,2014-07-01,article,recipe,,"['Corn', 'Arugula', 'Salads', 'Recipes']"
New York Summer Stories: Getting Out of Town,2014-07-01,article,News,,[]
Facebook Flunks Its Apology,2014-07-01,article,News,,[]
World Cup 2014: Penalty Kick Strategy,2014-07-01,multimedia,Video,,"['Soccer', 'World Cup 2014 (Soccer)']"
NASA Delays Launching of Carbon Observatory,2014-07-01,article,News,,"['Greenhouse Gas Emissions', 'Space and Astronomy', 'Carbon Dioxide', 'Air Pollution', 'Telescopes and Observatories']"
Wheelies: The Flying Honda Edition,2014-07-01,article,News,,"['Automobile Safety Features and Defects', 'AIRLINES AND AIRPLANES', 'Google Phone', 'Android (Operating System)', 'Electric and Hybrid Vehicles', 'Driver Distraction and Fatigue', 'Automobiles']"
American Homes Acquires Rival in Buy-to-Rent Business,2014-07-01,article,News,,"['Foreclosures', 'Mergers, Acquisitions and Divestitures', 'Real Estate and Housing (Residential)', 'Real Estate Investment Trusts']"
Saudi Arabia Donates $500 Million to Help Displaced Iraqis,2014-07-01,article,News,,"['Humanitarian Aid', 'Refugees and Displaced Persons']"
The N.S.A. Can Spy on These 193 Foreign Governments,2014-07-01,article,News,,"['Espionage and Intelligence Services', 'Surveillance of Citizens by Government']"
Who’s a ‘Christian’? Avoiding Labels in the Hobby Lobby Coverage,2014-07-01,article,News,,[]
"Penalties for Companies, but Executives Often Emerge Unscathed",2014-07-01,article,News,,"['Banking and Financial Institutions', 'Embargoes and Sanctions', 'Ethics and Official Misconduct', 'Tax Evasion']"
Flame Retardants Are Everywhere,2014-07-01,article,News,,"['Flame Retardants', 'Hazardous and Toxic Substances']"
Maria Sharapova Ousted by Angelique Kerber at Wimbledon,2014-07-01,article,News,,"['Wimbledon Tennis Tournament', 'Tennis']"
4 Are Rescued Days After Building Collapse in South India,2014-07-01,article,News,,"['Deaths (Fatalities)', 'Buildings (Structures)', 'Accidents and Safety', 'Building (Construction)', 'Rescues', 'Real Estate and Housing (Residential)']"
The Illogic of Employer-Sponsored Health Insurance,2014-07-01,article,News,,"['Health Insurance and Managed Care', 'Employee Fringe Benefits', 'Patient Protection and Affordable Care Act (2010)', 'Decisions and Verdicts']"
Orwell Birthplace in India to Become a Museum,2014-07-01,article,News,,"['Museums', 'Writing and Writers']"
Q & A: Chocolate Ganache,2014-07-01,article,News,,"['Cooking and Cookbooks', 'Chocolate']"
Former Newspaper Editor to Oversee Pulitzer Prizes,2014-07-01,article,News,,"['Pulitzer Prizes', 'Colleges and Universities']"
"Noisy Predators Put Plants on Alert, Study Finds",2014-07-01,article,News,,"['Flowers and Plants', 'Ears and Hearing']"
American Soccer Fans Dominate FIFA’s Online Audience,2014-07-01,article,News,,"['Soccer', 'World Cup 2014 (Soccer)']"
"Your World Cup Ethical Questions, Answered",2014-07-01,article,News,,"['World Cup 2014 (Soccer)', 'Soccer']"
Bonus All-World-Cup Ethicist Column!,2014-07-01,article,News,,"['Ethicist, The (Times Column)', 'World Cup 2014 (Soccer)']"
Post Office to Release a Janis Joplin Stamp,2014-07-01,article,News,,"['Postal Service and Post Offices', 'Stamps (Postal)']"
Clip: ‘Tammy’,2014-07-01,multimedia,Video,,[]
Thousands Beat Path to Queens Cemetery to Remember a Jewish Leader,2014-07-01,article,News,,"['Jews and Judaism', 'Hasidism', 'Rabbis']"
Atmospheric Tunes from the Spring/Summer 2015 Paris Men’s Shows,2014-07-01,article,News,,['Music']
Today in Small Business: Skip the Morning Meeting,2014-07-01,article,News,,['Small Business']
"Rottapharm, an Italian Drug Maker,  Sets Price Range for I.P.O.",2014-07-01,article,News,,"['Drugs (Pharmaceuticals)', 'Initial Public Offerings', 'Stocks and Bonds']"
Curtain Call | The Designers of Paris Men’s Spring/Summer 2015 Fashion Week Take Their Bows,2014-07-01,article,News,,"['Fashion and Apparel', 'Men and Boys', 'Paris Fashion Week']"
The Secret of Belgium’s Success,2014-07-01,article,News,,[]
Curtain Call | Paris Men’s Fashion Week,2014-07-01,multimedia,Video,,[]
"Ever True to You, Local Parlor",2014-07-01,article,News,,"['Ice Cream and Frozen Desserts', 'States (US)']"
U.S.A. vs. Belgium: World Cup 2014 Live Blog,2014-07-01,article,News,,[]
An Ailing Serena Williams Abandons a Doubles Match,2014-07-01,article,News,,"['Tennis', 'Wimbledon Tennis Tournament']"
Fresh Ink for the Human Canvas,2014-07-01,article,News,,"['Skin', 'Tattoos', '3-D Devices and Effects']"
Pershing Square Said to Hire Credit Suisse for Allergan Fight,2014-07-01,article,News,,['Banking and Financial Institutions']
T.S.A. Fees for Air Trips to Rise,2014-07-01,article,News,,"['AIRLINES AND AIRPLANES', 'Prices (Fares, Fees and Rates)', 'Travel and Vacations']"
Nets General Manager Wants to Move Quickly to Replace Jason Kidd,2014-07-01,article,News,,['Basketball']
Russell Westbrook Moves Between Oklahoma City and Paris With Ease,2014-07-01,article,News,,"['Fashion and Apparel', 'Basketball', 'Paris Fashion Week', ""Men's Fashion Week"", 'Parties (Social)']"
"In BNP Paribas Case, an Example of How Mighty the Dollar Is",2014-07-01,article,News,,"['United States International Relations', 'US Dollar (Currency)', 'Embargoes and Sanctions', 'Banking and Financial Institutions']"
Hong Kong Challenges Beijing,2014-07-01,multimedia,Video,,"['Demonstrations, Protests and Riots', 'Referendums']"
Graco Recalls 1.9 Million Rear-Facing Infant Seats,2014-07-01,article,News,,"['Child Car Seats', 'Automobile Safety Features and Defects', 'Recalls and Bans of Products', 'Automobiles']"
"Messi, as Always Expected, Rescues Argentina",2014-07-01,article,News,,"['World Cup 2014 (Soccer)', 'Soccer']"
A Straw Purchaser Goes to Jail,2014-07-01,article,News,,"['Newtown, Conn, Shooting (2012)']"
The Culture War’s Sore Winners,2014-07-01,article,News,,"['Christians and Christianity', 'Conservatism (US Politics)', 'Liberalism (US Politics)', 'Religion-State Relations', 'Social Conditions and Trends']"
Compromise at the Supreme Court Veils Its Rifts,2014-07-01,article,News Analysis,,[]
Distracted Diva: The Second Screen Goes to the Opera,2014-07-01,article,News,,['Opera']
U.S. Accuses T-Mobile of Overbilling,2014-07-01,article,News,,"['Frauds and Swindling', 'Text Messaging', 'Wireless Communications']"
HSBC Settles Fraud Charges Over Foreclosure Fees Paid by the U.S. Government,2014-07-01,article,News,,[]
Funeral Held for Slain Israeli Teenager,2014-07-01,multimedia,Video,,"['Kidnapping', 'Funerals and Memorials', 'Defense and Military Forces', 'Terrorism', 'Murders and Attempted Murders']"
Census Considers How to Measure a More Diverse America,2014-07-01,article,News,,"['Race and Ethnicity', 'Census', 'Hispanic-Americans', 'ARAB-AMERICANS']"
"Summer Reading Contest Winner, Week One | 21st-Century Concentration Camps",2014-07-01,article,News,,"['Minorities', 'War Crimes, Genocide and Crimes Against Humanity']"
"Barclays Rehires Tim Luke, an Adviser to Britain’s Prime Minister",2014-07-01,article,News,,['Telephones and Telecommunications']
Tinder Is Target of Sexual Harassment Lawsuit,2014-07-01,article,News,,"['Suits and Litigation (Civil)', 'Sexual Harassment', 'Online Dating', 'Discrimination']"
"Prescription Overdose Deaths in Florida Plunge After Tougher Measures, Report Says",2014-07-01,article,News,,"['Drug Abuse and Traffic', 'OxyContin (Drug)', 'Pain-Relieving Drugs', 'Drugs (Pharmaceuticals)', 'Deaths (Fatalities)']"
"One Goal, Three Perspectives",2014-07-01,multimedia,Interactive Feature,,[]
Time With Turtles in North Carolina,2014-07-01,article,News,,"['Travel and Vacations', 'Turtles and Tortoises']"
The Latest Ice Cream Essentials,2014-07-01,article,News,,"['Ice Cream and Frozen Desserts', 'Desserts', 'Books and Literature']"
Rangers Begin Makeover Only Weeks From Stanley Cup Finals,2014-07-01,article,News,,"['Hockey, Ice']"
"Print Matters | In Honor of the World Cup, Three Beautiful Independent Sports Journals",2014-07-01,article,News,,"['Magazines', 'Soccer', 'World Cup 2014 (Soccer)']"
"For Singer, Boundaries Are There to Be Ignored",2014-07-01,article,Review,,['Music']
Grand Banks to Offer Dining and a Raw Bar on a Tall Ship,2014-07-01,article,News,,"['Restaurants', 'Chefs', 'Bars and Nightclubs']"
U.S. Justice Seems to Fall Harder on Foreign Companies,2014-07-01,article,News,,[]
Simona Halep Takes Away Zarina Diyas’s Forehand,2014-07-01,article,News,,"['Tennis', 'Wimbledon Tennis Tournament']"
Festival of New Musicals Announces Its Roster,2014-07-01,article,News,,"['Music', 'Theater']"
