headline,date,doc_type,material_type,section,keywords
Emerging Nations Bloc to Open Development Bank,2014-07-15,article,News,,"['Economic Conditions and Trends', 'International Trade and World Market', 'International Relations']"
Pfizer to Inject Youth Into the Aging Process,2014-07-15,article,News,,"['Drugs (Pharmaceuticals)', 'Elderly', 'ADVERTISING AND MARKETING']"
Robert W. Barone,2014-07-15,article,Interview,,['Real Estate (Commercial)']
Kite Fight,2014-07-16,multimedia,Video,,['Kites']
Recent Commercial Real Estate Transactions,2014-07-16,article,News,,['Real Estate and Housing (Residential)']
‘Kite Fight’,2014-07-16,article,Op-Ed,,"['Kites', 'Poverty']"
F.C.C. Is Deluged With Comments on Net Neutrality Rules,2014-07-16,article,News,,"['Net Neutrality', 'Regulation and Deregulation of Industry']"
A Push to Give Steadier Shifts to Part-Timers,2014-07-16,article,News,,"['Labor and Jobs', 'Families and Family Life', 'Part-Time Employment', 'Work-Life Balance', 'Law and Legislation']"
Lapses in the C.D.C.’s Labs ,2014-07-16,article,Editorial,,"['Laboratories and Scientific Equipment', 'Avian Influenza', 'ANTHRAX', 'Accidents and Safety', 'Editorials', 'Research']"
Highways Need a Higher Gas Tax,2014-07-16,article,Editorial,,"['Gasoline Tax (US)', 'Infrastructure (Public Works)', 'Roads and Traffic', 'Law and Legislation', 'United States Economy', 'Editorials']"
"On Kawara, Artist Who Found Elegance in Every Day, Dies at 81",2014-07-16,article,Obituary (Obit),,"['Art', 'Deaths (Obituaries)']"
Whisked Away for Tea With a Rebel in Ukraine,2014-07-16,article,News,,['Defense and Military Forces']
Wheelies: The Green Growth Edition,2014-07-16,article,News,,"['Automobiles', 'Electric and Hybrid Vehicles', 'Hazardous and Toxic Substances', 'Waste Materials and Disposal', 'Environment', 'Small Cars (Compact, Subcompact and Microcars)', 'Convertibles (Autos)']"
E-Cigarette Makers Are in an Arms Race for Exotic Vapor Flavors,2014-07-16,article,News,,"['Smoking and Tobacco', 'E-Cigarettes', 'Law and Legislation']"
What an L.I.R.R. Strike Could Look Like,2014-07-16,multimedia,Video,,"['Railroads', 'Strikes', 'Commuting', 'Organized Labor']"
Transit Cards to Replace Cash on Kenyan Minibuses Are a Hard Sell,2014-07-16,article,News,,"['Buses', 'Corruption (Institutional)', 'Bribery and Kickbacks', 'Taxation']"
"Order vs. Disorder, Part 2",2014-07-16,article,Op-Ed,,"['International Relations', 'Palestinians', 'Awakening Movement (Iraq)']"
Take a Wild Ride on Kenya’s Minibuses,2014-07-16,multimedia,Video,,"['Buses', 'Commuting', 'Corruption (Institutional)']"
"With Likable Late-Night Hosts, NBC and ABC See Their Images Improve",2014-07-16,article,News,,['Television']
"L.I.R.R. Workers, on Brink of Strike, Prepare for Life on the Picket Line",2014-07-16,article,News,,"['Organized Labor', 'Strikes', 'Railroads']"
Documents Show General Motors Kept Silent on Fatal Crashes,2014-07-16,article,News,,"['Automobile Safety Features and Defects', 'Deaths (Fatalities)', 'Recalls and Bans of Products']"
A Canadian’s Pitch for ISIS,2014-07-16,multimedia,Video,,"['Video Recordings, Downloads and Streaming', 'Muslims and Islam']"
"At NewYork-Presbyterian Hospital, Its Ex-C.E.O. Finds Lucrative Work ",2014-07-16,article,News,,"['Executive Compensation', 'Hospitals', 'Bonuses', 'Wages and Salaries']"
FIFA’s Dazed and Dated Attitude,2014-07-16,article,News,,"['Soccer', 'Concussions', 'World Cup 2014 (Soccer)']"
Appeals Panel Upholds Race in Admissions for University,2014-07-16,article,News,,"['AFFIRMATIVE ACTION', 'ADMISSIONS STANDARDS', 'Colleges and Universities', 'Race and Ethnicity', 'Minorities', 'Decisions and Verdicts']"
Where’s the Oval Avatar?,2014-07-16,article,Op-Ed,,"['United States Politics and Government', 'Computers and the Internet']"
Canadian Killed in Syria Lives On as Pitchman for Jihadis,2014-07-16,article,News,,"['Video Recordings, Downloads and Streaming', 'Terrorism', 'Middle East and North Africa Unrest (2010- )', 'Defense and Military Forces']"
Ex-Punter Pressures Vikings for Report,2014-07-16,article,News,,"['Discrimination', 'Football', 'Homosexuality and Bisexuality']"
"Winning Lottery Numbers for July 15, 2014",2014-07-16,article,List,,['Lotteries']
"Medicaid Home Care Cuts Are Unjust, Lawsuit Says",2014-07-16,article,News,,"['Medicaid', 'Home Health Care', 'Suits and Litigation (Civil)', 'Disabilities']"
"After Brief Lull in Gaza Crisis, Airstrikes Resume",2014-07-16,article,News,,"['Defense and Military Forces', 'Palestinians', 'Deaths (Fatalities)', 'International Relations', 'United States International Relations']"
Cuomo’s Campaign Holds a Wide Lead in Fund-Raising,2014-07-16,article,News,,"['Campaign Finance', 'Elections, Governors', 'Same-Sex Marriage, Civil Unions and Domestic Partnerships', 'Midterm Elections (2014)']"
Leaving a Sport in Better Shape,2014-07-16,article,News,,"['Baseball', 'ALL STAR GAMES']"
Group Aiding de Blasio Spent $1.7 Million in First Half of ’14,2014-07-16,article,News,,"['Lobbying and Lobbyists', 'Campaign Finance', 'Polls and Public Opinion', 'Education (Pre-School)']"
Selig Hopes to Award Two Future Games Before His Retirement,2014-07-16,article,News,,"['Baseball', 'ALL STAR GAMES']"
"Gazans, Desiring Deep Change, Are Ambivalent on Egypt Cease-Fire Plan",2014-07-16,article,News,,['Palestinians']
Like the Figure Formed,2014-07-16,article,News,,"['Crossword Puzzles', 'Mathematics']"
Calls for Resignation Mount for Minnesota Archbishop in Scandals,2014-07-16,article,News,,"['Sex Crimes', 'Priests', 'Child Abuse and Neglect', 'Suits and Litigation (Civil)', 'Same-Sex Marriage, Civil Unions and Domestic Partnerships', 'Homosexuality and Bisexuality']"
The Best Selling Sports Books,2014-07-16,article,List,,"['Books and Literature', 'Book Trade and Publishing', 'Athletics and Sports']"
Christie to Test Presidential Hopes in Iowa Trip,2014-07-16,article,News,,"['Presidential Election of 2016', 'Elections, Governors', 'Midterm Elections (2014)', 'Polls and Public Opinion']"
Grindhaus,2014-07-16,multimedia,Slideshow,,[]
House Passes Interim Fix for Highway Trust Fund,2014-07-16,article,News,,"['Infrastructure (Public Works)', 'Roads and Traffic', 'United States Politics and Government', 'Law and Legislation', 'Transportation', 'Federal Taxes (US)', 'Gasoline Tax (US)', 'Federal Budget (US)']"
The Umbrella as a Useless Accessory,2014-07-16,article,News,,"['Rain', 'Weather']"
What Is Your Neighborhood’s Summertime Ritual?,2014-07-16,article,News,,"['Basketball', 'Bread', 'Croquet']"
Libya Airport Is Crippled in Fighting by Militias,2014-07-16,article,News,,"['Airport Security', 'AIRPORTS', 'International Relations', 'Defense and Military Forces', 'Deaths (Fatalities)']"
"Robert Roe, New Jersey Congressman Called ‘Mr. Jobs,’ Dies at 90",2014-07-16,article,Obituary (Obit),,"['Infrastructure (Public Works)', 'Deaths (Obituaries)', 'Law and Legislation', 'United States Politics and Government']"
Witnesses Testify Against Ex-Blackwater Colleagues in Case of 2007 Iraq Killings,2014-07-16,article,News,,"['Iraq War (2003-11)', 'Murders and Attempted Murders', 'Mercenaries and Private Military Contractors', 'Defense Contracts']"
Chinese Oil Rig Near Vietnam to Be Moved,2014-07-16,article,News,,"['Offshore Drilling and Exploration', 'Oil (Petroleum) and Gasoline', 'International Relations']"
The Coming Democratic Schism,2014-07-16,article,Op-Ed,,"['Polls and Public Opinion', 'United States Politics and Government']"
"Looking to the Fall, Democrats in Senate Races Lead Fund-Raising",2014-07-16,article,News,,"['Campaign Finance', 'Midterm Elections (2014)', 'United States Politics and Government', 'Elections, Senate']"
Two Former Attorneys General in Utah Are Charged With Corruption,2014-07-16,article,News,,"['Bribery and Kickbacks', 'Attorneys General', 'Corruption (Institutional)', 'Frauds and Swindling', 'Gifts to Public Officials']"
Qatar’s Soccer Move Into Europe,2014-07-16,multimedia,Slideshow,,"['Soccer', 'World Cup 2022 (Soccer)']"
"In Call, Obama and Merkel Discuss ‘Cooperation’ on Intelligence",2014-07-16,article,News,,"['United States International Relations', 'Espionage and Intelligence Services']"
California Approves Forceful Steps Amid Drought,2014-07-16,article,News,,"['Water', 'Drought', 'Rationing and Allocation of Resources', 'Agriculture and Farming', 'Regulation and Deregulation of Industry', 'Gardens and Gardening']"
Democrat Is Governor Pick of G.O.P. Group in Kansas,2014-07-16,article,News,,"['Endorsements', 'Midterm Elections (2014)', 'Elections, Governors', 'United States Politics and Government']"
"Goal Remains to Remove Sterling, but Timetable Shifts",2014-07-16,article,News,,['Basketball']
Obama Official Won’t Testify to Congress,2014-07-16,article,News,,"['United States Politics and Government', 'Midterm Elections (2014)', 'Law and Legislation']"
China Says Lending Put Growth Rate at 7.5 Percent,2014-07-16,article,News,,"['Gross Domestic Product', 'Economic Conditions and Trends']"
TV Reporter Suspended for Comments About Antipolice Sentiment in Black Community,2014-07-16,article,News,,"['Attacks on Police', 'Blacks', 'Black People', 'Television', 'News and News Media']"
The Making of Five Aesthetic Flights of Fancy in Michel Gondry’s New Film ‘Mood Indigo’,2014-07-16,article,News,,[]
An Unpretentious Upstate Eatery With Brooklyn-Pedigreed Pizza,2014-07-16,article,News,,[]
Train Like a German Soccer Star,2014-07-16,article,News,,"['Exercise', 'Soccer', 'World Cup 2014 (Soccer)']"
Word of the Day | muddle,2014-07-16,article,News,,[]
"Teenagers’ Cars Are Older, Smaller and Less Safe, Study Finds",2014-07-16,article,News,,"['Traffic Accidents and Safety', 'Automobile Safety Features and Defects', 'Teenagers and Adolescence', 'Insurance', 'Small Cars (Compact, Subcompact and Microcars)']"
Philippines: A Deadly Typhoon,2014-07-16,article,Brief,,"['Typhoons', 'Deaths (Fatalities)', 'Hurricanes and Tropical Storms']"
What’s On TV Wednesday,2014-07-16,article,Schedule,,[]
"Jeter Takes Advantage, and So Does the American League",2014-07-16,article,News,,"['Baseball', 'ALL STAR GAMES']"
Obama on Transportation and the Economy,2014-07-16,multimedia,Video,,"['Transportation', 'Federal Budget (US)', 'United States Politics and Government', 'Law and Legislation']"
No Cornering Clinton on ‘Daily Show’,2014-07-16,article,News,,"['Television', 'News and News Media']"
Chinatown’s Renegade Sport,2014-07-16,multimedia,Video,,"['Volleyball', 'Chinese-Americans']"
Rogue Sport Lacks Sand but Has Style and Speed,2014-07-16,article,News,,"['Volleyball', 'Chinese-Americans', 'Series']"
"Quotation of the Day for Wednesday, July 16, 2014",2014-07-16,article,Quote,,[]
"Corrections: July 16, 2014",2014-07-16,article,News,,[]
"The Toll in Gaza and Israel, Day by Day",2014-07-16,multimedia,Interactive Feature,,"['Palestinians', 'Defense and Military Forces', 'Deaths (Fatalities)']"
Book Editor Says His Firing Was Linked to Tiananmen Gathering,2014-07-16,article,News,,['Freedom of the Press']
"China Sees a Recovery, on Paper",2014-07-16,article,News,,"['Gross Domestic Product', 'Economic Conditions and Trends', 'Railroads', 'Labor and Jobs']"
Student Crossword | Geometry,2014-07-16,article,News,,"['Crossword Puzzles', 'Mathematics']"
"6 Q’s About the News | Ticking Viral Bombs, Left in Boxes",2014-07-16,article,News,,[]
Military Official Says Israel Invasion of Gaza Is Likely,2014-07-16,article,News,,"['Palestinians', 'Deaths (Fatalities)']"
7 Sauces That Taste Better Homemade,2014-07-16,multimedia,Interactive Feature,,[]
Fishing in South India’s Troubled Waters,2014-07-16,article,News,,"['Demonstrations, Protests, and Riots', 'Electric Light and Power', 'Fishing, Commercial', 'Japan Earthquake and Tsunami (2011)', 'Mines and Mining', 'Nuclear Energy', 'Photography', 'Poaching (Wildlife)']"
Steven Holl and Athol Fugard among Winners of Praemium Imperiale Awards,2014-07-16,article,News,,[]
Storm Leaves Trail of Destruction in Philippines,2014-07-16,article,News,,"['Typhoon Haiyan (2013)', 'Evacuations and Evacuees']"
Your Wednesday Briefing,2014-07-16,article,News,,[]
A Chinese-Language Lesson Ripped From the Headlines,2014-07-16,article,News,,['News and News Media']
White House Announces Climate Change Initiatives,2014-07-16,article,News,,"['Global Warming', 'Electric Light and Power', 'Coast Erosion', 'Floods', 'Landslides and Mudslides']"
New York Today: Weather People,2014-07-16,article,News,,[]
Daily Report: Apple and IBM Form ‘Landmark Partnership’ on Business Software,2014-07-16,article,News,,"['Mobile Applications', 'Software']"
Israelis Tells Palestinians to Leave Their Homes,2014-07-16,multimedia,Slideshow,,"['Palestinians', 'Defense and Military Forces']"
Morning Views,2014-07-16,article,News,,[]
The Invasion of Britain,2014-07-16,article,Op-Ed,,"['International Study and Teaching', 'English Language', 'Teenagers and Adolescence', 'Language and Languages']"
How I’m Trying to Manage My Online Brand,2014-07-16,article,News,,"['Computers and the Internet', 'Small Business', 'Social Media']"
Murdoch Puts Time Warner on His Wish List,2014-07-16,article,News,,"['Cable Television', 'Mergers, Acquisitions and Divestitures', 'News and News Media', 'Television']"
Messaging App Line Files for I.P.O. in Tokyo,2014-07-16,article,News,,"['Instant Messaging', 'Mergers, Acquisitions and Divestitures', 'Mobile Applications']"
Partisanship Infuses Hearings on Health Law and Executive Power,2014-07-16,article,News,,"['Suits and Litigation (Civil)', 'Patient Protection and Affordable Care Act (2010)', 'United States Politics and Government']"
Bank of America’s Settlement Negotiations Hit a Snag,2014-07-16,article,News,,[]
1939: Sculptor Epstein to Carve ‘Eve’,2014-07-16,article,News,,['Sculpture']
Netherlands Held Liable for 300 Deaths in Srebrenica Massacre,2014-07-16,article,News,,"['War Crimes, Genocide and Crimes Against Humanity', 'Decisions and Verdicts']"
Gtech of Italy to Acquire Slot Machine Maker for $4.7 Billion,2014-07-16,article,News,,[]
Stalking the Shadow Universe,2014-07-16,article,News,,"['Space and Astronomy', 'Stars and Galaxies', 'Dark Matter (Astronomy)', 'Computers and the Internet']"
A Master of Illusion Endures,2014-07-16,article,News,,"['Movies', 'Child Abuse and Neglect', 'Sex Crimes']"
"Kimpton Now Rewards How You Act, Not Just How Long You Stay",2014-07-16,article,News,,"['Customer Loyalty Programs', 'Hotels and Travel Lodgings']"
"A Tiny Wire, and a Big Train Wreck",2014-07-16,article,News,,"['Railroad Accidents and Safety', 'Subways', 'Deaths (Fatalities)']"
Note to Cadres: Hands Off the Black Audi and Chauffeur,2014-07-16,article,News,,['Automobiles']
Greek Fugitive Is Arrested in Athens Shootout,2014-07-16,article,News,,"['Fugitives', 'Police', 'Terrorism']"
BlackRock Results Show a Shift Away From Stocks,2014-07-16,article,News,,"['Company Reports', 'Stocks and Bonds']"
Morning Agenda: Murdoch Pursues Time Warner,2014-07-16,article,News,,[]
Portugal Telecom and Brazil Phone Giant Revise Merger Terms,2014-07-16,article,News,,"['Bankruptcies', 'Mergers, Acquisitions and Divestitures']"
Oldies on the Subway,2014-07-16,article,News,,"['Music', 'Subways']"
Tomas Maier Seeks an Entirely New Fashion Niche,2014-07-16,article,News,,['Fashion and Apparel']
A Robot With a Little Humanity,2014-07-16,article,News,,['Robots and Robotics']
"A Spare, Americana-Influenced Video From the Indie Supergroup Hiss Golden Messenger",2014-07-16,article,News,,['Music']
"Assad Begins a Third Term in Syria, Vowing to Look After Its People",2014-07-16,article,News,,['Elections']
Pakistani Airstrikes Target Haven for Qaeda and Taliban Fighters ,2014-07-16,article,News,,"['Drones (Pilotless Planes)', 'Defense and Military Forces', 'Deaths (Fatalities)', 'Afghanistan War (2001- )']"
"Treasury Urges End to Foreign Tax Flights, but Quick Action Is Unlikely",2014-07-16,article,News,,"['Corporate Taxes', 'Law and Legislation', 'Mergers, Acquisitions and Divestitures', 'Tax Shelters']"
South Korea Begins Naval Drills With the U.S.,2014-07-16,article,News,,['United States Defense and Military Forces']
What’s News in Washington: Boehner Moves Ahead With Plan to Sue Obama,2014-07-16,article,News,,['United States Politics and Government']
"Behind Subway’s Phantom Hotel Entrance, Neither Arias Nor Opulence Linger ",2014-07-16,article,News,,"['Restoration and Renovation', 'Subways', 'Historic Buildings and Sites']"
Gun Deaths Versus Car Deaths,2014-07-16,article,News,,"['Gun Control', 'Traffic Accidents and Safety']"
Miami’s Coastal Climate Calamity – in Super Slo-Mo,2014-07-16,article,News,,"['Area Planning and Renewal', 'Coast Erosion', 'Global Warming']"
L.I.R.R. Negotiations Resume With Different Tone,2014-07-16,article,News,,"['Railroads', 'Organized Labor', 'Strikes', 'Transit Systems']"
Ya Gotta Have Faith,2014-07-16,article,News,,[]
Deadly Typhoon in the Philippines,2014-07-16,multimedia,Video,,"['Typhoons', 'Typhoon Haiyan (2013)']"
Fantasies of Personal Destruction,2014-07-16,article,News,,[]
"Briarwood, Queens: A Quiet Refuge Bounded by Traffic",2014-07-16,article,News,,['Real Estate and Housing (Residential)']
Roche Reports Mixed Results in Trial of an Alzheimer’s Drug,2014-07-16,article,News,,"[""Alzheimer's Disease"", 'Drugs (Pharmaceuticals)', 'Clinical Trials']"
For Friends in the Know,2014-07-16,article,News,,"['Fashion and Apparel', 'Shopping and Retail', 'Men and Boys']"
"Fauna, Flora and Freighters in the Danube Delta",2014-07-16,article,News,,['Travel and Vacations']
"57,000 Reasons Immigration Overhaul May Be Stalled for Now",2014-07-16,article,News Analysis,,"['United States Politics and Government', 'Illegal Immigration', 'Children and Childhood', 'Deportation']"
The Rise of Cafe Culture in New York,2014-07-16,article,News,,"['Sidewalk Cafes', 'Restaurants']"
Simplifying Measuring Medication for Children,2014-07-16,article,News,,"['Children and Childhood', 'Labeling and Labels', 'Parenting']"
Family Behind Hobby Lobby Has New Project: Bible Museum,2014-07-16,article,News,,"['Museums', 'Bible', 'Religion-State Relations']"
"What You Get for ... $1,100,000",2014-07-16,article,News,,['Real Estate and Housing (Residential)']
London Theater Journal: A Hellish Vacation,2014-07-16,article,News,,['Theater']
Indian Club’s Ban on Dhotis in Favor of Western Attire Draws Protests,2014-07-16,article,News,,['Fashion and Apparel']
Ron Howard to Direct Documentary on Beatles’ Performing History,2014-07-16,article,News,,"['Documentary Films and Programs', 'Music']"
Reflecting on a Decade of Murdoch Deals,2014-07-16,article,News,,"['Mergers, Acquisitions and Divestitures', 'News and News Media', 'Social Media']"
Wheelies: The Heavy Chevy Edition,2014-07-16,article,News,,"['Automobiles', 'Vans', 'Antique and Classic Cars', 'Electric and Hybrid Vehicles', 'Auctions']"
Why You Are So Stressed About Stress,2014-07-16,article,News,,['Anxiety and Stress']
House Hunting in ...Newfoundland,2014-07-16,article,News,,['Real Estate and Housing (Residential)']
BMW Recalls 1.6 Million Cars Over Defective Takata Air Bag Part,2014-07-16,article,News,,"['Automobile Safety Features and Defects', 'Recalls and Bans of Products']"
Board Book Roundup: Babies’ Delight,2014-07-16,multimedia,Slideshow,,['Books and Literature']
"In Expansion, BMW to Make China-Only Models",2014-07-16,article,News,,"['Automobiles', 'Electric and Hybrid Vehicles']"
"Say Yes to Undress, Then Things Get Complicated",2014-07-16,article,News,,['Television']
Focus on Asset Managers Highlights Bad Behavior by S.E.C.,2014-07-16,article,News,,"['Banking and Financial Institutions', 'Dodd-Frank Wall Street Reform and Consumer Protection Act (2010)', 'Regulation and Deregulation of Industry']"
1964: Hostility Shown to Goldwater,2014-07-16,article,News,,[]
Brazilian Private Equity Firm Near Closing on $1 Billion Fund,2014-07-16,article,News,,['Private Equity']
Small Businesses Are Finding Bank Loans Easier to Come By,2014-07-16,article,News,,"['Banking and Financial Institutions', 'Small Business', 'Credit and Debt', 'Restaurants']"
A New History in the Making for Hoylake,2014-07-16,article,News,,"['Golf', 'British Open (Golf)']"
Stir-fried Rice With Amaranth or Red Chard and Thai Basil,2014-07-16,article,recipe,,"['Recipes', 'Diet and Nutrition']"
Stir-Fried Turkey Breast With Snap or Snow Peas and Chard,2014-07-16,article,recipe,,"['Recipes', 'Diet and Nutrition', 'Beans']"
"Paul Gibson Jr., New York City’s First Black Deputy Mayor, Is Dead at 86",2014-07-16,article,Obituary (Obit),,"['Blacks', 'Black People', 'Deaths (Obituaries)']"
Money Alone Won’t Secure Time Warner for Murdoch,2014-07-16,article,News,,[]
"Changyuraptor, Large Species of Flying Dinosaur, Is Discovered",2014-07-16,article,News,,"['Dinosaurs', 'Paleontology']"
"Randall Stout, Architect Tied to Nature, Dies at 56 ",2014-07-16,article,Obituary (Obit),,"['ARCHITECTURE', 'Museums', 'Deaths (Obituaries)']"
"Analyzing Next Steps, Airbus Chief Is Closely Watching Google and Facebook",2014-07-16,article,News,,"['AIRLINES AND AIRPLANES', 'Farnborough Air Show (GB)']"
Marvel Will Introduce a Female Thor This Fall,2014-07-16,article,News,,['Comic Books and Strips']
An Apartment as Co-Star,2014-07-16,article,News,,['Theater']
Vintage French Cars Turn Heads,2014-07-16,multimedia,Video,,"['Antique and Classic Cars', 'Automobiles', 'Bastille Day', 'Parades']"
Francophiles Celebrate Bastille Day With French Cars and Bikes,2014-07-16,article,News,,"['Automobiles', 'Antique and Classic Cars', 'Bastille Day', 'Parades']"
U.S. Is Said to Plan to Send 6 Detainees to Uruguay,2014-07-16,article,News,,"['Detainees', 'United States International Relations']"
"With DC59 Motorhead, Dyson Looks to Create the iPad of Vacuums",2014-07-16,article,News,,"['Vacuum Cleaners', 'Inventions and Patents']"
Nine in Egypt Are Convicted in Sex Assaults,2014-07-16,article,News,,"['Sex Crimes', 'Sentences (Criminal)', 'Middle East and North Africa Unrest (2010- )', ""Women's Rights""]"
"For a Parting Gift, Do You Want a Grapefruit or a Meatball?",2014-07-16,article,News,,"['Baseball', 'ALL STAR GAMES']"
"Whisky, Summer Style",2014-07-16,article,News,,['Whiskey']
A Westerner’s Inside View of Alibaba Successes and Failures,2014-07-16,article,News,,"['E-Commerce', 'Initial Public Offerings', 'Start-ups']"
Should Janet Yellen Be Giving Us Stock Picks?,2014-07-16,article,News,,"['United States Economy', 'Stocks and Bonds', 'Junk Bonds']"
"Classical Playlist: Schumann, Mozart, Brahms and More",2014-07-16,article,News,,['Classical Music']
Today in Small Business: Same-Day Delivery,2014-07-16,article,News,,['Small Business']
"Is Truvada, the Pill to Prevent H.I.V., 99 Percent Effective? Don’t Be So Sure",2014-07-16,article,News,,"['Truvada (Drug)', 'Acquired Immune Deficiency Syndrome', 'Condoms', 'Sex']"
The Moderate Revolution in Kansas,2014-07-16,article,News,,['Taxation']
Are Banks Fighting Over Your Business?,2014-07-16,article,News,,"['Banking and Financial Institutions', 'Small Business']"
Weather May Not Affect Back Pain,2014-07-16,article,News,,"['Back (Human Body Part)', 'Medicine and Health', 'Pain', 'Weather']"
Yellen Says Restraining the Fed’s Oversight Would Be a ‘Grave Mistake’,2014-07-16,article,News,,[]
Witness Accounts of Gaza Attack That Killed 4 Boys,2014-07-16,article,News,,['Defense and Military Forces']
"Easy Ways to Get More Vegetables on the Table, More Often",2014-07-16,article,News,,"['Cooking and Cookbooks', 'Parenting', 'Recipes', 'Vegetables']"
Sweet and Sour Stir-Fried Radishes With Their Greens,2014-07-16,article,recipe,,"['Recipes', 'Diet and Nutrition']"
Some Top Money Managers Push for Fed to Start Raising Interest Rates,2014-07-16,article,News,,"['Interest Rates', 'Quantitative Easing', 'United States Economy']"
"Pelosi, in Reversal, Says She Opposes Speeding Child Deportations ",2014-07-16,article,News,,"['Immigration and Emigration', 'Children and Childhood', 'Illegal Immigration', 'United States Politics and Government']"
App Smart | Avoiding Sunburns,2014-07-16,multimedia,Video,,"['Mobile Applications', 'Sunburn']"
"Your Time in the Sun, Measured to the Minute ",2014-07-16,article,News,,"['Mobile Applications', 'Sunburn', 'Sunscreen', 'Ultraviolet Light', 'Sun', 'Video Recordings, Downloads and Streaming']"
"To Reassure Time Warner Employees, Bewkes Takes to the Small Screen",2014-07-16,article,News,,"['Mergers, Acquisitions and Divestitures', 'Video Recordings, Downloads and Streaming']"
Noriega Sues Video Game Maker Over Portrayal in Call of Duty,2014-07-16,article,News,,"['Computer and Video Games', 'Suits and Litigation (Civil)']"
Gene Therapy Is Used to Adjust Pigs’ Heartbeat,2014-07-16,article,News,,"['Implants', 'Pacemakers', 'Heart', 'Pigs', 'Genetics and Heredity', 'Medicine and Health']"
‘Saturday Night Live’ Loses 4 Performers,2014-07-16,article,News,,[]
"Boys Drawn to Gaza Beach, and Into Center of Mideast Strife",2014-07-16,article,News,,"['Civilian Casualties', 'Palestinians']"
Reform Conservatism and Foreign Policy,2014-07-16,article,News,,"['Conservatism (US Politics)', 'United States Defense and Military Forces', 'United States International Relations']"
Did a Headline on Germany’s ‘Global Might’ Go Too Far?,2014-07-16,article,News,,[]
Mystery Solved on Names and Money Behind Thad Cochran Ads,2014-07-16,article,News,,"['Campaign Finance', 'Midterm Elections (2014)', 'Political Action Committees', 'Blacks', 'Black People', 'Voting and Voters', 'Elections, Senate', 'Political Advertising']"
Detroit Institute of Arts Receives Nearly $27 Million From Businesses,2014-07-16,article,News,,"['Finances', 'Museums']"
Lena Dunham’s Book Tour Is a Hot Ticket,2014-07-16,article,News,,['Books and Literature']
