headline,date,doc_type,material_type,section,keywords
Paul Ryan and His Poverty Prophet,2014-07-24,article,Op-Ed,,"['Race and Ethnicity', 'Poverty', 'Welfare (US)', 'Blacks', 'Black People', 'United States Politics and Government']"
"For Obama, Protectiveness About Daughters Gives Way to Pride",2014-07-24,article,News,,"['Presidents and Presidency (US)', 'United States Politics and Government']"
Let Our Oil and Gas Go,2014-07-24,article,Op-Ed,,"['Oil (Petroleum) and Gasoline', 'Natural Gas', 'International Trade and World Market', 'Regulation and Deregulation of Industry', 'United States Politics and Government']"
Political Crisis Jeopardizes Future of Bulgarian Bank,2014-07-24,article,News,,"['Banking and Financial Institutions', 'Foreign Investments', 'European Sovereign Debt Crisis (2010- )']"
What I Saw on Rikers Island,2014-07-24,article,Op-Ed,,"['Prisons and Prisoners', 'Assaults', 'Guards']"
42 Are Killed in Bombings Aimed at Nigerian Figures,2014-07-24,article,News,,"['Bombs and Explosives', 'Assassinations and Attempted Assassinations', 'Terrorism', 'Muslims and Islam']"
Turning Wind Into Electricity,2014-07-24,multimedia,Slideshow,,"['Wind Power', 'Electric Light and Power']"
"Texas Is Wired for Wind Power, and More Farms Plug In",2014-07-24,article,News,,"['Wind Power', 'Alternative and Renewable Energy', 'Electric Light and Power']"
Food Safety in China Still Faces Big Hurdles,2014-07-24,article,News,,"['Food Contamination and Poisoning', 'Factories and Manufacturing', 'Fast Food Industry', 'Food', 'Meat', 'Chickens']"
"American Apparel Names a New Board, Minus Dov Charney",2014-07-24,article,News,,"['Boards of Directors', 'Fashion and Apparel']"
"Robert Newhouse, 64, Rusher Whose Pass Secured a Title, Dies",2014-07-24,article,Obituary (Obit),,"['Football', 'Deaths (Obituaries)', 'Super Bowl']"
Boeing Earnings Take Hit Over Problems in Air Force Tankers,2014-07-24,article,News,,"['Military Aircraft', 'Company Reports']"
Ryder Uses New Campaign to Highlight Array of Services for Businesses,2014-07-24,article,News,,"['ADVERTISING AND MARKETING', 'Online Advertising', 'Trucks and Trucking']"
Prosecutors Snooping on Legal Mail,2014-07-24,article,Editorial,,"['Prisons and Prisoners', 'E-Mail', 'Legal Profession', 'Privacy', 'Editorials']"
Philadelphia Man Accused in Nazi Case Dies,2014-07-24,article,News,,"['Holocaust and the Nazi Era', 'Murders and Attempted Murders', 'World War II (1939-45)', 'Extradition']"
Iraq’s Imperiled Minorities,2014-07-24,article,Editorial,,"['Christians and Christianity', 'Muslims and Islam', 'Editorials', 'Human Rights and Human Rights Violations', 'Minorities', 'Chaldean Catholic Church']"
Gov. Cuomo’s Broken Promises,2014-07-24,article,Editorial,,"['Ethics and Official Misconduct', 'Editorials', 'Corruption (Institutional)', 'Lobbying and Lobbyists']"
"Quick Action in Chokehold Case Has Shielded de Blasio From Ire, for Now",2014-07-24,article,News,,"['Police Brutality, Misconduct and Shootings']"
I Was the Sick Passenger,2014-07-24,article,News,,"['Fainting', 'Subways']"
New Rules for Part-Time Work,2014-07-24,article,News,,[]
"Track Team Is Peerless and, Seemingly, Ageless",2014-07-24,article,News,,"['Track and Field', 'Elderly', 'Running']"
"At Hall, a Blank Look Is in Style",2014-07-24,article,News,,"['Baseball', 'Halls of Fame']"
G.O.P. Plan on Migrants Calls for Less Cash Than Democrats and Obama Seek,2014-07-24,article,News,,"['Immigration and Emigration', 'Illegal Immigration', 'Human Trafficking', 'Law and Legislation', 'Children and Childhood']"
Arizona Takes Nearly 2 Hours to Execute Inmate,2014-07-24,article,News,,"['Capital Punishment', 'Drugs (Pharmaceuticals)', 'Eighth Amendment (US Constitution)']"
"As Much of the World Frowns on Israel, Americans Hold Out Support",2014-07-24,article,News,,"['Palestinians', 'Polls and Public Opinion', 'Civilian Casualties', 'International Relations', 'War Crimes, Genocide and Crimes Against Humanity', 'Human Rights and Human Rights Violations', 'Jews and Judaism', 'Muslims and Islam', 'Deaths (Fatalities)']"
Wheelies: The Keystone Velocity Edition,2014-07-24,article,News,,"['Automobiles', 'Speed Limits and Speeding']"
"N.C.A.A. Players’ Winning Streak, Off the Field",2014-07-24,article,News,,"['College Athletics', 'Scholarships and Fellowships', 'Basketball (College)', 'Antitrust Laws and Competition Issues']"
"Winning Lottery Numbers for July 23, 2014",2014-07-24,article,List,,['Lotteries']
Swindlers Target Kin of Migrants,2014-07-24,article,News,,"['Illegal Immigration', 'Frauds and Swindling', 'Children and Childhood']"
Violent Attacks on Homeless in Albuquerque Expose City’s Ills,2014-07-24,article,News,,"['Homeless Persons', 'Murders and Attempted Murders']"
A Celebrity’s Welcome in Italy for de Blasio,2014-07-24,article,News,,['Politics and Government']
General Manager’s Recipe for Giants: Youth and Speed,2014-07-24,article,News,,['Football']
"Ryan Feels ‘Incredible’ About Jets, Who Show Lots of Confidence Themselves",2014-07-24,article,News,,['Football']
Control of Senate May Hinge on Georgia Race,2014-07-24,article,News,,"['Elections, Senate', 'United States Politics and Government', 'Midterm Elections (2014)']"
"Bolstered by Ruling, Republicans Attack Health Law",2014-07-24,article,News,,"['Patient Protection and Affordable Care Act (2010)', 'Health Insurance and Managed Care', 'United States Politics and Government', 'Decisions and Verdicts']"
A Rolling Stone Gathers No Moss,2014-07-24,article,News,,"['Crossword Puzzles', 'Rock Music']"
"Israel Says That Hamas Uses Civilian Shields, Reviving Debate",2014-07-24,article,News,,"['Palestinians', 'Civilian Casualties', 'Defense and Military Forces', 'Terrorism']"
Ruling on Health Care Subsidies Puts Coverage at Risk,2014-07-24,article,News,,"['Health Insurance and Managed Care', 'States (US)', 'Patient Protection and Affordable Care Act (2010)', 'Federal Aid (US)', 'Decisions and Verdicts']"
Port Authority Approves $90 Million in Upgrades at Bus Terminal,2014-07-24,article,News,,"['Port Authority Bus Terminal (NYC)', 'Stations and Terminals (Passenger)']"
8 Are Removed as Queens Library Trustees,2014-07-24,article,News,,"['Boards of Directors', 'Libraries and Librarians', 'Appointments and Executive Changes']"
"After Tough Competition, Rival Baby E-Commerce Sites in Brazil to Merge",2014-07-24,article,News,,"['E-Commerce', 'Foreign Investments', 'Mergers, Acquisitions and Divestitures']"
"In Downpour, Delay by the Grounds Crew Helps the Yankees",2014-07-24,article,News,,['Baseball']
"For Muslims in New York, Observing Ramadan Is a Blend of Rituals Far and Near",2014-07-24,article,News,,"['Ramadan', 'Muslim Americans', 'Muslims and Islam', 'Fasting']"
"Crash Victims to Undergo Routine Tests, Experts Say",2014-07-24,article,News,,"['Malaysia Airlines Flight 17', 'Aviation Accidents and Safety', 'Forensic Science', 'DNA (Deoxyribonucleic Acid)', 'AIRLINES AND AIRPLANES']"
"Over Government Objections, Rules on No-Fly List Are Made Public",2014-07-24,article,News,,"['Airport Security', 'Terrorism', 'Travel and Vacations', 'AIRLINES AND AIRPLANES', 'First Amendment (US Constitution)']"
Endless Summer in the Rockaways,2014-07-24,article,News,,[]
White House to Begin $10 Billion Rural Investment Fund,2014-07-24,article,News,,"['Banking and Financial Institutions', 'Hedge Funds', 'Rural Areas']"
"States Against E.P.A. Rule on Carbon Pollution Would Gain, Study Finds",2014-07-24,article,News,,"['Natural Gas', 'Global Warming', 'Greenhouse Gas Emissions', 'Coal', 'Air Pollution']"
Photography as a Balm for Mental Illness,2014-07-24,article,News,,"['Depression (Mental)', 'Mental Health and Disorders', 'Photography']"
One of Marvel’s Avengers Turns to Sign Language,2014-07-24,article,News,,['Sign Language']
U.S. Team Veteran Returns to M.L.S.,2014-07-24,article,Brief,,['Soccer']
Word of the Day | obsessive,2014-07-24,article,News,,[]
Rain Cuts Short Once-in-a-Generation Performance of ‘Hommy’,2014-07-24,article,News,,['Music']
What’s on TV Thursday,2014-07-24,article,Schedule,,[]
"Corrections: July 24, 2014",2014-07-24,article,News,,[]
"Quotation of the Day for Thursday, July 24, 2014",2014-07-24,article,Quote,,[]
"Flights to and From Israel Can Resume, Regulators Say",2014-07-24,article,News,,['AIRLINES AND AIRPLANES']
Student Crossword | Endangered Species,2014-07-24,article,News,,[]
Christians in Wenzhou Fight to Keep Church’s Cross,2014-07-24,article,News,,"['Christians and Christianity', 'Protestant Churches']"
"Standard Chartered ‘United’ in Its Support of C.E.O., Board Says",2014-07-24,article,News,,"['Appointments and Executive Changes', 'Stocks and Bonds']"
6 Q’s About the News | Upheavals Around the World Challenge Obama and U.S. Foreign Policy,2014-07-24,article,News,,[]
Obama Administration Presses for Retroactive Legislation on Tax Inversions,2014-07-24,article,News,,"['Corporate Taxes', 'Law and Legislation', 'Mergers, Acquisitions and Divestitures', 'Relocation of Business', 'Tax Shelters']"
A Graphic Photo Spurs Reflection,2014-07-24,article,News,,"['Murders and Attempted Murders', 'Photography', 'Sex Crimes', 'Women and Girls']"
"Opera of an Artist’s Life, Cut Short",2014-07-24,article,News,,"['Opera', 'Salzburg Festival', 'Holocaust and the Nazi Era', 'World War II (1939-45)', 'Theater', 'Music', 'Classical Music', 'Art']"
Sale of Handset Unit Bolsters Nokia’s Profit,2014-07-24,article,News,,['Company Reports']
"2 Foreign Aid Workers Are Gunned Down in Afghanistan, Officials Say",2014-07-24,article,News,,"['Murders and Attempted Murders', 'Humanitarian Aid']"
Your Thursday Briefing,2014-07-24,article,News,,[]
Eurozone Growth Rebounds in July,2014-07-24,article,News,,"['Economic Conditions and Trends', 'Production', 'Gross Domestic Product']"
Morning Views,2014-07-24,article,News,,[]
"New York Today: Planes, Trains And …",2014-07-24,article,News,,[]
A Carbon Tax’s Ignoble End,2014-07-24,article,Editorial,,"['Taxation', 'Global Warming', 'Greenhouse Gas Emissions', 'Environment']"
Australia Offers 50 Police Officers to Secure Jet Crash Site in Ukraine,2014-07-24,article,News,,"['Malaysia Airlines Flight 17', 'Aviation Accidents and Safety']"
E.C.B. Says It Has Been Hacked in Apparent Blackmail Attempt,2014-07-24,article,News,,"['Cyberattacks and Hackers', 'Robberies and Thefts', 'Banking and Financial Institutions', 'Extortion and Blackmail']"
Hope in the Abattoir,2014-07-24,article,Editorial,,"['Palestinians', 'Israeli Settlements', 'Jews and Judaism']"
Daily Report: Mobile Advertising Lifts Profit at Facebook,2014-07-24,article,News,,"['ADVERTISING AND MARKETING', 'Company Reports']"
A Revamped United Makes a Blazing Start,2014-07-24,article,News,,['Soccer']
Investigators Examine Role of Weather in Taiwan Plane Crash,2014-07-24,article,News,,"['Aviation Accidents and Safety', 'Hurricanes and Tropical Storms']"
Connecting the Tech World to Everyday Life,2014-07-24,article,News,,"['Artificial Intelligence', 'Computers and the Internet', 'Smartphones', 'Social Media', 'Text Messaging', 'Video Recordings, Downloads and Streaming']"
Could Jenny Lewis Have Been a Hip-Hop Star If Her Mom Hadn’t Said ‘Yo’ So Much?,2014-07-24,article,News,,"['Children and Childhood', 'Music', 'Trampolines']"
The Jenny Lewis Experience,2014-07-24,article,News,,"['Music', 'ACTORS AND ACTRESSES']"
"In Ukraine, Spent Cartridges Offer Clues to Violence Fueled by Soviet Surplus",2014-07-24,article,News,,"['Arms Trade', 'Cold War Era', 'Firearms']"
"Suddenly, Convenience Stores Face a Threat: Walmart",2014-07-24,article,News,,"['Convenience Stores', 'Fast Food Industry', 'Prices (Fares, Fees and Rates)', 'Small Business']"
A Tool to Trace Words Through Time,2014-07-24,article,News,,['English Language']
Why Voters Aren’t Angrier About Economic Inequality,2014-07-24,article,News,,"['Income Inequality', 'Politics and Government', 'Taxation']"
Army War College Starts Plagiarism Inquiry of Senator John Walsh’s Thesis,2014-07-24,article,News,,"['Plagiarism', 'Colleges and Universities', 'United States Politics and Government']"
Morning Agenda: New Rules for Money Market Funds,2014-07-24,article,News,,[]
1914: Note to Servia May Prompt War,2014-07-24,article,News,,['World War I (1914-18)']
G.M. Results Show Financial Hit of Recalls,2014-07-24,article,News,,"['Company Reports', 'Recalls and Bans of Products', 'Automobile Safety Features and Defects', 'Traffic Accidents and Safety']"
Weather Suspected in Air Algérie Plane Wreck; 116 Are Feared Dead,2014-07-24,article,News,,['Aviation Accidents and Safety']
"Throwback Thursday | Happy Birthday, Amelia Earhart",2014-07-24,article,News,,[]
Nadège Vanhee-Cybulski Named Artistic Director of Hermès: First Thoughts,2014-07-24,article,News,,"['Appointments and Executive Changes', 'Fashion and Apparel']"
Testing the Big Kaboom Theory,2014-07-24,article,Review,,"['Television', 'Manhattan Project']"
Goofy Guy Takes a Galactic Leap,2014-07-24,article,News,,"['Movies', 'ACTORS AND ACTRESSES']"
Wicked Tongues Rule the World,2014-07-24,article,News,,['Theater']
Stock Market Gains and Deal-Making Lift Profit at Lazard,2014-07-24,article,News,,"['Banking and Financial Institutions', 'Company Reports', 'Mergers, Acquisitions and Divestitures']"
Blasts Kill 16 Seeking Haven at Gaza School,2014-07-24,article,News,,"['Palestinians', 'Civilian Casualties']"
Iraq Picks New President to Confront Militant Threat,2014-07-24,article,News,,"['Kurds', 'Shiite Muslims', 'Sunni Muslims', 'Politics and Government']"
Asset Sales Bolster Earnings at K.K.R.,2014-07-24,article,News,,"['Company Reports', 'Private Equity']"
Breitburn Energy Partners to Buy QR Energy,2014-07-24,article,News,,"['Energy and Power', 'Mergers, Acquisitions and Divestitures', 'Oil (Petroleum) and Gasoline']"
Why Weren’t Two Stories in The Times? An Odyssey,2014-07-24,article,News,,[]
Ode to Grand Central,2014-07-24,article,News,,"['Grand Central Terminal (NYC)', 'Poetry and Poets']"
A Trusty Old French Spot for Frites on the Upper West Side,2014-07-24,article,News,,['Restaurants']
Obama and the Myth of Presidential Control,2014-07-24,article,News,,['United States Politics and Government']
Mapping the Spread of Drought Across the U.S.,2014-07-24,multimedia,Interactive Feature,,"['Drought', 'Weather', 'Global Warming']"
"Yes, You’re Smart, but Can You Manage Your Time?",2014-07-24,article,Question,,"['Executives and Management (Theory)', 'Hiring and Promotion']"
Paul Singer Takes Stake in Advertising Titan Interpublic and Pushes for Sale,2014-07-24,article,News,,['ADVERTISING AND MARKETING']
Ford Reports Earnings of $1.3 Billion,2014-07-24,article,News,,"['Company Reports', 'Automobiles']"
Dean Koontz: By the Book,2014-07-24,article,Question,,"['Books and Literature', 'Writing and Writers']"
This Is What Wealthy Looked Like,2014-07-24,article,News,,"['Photography', 'Books and Literature', 'Art', 'Income Inequality']"
Casting Announced for New Neil LaBute Play,2014-07-24,article,News,,['Theater']
"As a Neighborhood Mourns, a Call to Improve Pedestrian Safety Is Renewed",2014-07-24,article,News,,"['Traffic Accidents and Safety', 'Deaths (Fatalities)']"
Ukraine Prime Minister Resigns as Key Coalition in Parliament Falls Apart,2014-07-24,article,News,,"['Legislatures and Parliaments', 'Elections', 'Aviation Accidents and Safety']"
Walmart U.S. Chief Leaving; Successor Headed Asian Unit,2014-07-24,article,News,,['Appointments and Executive Changes']
Bloomberg Hires a Founder of The Verge to Lead Online Initiatives,2014-07-24,article,News,,"['News and News Media', 'Appointments and Executive Changes']"
G.O.P. Congressman’s Plan to Fight Poverty Shifts Efforts to States,2014-07-24,article,News,,"['Poverty', 'States (US)', 'Federal-State Relations (US)', 'Federal Budget (US)', 'United States Economy']"
"Spectators to War, West Bank Residents Hail the Hamas Fight Against Israel",2014-07-24,article,News,,['Palestinians']
Barclays Asks Court to Dismiss New York Suit Over Its ‘Dark Pool’,2014-07-24,article,News,,[]
Metaphysical Sleight of Heart,2014-07-24,article,Review,,['Movies']
Sculptures Found in Disputed Art Trove,2014-07-24,article,News,,"['Arts and Antiquities Looting', 'Art', 'Holocaust and the Nazi Era']"
Paul Ryan and the Party of Ideas,2014-07-24,article,News,,"['Federal Budget (US)', 'Libertarianism (US Politics)', 'Medicare', 'Taxation']"
Lively Surroundings for Man and Beasts,2014-07-24,article,News,,['Real Estate and Housing (Residential)']
One Room for Many Guests,2014-07-24,article,News,,"['Hotels and Travel Lodgings', 'Travel and Vacations']"
Britain Brings Corruption Charges Against Unit of Alstom,2014-07-24,article,News,,"['Bribery and Kickbacks', 'Corruption (Institutional)', 'Courts and the Judiciary']"
Venice Film Festival Announces Lineup,2014-07-24,article,News,,['Venice International Film Festival']
"In Portugal, Ex-Chief of Bank Is Arrested",2014-07-24,article,News,,"['Money Laundering', 'Tax Evasion']"
"With Lead Extended, It’s All Downhill to Paris",2014-07-24,article,News,,"['Bicycles and Bicycling', 'Tour de France (Bicycle Race)']"
Living With Cancer: A Tour of Hospice,2014-07-24,article,News,,"['Cancer', 'Death and Dying', 'Hospice Care']"
Conservatives Hone Script to Light a Fire Over Abortion,2014-07-24,article,News,,"['ABORTION', 'Conservatism (US Politics)', 'Midterm Elections (2014)', 'Women and Girls', 'United States Politics and Government']"
A Craig Grant Show and a New Lucy Thurber Play Coming From Labyrinth Theater,2014-07-24,article,News,,['Theater']
Paul Ryan’s Proposal Hints at Change in Tone on Poverty,2014-07-24,article,News,,"['Income Tax', 'Tax Credits, Deductions and Exemptions', 'Poverty', 'Conservatism (US Politics)']"
Do You Work Too Much?,2014-07-24,article,News,,['Working Hours']
Comic-Con 2014: Television Is Muscling Out Movies,2014-07-24,article,News,,"['Movies', 'Television']"
Botox Maker’s Bosses Put Money Where Their Mouths Are,2014-07-24,article,News,,"['Drugs (Pharmaceuticals)', 'Executive Compensation', 'Mergers, Acquisitions and Divestitures']"
Today in Small Business: Chief Happiness Officer,2014-07-24,article,News,,"['Small Business', 'United States Economy']"
A Search and Destroy Thyself Mission,2014-07-24,article,Review,,['Movies']
Ex-Chelsea Midfielder Joins New York Expansion Club ,2014-07-24,article,News,,['Soccer']
A Trophy Wife With a Cheesy Heritage,2014-07-24,article,News,,['Theater']
Morgan Stanley to Pay $275 Million in Mortgage Case,2014-07-24,article,News,,"['Mortgage-Backed Securities', 'Mortgages', 'Regulation and Deregulation of Industry', 'Subprime Mortgage Crisis']"
Court Censures Poland Over C.I.A. Renditions,2014-07-24,article,News,,"['Extraordinary Rendition', 'Human Rights and Human Rights Violations', 'Interrogations']"
Study Gives Hope of Adaptation to Climate Change,2014-07-24,article,News,,"['Global Warming', 'Flies', 'Genetics and Heredity', 'Biodiversity']"
"Seeing the Child, Not the Disability",2014-07-24,article,News,,"['Children and Childhood', 'Disabilities', 'Doctors']"
Hermès Names New Designer for Women’s Fashion,2014-07-24,article,News,,"['Fashion and Apparel', 'Appointments and Executive Changes']"
Deadly Tornado Hits Campground in Virginia Two Times,2014-07-24,article,News,,"['Tornadoes', 'Camps and Camping', 'Deaths (Fatalities)']"
Putting Liberty Island on the Map,2014-07-24,multimedia,Slideshow,,[]
Google to Offer Close-Up View of Liberty Island,2014-07-24,article,News,,"['Statue of Liberty', 'Maps']"
Extended Week for MOMA Boosts Attendance,2014-07-24,article,News,,"['Art', 'Museums']"
Rising Airline Crash Fatalities Making 2014 Even More of an Aberration,2014-07-24,article,News,,"['Deaths (Fatalities)', 'Malaysia Airlines Flight 17', 'AIRLINES AND AIRPLANES']"
"Deep in Her Gut, She Knows She’s Not Ordinary",2014-07-24,article,Review,,"['Movies', 'Women and Girls']"
Even Utopian Citizens Like to Leave the House,2014-07-24,article,Review,,"['Art', 'ARCHITECTURE']"
Emma Stone and Colin Firth on Working With Woody Allen,2014-07-24,article,News,,['Movies']
Ravens’ Rice Draws 2-Game Suspension From Goodell ,2014-07-24,article,News,,['Football']
"In Argentina, Cycles and Cameras",2014-07-24,article,News,,['Travel and Vacations']
Spared Sudanese Christian Woman Meets Pope in Rome,2014-07-24,article,News,,[]
Obama Seeks to Close Loophole That Firms Use to Shield Profits Abroad,2014-07-24,article,News,,"['Corporate Taxes', 'Tax Shelters', 'Tax Credits, Deductions and Exemptions', 'Federal Taxes (US)', 'Mergers, Acquisitions and Divestitures']"
The Next Big Thing in Hardware: Smart Garbage,2014-07-24,article,News,,"['Electronics', 'Recycling of Waste Materials', 'Smartphones', 'Waste Materials and Disposal']"
Check This Out: Elvis’s Library Card Up for Auction,2014-07-24,article,News,,"['Auctions', 'Collectors and Collections']"
"To Help Mount Giant Time Warner Bid, Murdoch Calls On European Outposts",2014-07-24,article,News,,"['Mergers, Acquisitions and Divestitures', 'Television']"
"Rules for Money Market Funds Arrive, Finally",2014-07-24,article,News,,"['Money Market Mutual Funds', 'Banking and Financial Institutions', 'Regulation and Deregulation of Industry', 'Dodd-Frank Wall Street Reform and Consumer Protection Act (2010)', 'Subprime Mortgage Crisis']"
"Brooklyn Factory, Japanese Food",2014-07-24,article,Review,,['Restaurants']
"From Kenzo, an Interactive 3-D Virtual Gallery and Fashionable Art Heist",2014-07-24,article,News,,['3-D Devices and Effects']
U.S. Considering Refugee Status for Hondurans,2014-07-24,article,News,,"['Illegal Immigration', 'Children and Childhood', 'Refugees and Displaced Persons', 'United States Politics and Government']"
Give to Get,2014-07-24,article,News,,"['Customs, Etiquette and Manners', 'Gifts', 'Weddings and Engagements', 'Families and Family Life', 'Bars and Nightclubs']"
"Thanks for the Taunts, Classmates",2014-07-24,article,News,,"['Television', 'Movies', 'Web-Original Programming', 'Iranian-Americans']"
Reviewing Those Uncharted Restaurants: The Romance and the Reality,2014-07-24,article,News,,"['Cooking and Cookbooks', 'Restaurants', 'Transit Systems']"
Ford Ekes Out a Profit in Europe,2014-07-24,article,News,,[]
"From Republicans, a New Approach to ‘Accountability’",2014-07-24,article,News,,"['Poverty', 'Federal Budget (US)', 'Welfare (US)', 'United States Politics and Government', 'Food Stamps']"
The Wisdom of the Moving Man,2014-07-24,article,News,,"['Modern Love (Times Column)', 'Dating and Relationships', 'Moving and Moving Industry', 'Real Estate and Housing (Residential)']"
Yellen Settles for a Slingshot Instead of a Shotgun,2014-07-24,article,News,,[]
Why Are We Ignoring a New Ebola Outbreak?,2014-07-24,article,News,,[]
UBS Lashes Out at French Prosecutors,2014-07-24,article,News,,['Tax Evasion']
Paul Ryan’s Glossy New Poverty Plan,2014-07-24,article,News,,['Poverty']
"36 Hours in Provincetown, Mass.",2014-07-24,article,News,,['Travel and Vacations']
An Abstract World That Looks Like Silence,2014-07-24,article,Review,,['Art']
Bright Passages Along the Northeast Corridor,2014-07-24,article,News,,"['Art', 'Travel and Vacations', 'Railroads', 'Murals']"
"So, Winning Isn’t the Only Thing?",2014-07-24,article,Review,,['Theater']
The Workout Doctor,2014-07-24,multimedia,Video,,"['Medicine and Health', 'Exercise', 'Sports Medicine']"
An Art Project That Lets Regular Citizens Become the Stars of Times Square,2014-07-24,article,News,,['Art']
The 2015 Sonata Shows That Hyundai Can Play With the Big Boys,2014-07-24,article,News,,['Automobiles']
Anatomy of a Scene | ‘A Most Wanted Man’,2014-07-24,multimedia,Video,,['Movies']
Ukraine Crisis Is Testing E.U.’s Resolve,2014-07-24,article,News,,"['Embargoes and Sanctions', 'Malaysia Airlines Flight 17', 'International Relations']"
The Workout: Practicing His Own Medicine,2014-07-24,article,News,,"['Exercise', 'Medicine and Health', 'Sports Injuries', 'Sports Medicine']"
"Soviet Valor, Revised for the ’50s ",2014-07-24,article,News,,"['Movies', 'Video Releases (Entertainment)', 'Video Recordings, Downloads and Streaming']"
"Hey, Mister, I’ve Got a Park I Can Sell You",2014-07-24,article,News,,['Parks and Other Recreation Areas']
Sketching When the Pencil Requires Ignition,2014-07-24,article,Review,,['Art']
When Reality Comes With a Score,2014-07-24,article,News,,['Theater']
Subway Inn to Make Its Last Stop,2014-07-24,article,News,,['Shutdowns (Institutional)']
10 Questions for Hillary Rodham Clinton,2014-07-24,article,News,,"['Presidential Election of 2016', 'United States International Relations']"
India House Artwork Inspires a New Book,2014-07-24,article,News,,"['ANTIQUES', 'Books and Literature', 'Art']"
How Was School? Deadly,2014-07-24,article,Review,,['Books and Literature']
Feeble Rangers Give Fuel to Yankees’ Sudden Surge,2014-07-24,article,News,,['Baseball']
Anton Corbijn Narrates a Scene From ‘A Most Wanted Man’,2014-07-24,article,News,,['Movies']
The Muddled Case of Argentine Bonds,2014-07-24,article,News,,['Government Bonds']
Passing of a Video Store and a Downtown Aesthetic,2014-07-24,article,News,,"['Video Recordings, Downloads and Streaming', 'Movies']"
Your Teenager on Vacation — and on Social Media,2014-07-24,article,News,,"['Parenting', 'Social Media', 'Teenagers and Adolescence']"
The Roar of the Crowd,2014-07-24,article,Review,,"['Books and Literature', 'Jazz', 'Nineteen Hundred Twenties']"
"Amazon’s Ambitious Bets Pile Up, and Its Losses Swell",2014-07-24,article,News,,['Company Reports']
"Clash of the Items, at a Gallery Near You",2014-07-24,article,Review,,['Art']
Your Evening Briefing,2014-07-24,article,News,,[]
Meditation on President Obama’s Portrait,2014-07-24,multimedia,Slideshow,,[]
Wheelies: The New-Look Yaris Edition,2014-07-24,article,News,,"['Automobiles', 'Small Cars (Compact, Subcompact and Microcars)', 'Factories and Manufacturing']"
