headline,date,doc_type,material_type,section,keywords
"With Ebola Cases Still Few, Populous Nigeria Has Chance to Halt Its Outbreak",2014-08-16,article,News,,"['Ebola Virus', 'Deaths (Fatalities)']"
"Tanaka May Return, but Perhaps Not to a Playoff Race",2014-08-16,article,News,,['Baseball']
Agencies Issue Warnings Over Bogus Ebola Cures,2014-08-16,article,News,,"['Ebola Virus', 'Dietary Supplements and Herbal Remedies', 'ZMapp (Drug)', 'Drugs (Pharmaceuticals)']"
Hospitals in the U.S. Get Ready for Ebola,2014-08-16,article,News,,"['Ebola Virus', 'Hospitals', 'Protective Clothing', 'Emergency Medical Treatment']"
The Cormorants of East Sand Island,2014-08-16,multimedia,Video,,"['Birds', 'Salmon', 'Endangered and Extinct Species']"
"Quotation of the Day for Saturday, August 16, 2014",2014-08-16,article,Quote,,[]
What’s on TV Saturday,2014-08-16,article,Schedule,,[]
"Corrections: August 16, 2014",2014-08-16,article,News,,[]
Modern Technologies and the Ebola Fight,2014-08-16,multimedia,Video,,"['Ebola Virus', 'Ebola', 'Epidemics', 'Preventive Medicine', 'AIRPORTS', 'AIRLINES AND AIRPLANES']"
Midnight Curfew in Effect for Ferguson,2014-08-16,article,News,,"['Police Brutality, Misconduct and Shootings', 'Demonstrations, Protests and Riots', 'Curfews', 'Police']"
Papal Visit That Thrills Catholics Is Unsettling to Protestants in South Korea,2014-08-16,article,News,,"['Protestant Churches', 'Christians and Christianity']"
Senator Brian Schatz Wins Closely Fought Democratic Primary in Hawaii,2014-08-16,article,News,,"['Primaries and Caucuses', 'Elections, Senate', 'United States Politics and Government']"
Analytics: How Readers Reacted to Our Cover Story on Autism,2014-08-16,article,News,,[]
A Double Dose of Comfort,2014-08-16,article,Letter,,['AIRLINES AND AIRPLANES']
LiketoKnowit Lets You Shop Looks on Instagram,2014-08-16,article,News,,"['Fashion and Apparel', 'Social Media']"
"A Menagerie of Ideas, Unlocked in Odd Jobs",2014-08-16,article,News,,"['Labor and Jobs', 'Writing and Writers', 'Careers and Professions']"
Hesitating on the High Board of Investing,2014-08-16,article,News,,"['Personal Finances', 'Stocks and Bonds']"
"Narinder Singh of Topcoder: Is It the Cards, or How You Play Them?",2014-08-16,article,Question,,"['Executives and Management (Theory)', 'Hiring and Promotion']"
The Mystery of Lofty Stock Market Elevations,2014-08-16,article,News,,['Stocks and Bonds']
"Your 401(k) Is Healthy. So Maybe You Are, Too.",2014-08-16,article,News,,"['401(k), 403(b) and 457 Plans', 'Savings', 'Exercise', 'Diet and Nutrition', 'Pensions and Retirement Plans', 'Medicine and Health', 'Psychology and Psychologists', 'Retirement', 'Research', 'Personal Finances']"
"Aug. 16: Scenes on Twitter From Ferguson, Mo., Overnight",2014-08-16,article,News,,"['Demonstrations, Protests and Riots', 'Looting (Crime)']"
3 Liberian Health Workers With Ebola Receive Scarce Drug After Appeals to U.S.,2014-08-16,article,News,,"['ZMapp (Drug)', 'Ebola Virus', 'Drugs (Pharmaceuticals)']"
"In a Bank Settlement, Don’t Forget the Bulldozers",2014-08-16,article,News,,"['Real Estate and Housing (Residential)', 'Abandonment (Property)', 'Demolition', 'Mortgages', 'Banking and Financial Institutions', 'Foreclosures']"
"Authenticity, Repurposed, in a Mason Jar",2014-08-16,article,News,,"['Glassware', 'Containers and Packaging', 'Canning and Preserving', 'Food', 'Cooking and Cookbooks']"
"Everyone Gets a Share, of Everything",2014-08-16,article,News,,"['Hotels and Travel Lodgings', 'Mobile Applications', 'Travel and Vacations']"
Renting With Bad Credit,2014-08-16,article,News,,"['Real Estate and Housing (Residential)', 'Renting and Leasing (Real Estate)', 'Credit Scores']"
Steps and the City (Fairly Trivial),2014-08-16,article,News,,[]
Tug of War Between Republicans Seeking Same Base Support,2014-08-16,article,News,,"['Presidential Election of 2016', 'Ethics and Official Misconduct']"
Acclimating to Stardom and a New Coach,2014-08-16,article,News,,['Basketball']
Variety: Puns and Anagrams,2014-08-16,article,News,,['Crossword Puzzles']
"As (Very) Fast Friends, Two Young Americans Balance at Sport’s Peak",2014-08-16,article,News,,"['Swimming', 'Olympic Games (2012)', 'Pan Pacific Swimming Championships']"
"In the Sharing Economy, Workers Find Both Freedom and Uncertainty",2014-08-16,article,News,,"['Labor and Jobs', 'Mobile Applications', 'United States Economy', 'Working Hours']"
"In China’s Shadow, U.S. Courts Old Foe Vietnam",2014-08-16,article,News,,"['Embargoes and Sanctions', 'United States International Relations']"
Brokers of the Sharing Economy,2014-08-16,article,List,,[]
Plotting Lassie’s Future,2014-08-16,multimedia,Video,,['Dogs']
Floods and Landslides Kill Dozens and Leave Scores Missing in Nepal,2014-08-16,article,News,,"['Floods', 'Landslides and Mudslides', 'Deaths (Fatalities)', 'Monsoons', 'Rain']"
Lassie as Salesdog: One More Trip to the Well,2014-08-16,article,News,,"['Dogs', 'ADVERTISING AND MARKETING', 'ANIMATED FILMS']"
"In Push to Shorten Games, There’s No Time to Waste",2014-08-16,article,News,,['Baseball']
Plight of Iraqi Minorities Worsens With Forced Conversions and Killings,2014-08-16,article,News,,"['Muslims and Islam', 'Yazidi (Religious Sect)', 'Refugees and Displaced Persons']"
Deep Tensions Rise to Surface After Ferguson Shooting,2014-08-16,article,News,,"['Demonstrations, Protests and Riots', 'Blacks', 'Black People', 'Race and Ethnicity', 'Police Brutality, Misconduct and Shootings', 'Racial Profiling', 'Income Inequality']"
Smashing a Ceiling and a Lot of Egos,2014-08-16,article,News,,"['Basketball', 'Women and Girls']"
Best Shortstop on the Cubs? Scan the Field,2014-08-16,article,News,,['Baseball']
"Amid Debate Over Who Overstepped, Perry Calls Indictment a ‘Farce’ ",2014-08-16,article,News,,"['Governors (US)', 'Corruption (Institutional)', 'Presidential Election of 2016']"
"No Longer an Impact Player, a Giant Finds a Way to Deliver a Kaboom",2014-08-16,article,News,,"['Comic Books and Strips', 'Football']"
"Licia Albanese, Exalted Soprano, Is Dead at 105",2014-08-16,article,Obituary (Obit),,"['Opera', 'Deaths (Obituaries)']"
A Skewed View of a ‘Middle Tier’,2014-08-16,article,Letter,,"['College Athletics', 'Colleges and Universities']"
Is Summer Different Now?,2014-08-16,article,Op-Ed,,"['Summer (Season)', 'Social Conditions and Trends']"
"Couple Sexually Abused Amish Sisters, Officials Say",2014-08-16,article,News,,"['Kidnapping', 'Sex Crimes', 'Child Abuse and Neglect', 'AMISH']"
Grand Canyon Symphony,2014-08-16,article,Letter,,"['National Parks, Monuments and Seashores', 'Real Estate (Commercial)']"
Pope Francis in South Korea,2014-08-16,multimedia,Slideshow,,[]
Bolivia’s Subway in the Sky,2014-08-16,multimedia,Video,,"['Transit Systems', 'Commuting', 'Cable Cars and Trams']"
Where’s the Justice at Justice?,2014-08-16,article,Op-Ed,,"['News and News Media', 'Freedom of the Press', 'Books and Literature', 'Wiretapping and Other Eavesdropping Devices and Methods', 'Surveillance of Citizens by Government', 'News Sources, Confidential Status of']"
China Confronts Its Coal Problem,2014-08-16,article,Editorial,,"['Editorials', 'Coal', 'Greenhouse Gas Emissions', 'Air Pollution', 'Global Warming']"
Strutting Back With a Vengeance,2014-08-16,article,Editorial,,"['Turkeys', 'Conservation of Resources', 'Editorials']"
Sister Acts,2014-08-16,article,Op-Ed,,"['Nuns', 'Books and Literature']"
Fixing Immigration in the Field,2014-08-16,article,Editorial,,"['Immigration and Emigration', 'Editorials', 'Illegal Immigration', 'Discrimination', 'Hispanic-Americans', 'Deportation']"
Playing Soldier in the Suburbs,2014-08-16,article,Op-Ed,,"['Police', 'Demonstrations, Protests and Riots', 'Police Brutality, Misconduct and Shootings']"
A Battleground and Bellwether,2014-08-16,article,Op-Ed,,"['Politics and Government', 'Midterm Elections (2014)']"
"Sunday Breakfast Menu, Aug. 16",2014-08-16,article,News,,[]
"With Aid Doctors Gone, Ebola Fight Grows Harder",2014-08-16,article,News,,"['Ebola Virus', 'Epidemics', 'Medicine and Health', 'ZMapp (Drug)']"
Medicare to Start Paying Doctors Who Coordinate Needs of Chronically Ill Patients,2014-08-16,article,News,,"['Medicare', 'Health Insurance and Managed Care', 'Doctors']"
"On a Helicopter, Going Down: Inside a Lethal Crash in Iraq",2014-08-16,article,News,,"['Helicopters', 'Aviation Accidents and Safety', 'Yazidi (Religious Sect)', 'Kurds', 'Rescues']"
The Disappearing Volunteer Firefighter,2014-08-16,article,News Analysis,,"['Fires and Firefighters', 'Volunteers and Community Service', 'Social Conditions and Trends']"
Teaching Is Not a Business,2014-08-16,article,Op-Ed,,"['Education (K-12)', 'Tests and Examinations', 'Teachers and School Employees', 'Children and Childhood']"
"Leonard Fein, Provocative Writer on Jewish Affairs, Dies at 80",2014-08-16,article,Obituary (Obit),,"['Deaths (Obituaries)', 'Jews and Judaism', 'Writing and Writers', 'Books and Literature']"
Nadya Tolokonnikova,2014-08-16,article,Op-Ed,,['Music']
An SEC Partisan on Rooting for Greatness,2014-08-16,article,Question,,"['Football (College)', 'Books and Literature', 'College Athletics', 'Bowl Games']"
More Latinos on Farms Move From Fields to Office,2014-08-16,article,News,,"['Agriculture and Farming', 'Hispanic-Americans', 'Entrepreneurship', 'Small Business']"
A Choice Between Boredom and Blood,2014-08-16,article,Op-Ed,,"['Malaysia Airlines Flight 17', 'Human Rights and Human Rights Violations', 'Social Conditions and Trends']"
Man Is Accused of Stabbing 3 Inside Grand Central Station,2014-08-16,article,News,,"['Assaults', 'Grand Central Terminal (NYC)', 'Murders and Attempted Murders']"
35 Are Found as Container Is Unloaded Near London,2014-08-16,article,News,,"['Ships and Shipping', 'Illegal Immigration', 'Immigration and Emigration', 'Refugees and Displaced Persons', 'Ports']"
Cancer and the Secrets of Your Genes,2014-08-16,article,Op-Ed,,"['Genetics and Heredity', 'Cancer', 'Tests (Medical)', 'Research', 'Colon and Colorectal Cancer']"
A Protest Ignited,2014-08-16,multimedia,Video,,"['Police Brutality, Misconduct and Shootings', 'Demonstrations, Protests and Riots']"
Finding My Voice in Fantasy,2014-08-16,article,News,,['Writing and Writers']
"Eroni Kumana, Who Saved Kennedy and His Shipwrecked Crew, Dies at 96",2014-08-16,article,Obituary (Obit),,"['World War II (1939-45)', 'Deaths (Obituaries)']"
"With Subway in the Sky, Valley Meets Plateau",2014-08-16,article,News,,"['Cable Cars and Trams', 'Commuting', 'Transit Systems', 'Economic Conditions and Trends']"
"As the L.P.G.A. Leaves Town, a Community Contemplates a Void ",2014-08-16,article,News,,['Golf']
What the Sparrows Told Me,2014-08-16,article,News,,"['Animal Migration', 'Birds', 'Hurricane Katrina (2005)']"
Managers Provide Drama as English Fans Lament Talent Drain ,2014-08-16,article,News,,['Soccer']
The Wisdom of the Exile,2014-08-16,article,News,,"['Immigration and Emigration', 'Philosophy', 'Tango']"
Lack of Leadership and a Generational Split Hinder Protests in Ferguson,2014-08-16,article,News,,"['Blacks', 'Black People', 'Demonstrations, Protests and Riots', 'Police Brutality, Misconduct and Shootings', 'Police']"
The Obituary Lottery,2014-08-16,article,Op-Ed,,"['Deaths (Obituaries)', 'Celebrities', 'News and News Media']"
Bomb Scare in Brooklyn Causes False Alarm,2014-08-16,article,News,,['Bombs and Explosives']
Protesters Call for Pakistani Premier to Step Down,2014-08-16,article,News,,"['Demonstrations, Protests and Riots', 'Elections']"
Sittin’ Solve,2014-08-16,article,News,,['Crossword Puzzles']
Ink and Paper Make Comeback in Oil Towns,2014-08-16,article,News,,"['Magazines', 'Newspapers', 'Drilling and Boring']"
"Traffic Offense Program Is Seen as a Trap for Poor Drivers, but Proves Hard to Kill",2014-08-16,article,News,,"['Traffic and Parking Violations', 'Poverty']"
‘The Bridge’ Isn’t Real; It Just Seems That Way,2014-08-16,article,News,,['Television']
A Haven for an Iraqi Minority,2014-08-16,multimedia,Slideshow,,"['Yazidi (Religious Sect)', 'Muslims and Islam', 'Minorities']"
Flow of Olympiad Medals for Russian Men Dries Up,2014-08-16,article,News,,['Chess']
Artists’ Work Rises From the Destruction of the Israel-Gaza Conflict,2014-08-16,article,News,,"['Art', 'Social Media', 'Palestinians', 'Defense and Military Forces']"
Montana Democrats Pick Novice for Senate Race,2014-08-16,article,News,,"['Elections, Senate', 'Midterm Elections (2014)', 'United States Politics and Government']"
"After Doctor’s Visit, Ivanovic Rallies Past Sharapova to Advance to Final ",2014-08-17,article,News,,['Tennis']
"With Yankees and Their Spirits Slumping, Jeter Provides a Remedy",2014-08-17,article,News,,['Baseball']
"Winning Lottery Numbers for Aug. 16, 2014",2014-08-17,article,List,,['Lotteries']
Battling Ebola in Liberia,2014-08-17,multimedia,Slideshow,,"['Ebola Virus', 'Protective Clothing', 'Doctors']"
"Configuring a Future, the Mets Cobble a Win, Too",2014-08-17,article,News,,['Baseball']
"Quotation of the Day for Sunday, August 17, 2014",2014-08-17,article,News,,[]
Jets Win but Fail to Ease Worries Over Defensive Backfield ,2014-08-17,article,News,,['Football']
"Giants Get Last Laugh, but First Unit’s Struggles Cause No Smiles",2014-08-17,article,News,,['Football']
A Beautiful Mind,2014-08-17,article,News,,"['Interior Design and Furnishings', 'Fashion and Apparel']"
Elizabeth Forbes and Michael Siliciano,2014-08-17,article,News,,['Weddings and Engagements']
Lorraine Spradley and Sean Wilson,2014-08-17,article,News,,['Weddings and Engagements']
"Laura Flannery, Colin Masters",2014-08-17,article,News,,['Weddings and Engagements']
"Diana Ren, Michael Senno",2014-08-17,article,News,,['Weddings and Engagements']
"Mary Kearns, Peter Naylor",2014-08-17,article,News,,['Weddings and Engagements']
"Caroline Balkonis, Andrew Usas",2014-08-17,article,News,,['Weddings and Engagements']
"Lauren Koppel, Eric Fraser",2014-08-17,article,News,,['Weddings and Engagements']
"Jill Springer, William Gostic II",2014-08-17,article,News,,['Weddings and Engagements']
"Gowri Ramachandran, Anshul Amar",2014-08-17,article,News,,['Weddings and Engagements']
"Saba Bireda, Harambee Ryan",2014-08-17,article,News,,['Weddings and Engagements']
"Rae Schweizer, Craig Story",2014-08-17,article,News,,['Weddings and Engagements']
"Kate Berry, Will Sheppard",2014-08-17,article,News,,['Weddings and Engagements']
"Tyrha Lindsey, Sidney Warren",2014-08-17,article,News,,['Weddings and Engagements']
"Carlisle Williams, Paul Engelhardt",2014-08-17,article,News,,['Weddings and Engagements']
"Jessica Brondo, Nicholas Davidoff",2014-08-17,article,News,,['Weddings and Engagements']
Hope Wachter and Robert Kaplan,2014-08-17,article,News,,['Weddings and Engagements']
"Vivian Tsai, Austin Lin",2014-08-17,article,News,,['Weddings and Engagements']
"Sheila Bautista, Charles Toothill II",2014-08-17,article,News,,['Weddings and Engagements']
Barbara Rice and Katherine Callaghan,2014-08-17,article,News,,['Weddings and Engagements']
"Amanda Thurston, Matthew Andrews",2014-08-17,article,News,,['Weddings and Engagements']
"Emily Ward, Gary Lupyan",2014-08-17,article,News,,['Weddings and Engagements']
"Savanna Thor, Simon Smith",2014-08-17,article,News,,['Weddings and Engagements']
Altaf Saadi and Sameer Ahmed,2014-08-17,article,News,,['Weddings and Engagements']
"June Chan, Nancy Ferrone",2014-08-17,article,News,,['Weddings and Engagements']
"Jessica Eisner, Michael Cabin",2014-08-17,article,News,,['Weddings and Engagements']
A Childhood Romance Grows Up,2014-08-17,article,News,,['Weddings and Engagements']
"Samuel Talone, Dickson Jean",2014-08-17,article,News,,['Weddings and Engagements']
Elizabeth Kirby and Timothy Fuderich,2014-08-17,article,News,,['Weddings and Engagements']
"Judith Scarl, David Williams",2014-08-17,article,News,,['Weddings and Engagements']
"Elizabeth Olney, Aaron Goldfarb",2014-08-17,article,News,,['Weddings and Engagements']
"Elizabeth Tepe, John Kneeland",2014-08-17,article,News,,['Weddings and Engagements']
"Leila Taha, Saed Shonnar",2014-08-17,article,News,,['Weddings and Engagements']
"Corrections: August 17, 2014",2014-08-17,article,News,,[]
Vows | Celebrity Stylists Wed on the Fly,2014-08-17,multimedia,Video,,"['Vows (Times Column)', 'Weddings and Engagements']"
Transplant Brokers in Israel Lure Desperate Kidney Patients to Costa Rica,2014-08-17,article,News,,"['Organ Donation', 'Transplants', 'Kidneys', 'Black Markets', 'Jews and Judaism']"
An Impossible Wait List,2014-08-17,multimedia,Video,,"['Kidneys', 'Transplants', 'Kidney transplant']"
Advocate for Deceased Organ Donation,2014-08-17,multimedia,Video,,['Organ Donation']
Opposes Deceased Organ Donations,2014-08-17,multimedia,Video,,"['Organ Donation', 'Transplants', 'Kidneys']"
A Clash of Religion and Bioethics Complicates Organ Donation in Israel,2014-08-17,article,News,,"['Organ Donation', 'Transplants', 'Medicine and Health', 'Kidneys', 'Jews and Judaism', 'Rabbis', 'Brain', 'Black Markets']"
Violence Flares in Ferguson After Appeals for Harmony,2014-08-17,article,News,,"['Demonstrations, Protests and Riots', 'Police Brutality, Misconduct and Shootings', 'Blacks', 'Black People', 'Curfews']"
Thousands in Hong Kong Rally in Support of China,2014-08-17,article,News,,"['Demonstrations, Protests and Riots', 'Democracy (Theory and Philosophy)']"
"After a Miscarriage, Seeking Permission to Grieve",2014-08-17,article,News,,"['Babies and Infants', 'Grief (Emotion)', 'Miscarriages', 'Parenting']"
Reprogramming Government: A Conversation With Mikey Dickerson,2014-08-17,article,News,,"['Computers and the Internet', 'United States Politics and Government']"
1914: British Committee Helps Visitors in Paris,2014-08-17,article,News,,"['English Language', 'Language and Languages', 'Travel and Vacations']"
From Field to Front Office,2014-08-17,multimedia,Video,,"['Agriculture and Farming', 'Hispanic-Americans', 'Small Business', 'Flowers and Plants']"
The Truth About Unmarried Moms,2014-08-17,article,News,,"['Marriages', 'Parenting', 'Pregnancy and Childbirth']"
Readers Respond: Michael Brown and Black Men,2014-08-17,article,News,,"['Blacks', 'Black People', 'Discrimination', 'Race and Ethnicity', 'Racial Profiling']"
New Drug Helps Some Bald Patients Regrow Hair,2014-08-17,article,News,,"['Hair', 'Baldness', 'Alopecia Areata', 'Immune System', 'Research', 'Drugs (Pharmaceuticals)']"
"In the Bronx, an Unlikely Sanctuary for Birds, and People",2014-08-17,article,News,,"['Birds', 'Parks and Other Recreation Areas']"
1939: Tate Gallery Refuses Portrait by John Singer Sargent,2014-08-17,article,News,,"['Art', 'Museums', 'Royal Family']"
Drawing the Line Between Soldier and Cop,2014-08-17,article,News,,"['Police', 'Police Brutality, Misconduct and Shootings', 'Politics and Government', 'United States Defense and Military Forces', 'United States Politics and Government']"
Jazz at Lincoln Center to Open a Summer Academy,2014-08-17,article,News,,['Jazz']
United by Their Rough Edges,2014-08-17,article,Review,,"['Music', 'Rap and Hip-Hop']"
What’s On TV Sunday,2014-08-17,article,Schedule,,[]
"In Wake of Indictment, Perry Defends Veto (and Criticizes Obama)",2014-08-17,article,News,,"['District Attorneys', 'Drunken and Reckless Driving', 'Corruption (Institutional)']"
Kurds Move to Retake Dam as U.S. Bombs Weaken ISIS,2014-08-17,article,News,,"['Kurds', 'United States Defense and Military Forces']"
An Agent of Change,2014-08-17,article,News,,"['Basketball', 'AGENTS (BUSINESS)']"
News From the Advertising Industry,2014-08-17,article,News,,"['ADVERTISING AND MARKETING', 'Appointments and Executive Changes', 'Mergers, Acquisitions and Divestitures']"
Ukraine Says Army Controls Center of a Rebel City,2014-08-17,article,News,,['Defense and Military Forces']
Liberia Expanding Space for Ebola Patient Care,2014-08-17,article,News,,"['Ebola Virus', 'Hospitals']"
Using a Tawdry 1990s Case to Put the Camera on Trial,2014-08-17,article,Review,,['Television']
"In a Metropolis, a Messenger Bag Might Come in Handy",2014-08-17,article,Review,,['Television']
"In Uncertain Times, a Suitor’s Rose Is Still Silver",2014-08-17,article,Review,,"['Opera', 'Salzburg Festival']"
A Railroad Built Out of Prisoners’ Pain and Sweat,2014-08-17,article,Review,,['Books and Literature']
"Encouraged by Defeat, Mets Stay Positive as Rookie Throws Aggressively",2014-08-17,article,News,,['Baseball']
World Youth Teams Championships Unfold,2014-08-17,article,News,,"['Cards and Card Games', 'Bridge (Card Game)']"
‘The Expendables 3’ Fumbles Its Mission,2014-08-17,article,News,,['Movies']
Treasury Auctions Set for the Week of Aug. 18,2014-08-17,article,News,,"['Stocks and Bonds', 'Credit and Debt', 'Income Tax']"
"Thanks to Pitchers, Yankees Finish Trip on an Upbeat Note",2014-08-17,article,News,,['Baseball']
Barbarians at the Art Auction Gates? Not to Worry,2014-08-17,article,News,,"['Art', 'Auctions', 'Finances', 'Collectors and Collections']"
My Life in Bicycles,2014-08-17,article,Op-Ed,,['Bicycles and Bicycling']
Edelman P.R. Firm Acts to Correct Faux Pas,2014-08-17,article,News,,"['Public Relations and Publicity', 'ADVERTISING AND MARKETING', 'Global Warming', 'Depression (Mental)']"
"For a Festival, Change Comes, Invited or Not",2014-08-17,article,News,,"['Music', 'Lucerne Festival', 'Classical Music']"
The Pope Visits South Korea,2014-08-17,article,Op-Ed,,[]
"The Witches, the Furies and Mozart",2014-08-17,article,Review,,"['Music', 'Mostly Mozart Festival', 'Classical Music']"
Eclipsing a Fast-Food Clown With Beats and Break-Dancing,2014-08-17,article,Review,,"['Dancing', 'Rap and Hip-Hop', 'Asian-Americans']"
"It’s a New Crown for Williams, but It’s Old Hat to Federer in Ohio",2014-08-17,article,News,,['Tennis']
Misfit,2014-08-17,article,News,,['Crossword Puzzles']
Q. and A.: Wu Heng on Throwing China’s Food Out the Window,2014-08-17,article,News,,"['Consumer Protection', 'Food', 'Food Contamination and Poisoning', 'Meat', 'Supermarkets and Grocery Stores']"
Retailers Report Earnings in a Subdued Season,2014-08-17,article,News,,"['Shopping and Retail', 'United States Economy', 'Company Reports', 'Consumer Price Index', 'Taxation', 'Inflation (Economics)']"
When Baby Pictures Offend the Law,2014-08-17,article,Letter,,"['Babies and Infants', 'Law and Legislation', 'Privacy', 'Photography']"
"The Music of 10,000 Nights",2014-08-17,article,Review,,['Theater']
Experts Say a Second Work in Munich Was Looted,2014-08-17,article,Brief,,"['Arts and Antiquities Looting', 'Art', 'Holocaust and the Nazi Era']"
"Emmys Go to Fallon, ‘Orange’ and, Yes, HBO",2014-08-17,article,Brief,,"['Television', 'Emmy Awards']"
Carnegie Hall Executive to Run Symphony Space,2014-08-17,article,Brief,,['Appointments and Executive Changes']
What Do You Remember From the First Time You Saw ‘Pippin’?,2014-08-17,article,News,,['Theater']
Trying to Ensure the Fundamental Right to Vote,2014-08-17,article,Letter,,"['Voting and Voters', 'Voting Rights Act (1965)', 'Voter Registration and Requirements']"
Justice for Rape Victims,2014-08-17,article,Letter,,"['Sex Crimes', 'DNA (Deoxyribonucleic Acid)', 'Law and Legislation']"
View of #Ferguson Thrust Michael Brown Shooting to National Attention,2014-08-17,article,News,,"['News and News Media', 'Demonstrations, Protests and Riots', 'Police Brutality, Misconduct and Shootings', 'Social Media', 'Freedom of the Press', 'Newspapers']"
"Despite a Turbulent Work Life, a Minister Doesn’t Question Her Calling",2014-08-17,article,News,,"['Ministers (Protestant)', 'Religion and Belief', 'Unemployment', 'Social Conditions and Trends']"
Court Filings From Arizona Prisoners’ Lawsuit,2014-08-17,multimedia,Interactive Feature,,"['Prisons and Prisoners', 'Capital Punishment', 'Suits and Litigation (Civil)']"
Preseason Wind-Down? Not for a Giants Offense That Needs a Lot of Work,2014-08-17,article,News,,['Football']
Native Fantasy: Germany’s Indian Heroes,2014-08-17,multimedia,Video,,"['Native Americans', 'Books and Literature', 'Movies']"
"Arizona Loose With Its Rules in Executions, Records Show",2014-08-17,article,News,,"['Capital Punishment', 'Prisons and Prisoners']"
"In Ferguson, Black Town, White Power",2014-08-17,article,Op-Ed,,"['Blacks', 'Black People', 'Police', 'Race and Ethnicity', 'Local Government', 'Politics and Government']"
Lost in Translation: Germany’s Fascination With the American Old West,2014-08-17,article,News,,"['Native Americans', 'ARCHAEOLOGY', 'Museums']"
When Being ‘Obsessed’ With Hillary Clinton Is Your Job,2014-08-18,article,News,,[]
‘Ice Bucket Challenge’ Has Raised Millions for ALS Association,2014-08-18,article,News,,"['Social Media', 'AMYOTROPHIC LATERAL SCLEROSIS', 'Video Recordings, Downloads and Streaming', 'Philanthropy', 'Celebrities']"
Case in Which Abortion Was Denied Reignites Controversy Over Irish Law,2014-08-18,article,News,,"['ABORTION', 'Law and Legislation', 'Women and Girls']"
"Childhood Passion for Celebrity Still Drives the Editor of People Magazine, Jess Cagle",2014-08-18,article,News,,"['Magazines', 'Celebrities']"
"Jay Adams, Who Revolutionized Skateboarding, Dies at 53",2014-08-18,article,Obituary (Obit),,"['Skateboarding', 'Deaths (Obituaries)']"
"Sophie Masloff, Ex-Mayor of Pittsburgh, Dies at 96",2014-08-18,article,Obituary (Obit),,"['Deaths (Obituaries)', 'Mayors']"
German Authors Join Protest Over Amazon’s Tactics in E-Book Dispute,2014-08-18,article,News,,"['Writing and Writers', 'E-Books and Readers', 'Book Trade and Publishing']"
Why We Fight Wars,2014-08-18,article,Op-Ed,,"['War and Revolution', 'ARMS CONTROL AND LIMITATION AND DISARMAMENT', 'World War I (1914-18)', 'Iraq War (2003-11)', 'Defense and Military Forces']"
Oil Industry’s Taxes Create Odd Wedge for Alaskan Voters,2014-08-18,article,News,,"['Oil (Petroleum) and Gasoline', 'Referendums', 'Tax Credits, Deductions and Exemptions']"
