headline,date,doc_type,material_type,section,keywords
Inside The New York Times Book Review: ‘All That Is Solid Melts Into Air’,2014-08-08,audio,,,['Books and Literature']
A Cooking Tour in Southern Turkey,2014-08-08,article,News,,['Travel and Vacations']
Strong Winds Ahead of Hurricane Iselle,2014-08-08,multimedia,Video,,['Hurricanes and Tropical Storms']
Paperback Row,2014-08-08,article,List,,['Books and Literature']
Editors’ Choice,2014-08-08,article,List,,['Books and Literature']
Inside the List,2014-08-08,article,News,,['Books and Literature']
The Interpretation of Freud,2014-08-08,article,Review,,"['Books and Literature', 'Psychology and Psychologists']"
World War II Lit,2014-08-08,article,Review,,['Books and Literature']
Reality Bites,2014-08-08,article,Review,,['Books and Literature']
W.H.O. on Ebola Emergency Declaration,2014-08-08,multimedia,Video,,"['Ebola Virus', 'Epidemics']"
Letters: ‘A Troublesome Inheritance’,2014-08-08,article,News,,['Books and Literature']
Seduction and Betrayal,2014-08-08,article,Review,,['Books and Literature']
Striking It Rich,2014-08-08,article,Review,,['Books and Literature']
Enlisted Women,2014-08-08,article,Review,,"['Books and Literature', 'United States Defense and Military Forces']"
Seen on the Street | Outside the Spring/Summer 2015 Copenhagen Shows,2014-08-08,article,News,,['Fashion and Apparel']
Unmasters of Sex,2014-08-08,article,Review,,"['Books and Literature', 'Graphic Novels']"
You Mean It’s Not Dead?,2014-08-08,article,Review,,['Books and Literature']
The Search Continues,2014-08-08,article,Review,,['Books and Literature']
Between God and the Führer,2014-08-08,article,Review,,['Books and Literature']
Paul McCartney Collaborates on a Video Game Score,2014-08-08,article,News,,['Music']
"A Ranch With 1,000 Acres, for Your Inner Buckaroo",2014-08-08,article,News,,"['Ranches', 'Real Estate and Housing (Residential)']"
The Distance Between,2014-08-08,article,Review,,['Books and Literature']
Britain’s Drinking Problem,2014-08-08,article,Op-Ed,,"['Alcohol Abuse', 'Social Conditions and Trends', 'ALCOHOLIC BEVERAGES']"
Creating Captions on YouTube Videos,2014-08-08,article,Question,,"['Computers and the Internet', 'Video Recordings, Downloads and Streaming']"
Movie Review ‘Web Junkie’,2014-08-08,multimedia,Video,,"['Movies', 'Documentary Films and Programs']"
Movie Review: ‘The Hundred-Foot Journey’,2014-08-08,multimedia,Video,,['Movies']
Book Review Podcast: ‘All That Is Solid Melts Into Air’,2014-08-08,article,News,,['Books and Literature']
Movie Review: ‘The Dog’,2014-08-08,multimedia,Video,,"['Movies', 'Documentary Films and Programs']"
Today in Small Business: No Snacking,2014-08-08,article,News,,"['Small Business', 'Start-ups', 'United States Economy']"
Cava Is Overlooked Everywhere but Catalonia,2014-08-08,article,News,,['Wines']
"In China, British Investigator Hired by Glaxo, and Wife, Sentenced to Prison",2014-08-08,article,News,,"['Privacy', 'Whistle-Blowers']"
Why You Lie About Where You’re From,2014-08-08,article,News,,"['Affordable Housing', 'Area Planning and Renewal', 'Suburbs', 'Urban Areas']"
1914: France Reclaims Alsace,2014-08-08,article,News,,"['Defense and Military Forces', 'World War I (1914-18)']"
Searching for Vintage Toilet Seats and Other Parts,2014-08-08,article,News,,"['Bathrooms and Toilets', 'Computers and the Internet', 'Home Repairs and Improvements']"
Weekend Auto Calendar: Coys Classics at the ‘Ring,2014-08-08,article,News,,"['Automobiles', 'Antique and Classic Cars', 'Automobile Racing', 'Nascar Sprint Cup Series', 'Auctions']"
Crime Writer Signs Deal to Advertise on Jerseys,2014-08-08,article,News,,"['Soccer', 'Books and Literature', 'Uniforms']"
Strikes Resume in Gaza Strip,2014-08-08,multimedia,Video,,['Palestinians']
Home Sales Around the Region,2014-08-08,multimedia,Interactive Feature,,['Real Estate and Housing (Residential)']
What We Mean When We Say Student Debt Is Bad,2014-08-08,article,News,,"['Student Loans', 'Colleges and Universities']"
Going for a Run Around the World,2014-08-08,article,Question,,"['Travel and Vacations', 'Running']"
"Seeing Mexico City, Guided by Architects",2014-08-08,article,News,,"['ARCHITECTURE', 'Travel and Vacations']"
Restoring Acadia’s Trails,2014-08-08,article,News,,"['Hikes and Hiking', 'Travel and Vacations']"
"A Boy at Play in Gaza, a Renewal of Warfare, a Family in Mourning",2014-08-08,article,News,,['Palestinians']
Blast in Ukraine’s Capital Stirs Fears of New Conflict,2014-08-08,article,News,,['Bombs and Explosives']
The Magic of Swimming on Martha’s Vineyard,2014-08-08,article,News,,"['Swimming', 'Travel and Vacations']"
"The Flavor of Corn, but With Sizzle",2014-08-08,article,News,,"['Corn', 'Cooking and Cookbooks']"
"Ryerson, an Old Chicago Steel Company, Slumps in Market Debut",2014-08-08,article,News,,[]
Restaurant Report: The Raeburn in Edinburgh,2014-08-08,article,News,,"['Restaurants', 'Local Food', 'Travel and Vacations']"
When a Mormon Teenager Takes a Transgender Journey,2014-08-08,article,News,,"['Documentary Films and Programs', 'Gender', 'Mormons (Church of Jesus Christ of Latter-Day Saints)', 'Transgender and Transsexuals']"
Etihad Airways Completes Deal to Buy 49% of Alitalia,2014-08-08,article,News,,['AIRLINES AND AIRPLANES']
"Your Turn: A Weekend Thread, Open for Comments",2014-08-08,article,News,,[]
Where the Grande Dame of the Thriller Chills,2014-08-08,article,News,,"['Real Estate and Housing (Residential)', 'Writing and Writers', 'Books and Literature']"
"On Fishers Island, N.Y., Summertime Style and Flavors Run in the Family",2014-08-08,article,News,,['Travel and Vacations']
A Tax Inversion in All but Name,2014-08-08,article,News,,"['Corporate Taxes', 'Mergers, Acquisitions and Divestitures', 'Taxation']"
Bloomberg’s Bruised Legacy,2014-08-08,article,News,,"['Bicycles and Bicycling', 'Hurricane Sandy (2012)']"
"Cars to Watch, and Wish For, at the Monterey Auctions",2014-08-08,multimedia,Slideshow,,[]
"Papers, Please!",2014-08-08,article,News,,"['Civil War (US) (1861-65)', 'Passports']"
Driven | 2015 BMW 435i Convertible,2014-08-08,multimedia,Video,,['Automobiles']
The Pesh Merga’s Fight Against ISIS,2014-08-08,multimedia,Video,,"['Kurds', 'United States International Relations']"
The Alchemist,2014-08-08,audio,,,['Music']
2014 Volkswagen Jetta GLI,2014-08-08,multimedia,Slideshow,,[]
"Video: The BMW 435i Is a Ray of Sunshine, for a Price",2014-08-08,article,News,,"['Automobiles', 'Convertibles (Autos)']"
A Two-Step Plan to Stop Hackers,2014-08-08,article,News,,"['Computer Security', 'Cyberattacks and Hackers', 'Banking and Financial Institutions']"
When Downtown Real Estate Turned Upward,2014-08-08,article,News,,"['ARCHITECTURE', 'Real Estate (Commercial)', 'Historic Buildings and Sites']"
Popcast: The Alchemist,2014-08-08,article,News,,['Music']
Back to American Force in Iraq,2014-08-08,article,Letter,,"['United States Defense and Military Forces', 'Humanitarian Aid', 'Yazidi (Religious Sect)', 'War Crimes, Genocide and Crimes Against Humanity']"
Big Ticket | Luxury Near the Zoo for $31.86 Million,2014-08-08,article,News,,['Real Estate and Housing (Residential)']
Board of North Miami MOCA Announces Move to Miami,2014-08-08,article,News,,['Museums']
McIlroy Shines Through the Sogginess,2014-08-08,article,News,,"['PGA Championship', 'Golf']"
On the Market in New York City,2014-08-08,article,News,,['Real Estate and Housing (Residential)']
On the Market in the Region,2014-08-08,article,News,,['Real Estate and Housing (Residential)']
Hearing Is Set on Voiding Conviction in Murder of Utah Tourist,2014-08-08,article,News,,"['Murders and Attempted Murders', 'Muggings']"
Airstrikes in Iraq Seen Near Erbil,2014-08-08,multimedia,Video,,[]
A Tax Inversion in a Glass,2014-08-08,article,News,,"['Corporate Taxes', 'Cocktails', 'ALCOHOLIC BEVERAGES']"
Weekend Reading: The Business of Being a Bank,2014-08-08,article,News,,[]
Not Enough to Smooth the Bumps,2014-08-08,article,Review,,['Automobiles']
Think Like a Doctor: Losing It Solved!,2014-08-08,article,News,,"['Celiac Disease', 'Doctors', 'Gluten', 'Tests (Medical)']"
"Bipartisan Support, With Caveats, for Obama on Iraq Airstrikes",2014-08-08,article,News,,['United States Defense and Military Forces']
How Math Got Its ‘Nobel’,2014-08-08,article,Op-Ed,,"['Mathematics', 'Nobel Prizes', 'Awards, Decorations and Honors']"
"Voice Recognition Still a Top Complaint, Study Says",2014-08-08,article,News,,"['Automobiles', 'Voice Recognition Systems']"
"For Car Lovers, Summer Peaks on the California Coast",2014-08-08,article,News,,"['Antique and Classic Cars', ""Pebble Beach Concours D'Elegance (Car Show)"", 'Automobiles']"
Much to Do Around Monterey,2014-08-08,article,News,,"['Antique and Classic Cars', ""Pebble Beach Concours D'Elegance (Car Show)"", 'Automobiles', 'Parties (Social)', 'Auctions']"
"As Dealers Settle In, Residential Developers Come Knocking",2014-08-08,article,News,,"['Automobiles', 'Real Estate (Commercial)', 'Real Estate and Housing (Residential)', 'Relocation of Business']"
"At a Brooklyn Institution, Old School Goes iPad",2014-08-08,article,News,,"['Restaurants', 'iPad']"
Pictures of the Day: Gaza City and Elsewhere,2014-08-08,multimedia,Slideshow,,[]
Pictures of the Day: Gaza City and Elsewhere,2014-08-08,article,News,,['Photography']
Watergate’s Emotional Legacy,2014-08-08,article,News,,"['Impeachment', 'Polls and Public Opinion', 'United States Politics and Government', 'Watergate Affair']"
"After Decades in Exile, a South African Writer’s Remains Will Head Home",2014-08-08,article,News,,"['Apartheid (Policy)', 'Writing and Writers', 'Immigration and Emigration', 'Race and Ethnicity']"
90-Year-Old Sex Columnist Shatters Taboos in India,2014-08-08,article,Biography,,"['Sex', 'News and News Media']"
Iraq Strikes Seen as Giving Putin Pretext in Ukraine,2014-08-08,article,News,,[]
N.C.A.A.’s Vote on Autonomy Generates Criticism,2014-08-08,article,News,,"['College Athletics', 'Colleges and Universities']"
"Crossing Rivers, Searching for the Future",2014-08-08,multimedia,Slideshow,,[]
Bill Cunningham | Gray Is the New Black,2014-08-08,multimedia,Video,,['Fashion and Apparel']
Share Your Hijab Fashion on Instagram,2014-08-08,article,News,,['Fashion and Apparel']
Your Evening Briefing,2014-08-08,article,News,,[]
Bill Cunningham | Gray Matters,2014-08-08,article,News,,['Fashion and Apparel']
Read This Before You Write Your Dating Profile,2014-08-08,article,News,,"['Computers and the Internet', 'Dating and Relationships', 'Letters', 'Online Dating']"
The Youngest Are Hungriest,2014-08-08,article,Op-Ed,,"['Height (Stature)', 'Children and Childhood', 'Malnutrition', 'Babies and Infants', 'Families and Family Life']"
Miami Grows Up. A Little.,2014-08-08,article,Op-Ed,,['Americans Abroad']
Pity the Poor Working Artist in Las Vegas,2014-08-08,article,Review,,"['Movies', 'Dancing']"
Evening Hours | Sentimental Journeys,2014-08-08,multimedia,Interactive Feature,,"['Fashion and Apparel', 'Parties (Social)']"
He Rarely Stops Writing,2014-08-08,article,News,,"['Books and Literature', 'Writing and Writers']"
"The Half-Century-Long Renovation of Rundale Palace, the Versailles of Latvia",2014-08-08,article,News,,"['ARCHITECTURE', 'Restoration and Renovation']"
With This Ship’s Shackle I Thee Wed,2014-08-08,multimedia,Slideshow,,[]
Truscott/United States Playing Card Senior Swiss Teams,2014-08-08,article,News,,"['Bridge (Card Game)', 'Cards and Card Games']"
"All Brahms, by the (Smaller) Numbers",2014-08-08,article,Review,,"['Music', 'Mostly Mozart Festival', 'Classical Music']"
What We’re Reading,2014-08-08,article,News,,"['Baseball', 'Defense and Military Forces', 'Music', 'Newspapers']"
"Burned by Losses on Portuguese Bank Bonds, Hedge Funds Ponder Next Steps",2014-08-08,article,News,,"['Credit and Debt', 'Foreign Investments', 'Hedge Funds']"
"A Letter to the President, and a Well-Timed Response",2014-08-08,article,News,,"['Iraq War (2003-11)', 'Terrorism', 'United States Defense and Military Forces', 'Vietnam War']"
A Voyage That Is Finally Complete,2014-08-08,article,News,,"['Vows (Times Column)', 'Weddings and Engagements']"
The Murakami Effect,2014-08-08,article,News,,[]
"Where Big Stars and Little Stars Shine, for a Bargain",2014-08-08,article,Review,,"['Dancing', 'Vail International Dance Festival']"
A Trip to the Big City,2014-08-08,article,News,,['Elderly']
Tennessee Ignores the Koch Brothers,2014-08-08,article,News,,"['Elections, Courts and the Judiciary']"
"An Old Love Story, Tinkered for the Times",2014-08-08,article,Review,,"['Dancing', 'Mostly Mozart Festival']"
Court Rejects Deal on Hiring in Silicon Valley,2014-08-08,article,News,,"['Computers and the Internet', 'Antitrust Laws and Competition Issues', 'Suits and Litigation (Civil)', 'Hiring and Promotion']"
"Sacred Music and Movement, With an Infectious Beat",2014-08-08,article,Review,,"['Dancing', 'Music', 'Lincoln Center Out of Doors Festival']"
There’s Always Someone You’re Smarter Than,2014-08-08,article,News,,['Television']
Story Lines (and More) Assembled in Parts,2014-08-08,article,Review,,['Theater']
"Less Like a Chef, More Like an Actor",2014-08-08,article,News,,"['Movies', 'Cooking and Cookbooks']"
"Friday Night Music: San Fermin, Revised",2014-08-08,article,News,,[]
Choice Cuts: Zero Freitas’s Rarest Records,2014-08-08,article,News,,[]
"For a Bit of Broadway, Turn Left at Space Mountain",2014-08-08,article,News,,"['Theater', 'AMUSEMENT AND THEME PARKS', 'Music']"
Facebook’s Change of Face,2014-08-08,article,News,,"['Social Media', 'Palestinians', 'News and News Media']"
"Coroner Is Said to Rule James Brady’s Death a Homicide, 33 Years After a Shooting",2014-08-08,article,News,,"['Assassinations and Attempted Assassinations', 'Murders and Attempted Murders']"
CrossFit Flirting: Talk Burpee to Me,2014-08-08,article,News,,"['Exercise', 'Dating and Relationships', 'Single Persons', 'Health Clubs']"
His Own Redemption Story,2014-08-08,article,News,,"['Magazines', 'News and News Media', 'Celebrities', 'Drug Abuse and Traffic', 'Writing and Writers']"
Finding Sharp Differences in the Similarities,2014-08-08,article,Review,,"['Dancing', 'Central Park Summerstage']"
"Rihanna’s Legal Maneuver, Kate Moss’s Run-In With Justin Bieber and Lupita Nyong’O’s Latest Honor",2014-08-08,article,News,,['Fashion and Apparel']
Under Cover: Decidedly D.I.Y.,2014-08-08,article,News,,[]
"Watching Your Back, and What’s on It",2014-08-08,article,News,,"['Photography', 'T-Shirts (Apparel)', 'Books and Literature']"
Sunday Routine: Khajak Keledjian,2014-08-08,multimedia,Video,,['Meditation']
"Khajak Keledjian: Zero to 60, and Back Again",2014-08-08,article,News,,['Fashion and Apparel']
Judge Threatens Argentina With Contempt Over Its Statements,2014-08-08,article,News,,"['Government Bonds', 'Suits and Litigation (Civil)']"
"Medicine Man and Mayor, Blended",2014-08-08,article,News,,"['Juices', 'Food Trucks and Vendors']"
"N.C.A.A. Must Allow Colleges to Pay Athletes, Judge Rules",2014-08-08,article,News,,"['College Athletics', 'Antitrust Laws and Competition Issues', 'Suits and Litigation (Civil)']"
"Cold and Sweet, No Trip to the Jersey Shore Necessary",2014-08-08,article,News,,['Ice Cream and Frozen Desserts']
G.M.’s Woes Multiply as It Announces Further Recalls,2014-08-08,article,News,,"['Automobile Safety Features and Defects', 'Recalls and Bans of Products']"
"Recollections, Past and Future",2014-08-08,article,News,,['Movies']
"Cashew Juice, the Apple of Pepsi’s Eye",2014-08-08,article,News,,"['Beverages', 'Fruit', 'Agriculture and Farming', 'Juices', 'Nuts']"
Defense Seeks to Move Trial on Boston Marathon Bombing,2014-08-08,article,News,,"['Boston Marathon Bombings (2013)', 'Murders and Attempted Murders', 'Capital Punishment']"
Chimney Swift: Suited for Ashes and Soot,2014-08-09,article,News,,['Birds']
U.S. Jews and Israel: Support and Criticism,2014-08-09,article,Letter,,"['Palestinians', 'Zionism', 'Polls and Public Opinion']"
"School Lessons, From South Korea to Finland",2014-08-09,article,Letter,,"['Tests and Examinations', 'Education (K-12)', 'Teachers and School Employees']"
"Facebook Messenger Switch Controversy Is Part Misunderstanding, Part Mistrust",2014-08-09,article,News,,"['Instant Messaging', 'Mobile Applications', 'Social Media']"
Claims Against BP,2014-08-09,article,Letter,,"['Gulf of Mexico Oil Spill (2010)', 'Suits and Litigation (Civil)']"
Khmer Rouge Convictions,2014-08-09,article,Letter,,"['War Crimes, Genocide and Crimes Against Humanity', 'Decisions and Verdicts']"
Virginia Ex-Governor’s Trial Keeps Focus on Key Donor’s Character,2014-08-09,article,News,,"['Bribery and Kickbacks', 'Gifts to Public Officials']"
"Yields on 10-Year Treasuries Fall, Confounding the Experts",2014-08-09,article,News,,"['Government Bonds', 'United States Economy']"
It’s a Can’t-Lose Year,2014-08-09,article,Op-Ed,,"['United States Politics and Government', 'Primaries and Caucuses', 'ABORTION', 'Midterm Elections (2014)', 'Elections, House of Representatives']"
Taking the Express to Zen,2014-08-09,article,News,,"['Models and Replicas', 'Railroads', 'Automobiles']"
29 States Seek Tighter E-Cigarette Regulations,2014-08-09,article,News,,"['Smoking and Tobacco', 'E-Cigarettes', 'Regulation and Deregulation of Industry', 'States (US)', 'Attorneys General', 'ADVERTISING AND MARKETING']"
"Half a Ton of This, Half a Ton of That: Russia Is Calm Over Food Import Bans",2014-08-09,article,News,,"['Embargoes and Sanctions', 'Food', 'International Trade and World Market']"
Tiny Lead for Incumbent in Tennessee Primary Vote,2014-08-09,article,News,,"['Midterm Elections (2014)', 'Primaries and Caucuses', 'Elections, House of Representatives', 'Voting and Voters', 'ADULTERY']"
Inquiry Seeks Twitter User in Brooklyn Bridge Flag Case,2014-08-09,article,News,,"['Flags, Emblems and Insignia', 'Social Media']"
"Speaking Openly, but Giving Conflicting Accounts of ‘Knockout Game’ Assaults",2014-08-09,article,News,,['Assaults']
Nazi Spies and New York Perspectives,2014-08-09,article,News,,"['Books and Literature', 'World War II (1939-45)', 'Espionage and Intelligence Services']"
"Living, and Leaving, the Dream",2014-08-09,article,News,,"['Baseball', 'Writing and Writers']"
Questions on Telephone Poles and Subway Globes,2014-08-09,article,Question,,"['Subways', 'Telephones and Telecommunications']"
Motorbikers in North Korea Are Told to Park to Save Fuel,2014-08-09,article,News,,"['Motorcycles, Motor Bikes and Motorscooters', 'Oil (Petroleum) and Gasoline', 'Defense and Military Forces']"
"Guided by History, a Jew Tries to Unite Two Faiths Divided by War in Gaza",2014-08-09,article,News,,"['Jews and Judaism', 'Muslims and Islam', 'Prayers and Prayer Books', 'Volunteers and Community Service']"
Massachusetts: Health Site Will Stay State-Based ,2014-08-09,article,Brief,,"['Health Insurance and Managed Care', 'Patient Protection and Affordable Care Act (2010)']"
Dashing Good Looks With a Menu to Match,2014-08-09,article,Review,,['Restaurants']
De Blasio to Gather Clergy on Police-Community Divide,2014-08-09,article,News,,"['Police Brutality, Misconduct and Shootings', 'Police', 'Clergy']"
Turkey Votes for a President,2014-08-09,multimedia,Slideshow,,['Elections']
"Frustrated and Clutching His Back, Woods Misses the Cut",2014-08-09,article,News,,"['PGA Championship', 'Golf']"
"Turkey’s Premier Tries to Keep Power, as President",2014-08-09,article,News,,"['Elections', 'International Relations', 'Politics and Government']"
New Jersey Republican Killed in Apparent Murder-Suicide,2014-08-09,article,News,,"['Murders and Attempted Murders', 'Suicides and Suicide Attempts']"
Out-of-State Clinic Is Central in Texas Abortion Law Fight,2014-08-09,article,News,,"['ABORTION', 'States (US)', 'Suits and Litigation (Civil)']"
A Water-Propelled Jetpack,2014-08-09,multimedia,Video,,['Jetpacks']
New York Settles Lawsuit Over Man Killed by Police Car,2014-08-09,article,News,,"['Police Brutality, Misconduct and Shootings', 'Traffic Accidents and Safety', 'Police']"
"Thrill Ride Flies in the Face of Gravity, as Well as Cautious Officials",2014-08-09,article,News,,"['Jetpacks', 'Accidents and Safety', 'Noise', 'Boats and Boating', 'Regulation and Deregulation of Industry', 'AMUSEMENT AND THEME PARKS', 'Gravitation and Gravity']"
Keep Planes a Quiet Space,2014-08-09,article,Editorial,,"['AIRLINES AND AIRPLANES', 'Cellular Telephones', 'Editorials', 'Wireless Communications', 'Noise']"
Spot on U.S. Ryder Cup Team Is Possibility for Stricker,2014-08-09,article,News,,"['PGA Championship', 'Golf', 'Ryder Cup (Golf)']"
A Misguided Tobacco Proposal,2014-08-09,article,Editorial,,"['Smoking and Tobacco', 'Editorials', 'E-Cigarettes', 'Regulation and Deregulation of Industry']"
"Keeping Track: Another Labor Suit for Apple, Stop-and-Frisk",2014-08-09,article,Editorial,,"['Editorials', 'Search and Seizure', 'Workplace Environment', 'Computers and the Internet', 'Hiring and Promotion', 'Antitrust Laws and Competition Issues', 'Suits and Litigation (Civil)']"
Judge Backs New Limits on North Carolina Voting,2014-08-09,article,News,,"['Voter Registration and Requirements', 'Identification Devices', 'Blacks', 'Black People', 'Elections']"
In Pursuit of the Perfect Pie,2014-08-09,article,News,,['Pies']
"Arrest in New Jersey Boy’s Death Stirs Memories, but Mysteries Remain",2014-08-09,article,News,,"['Murders and Attempted Murders', 'Missing Persons']"
Florida Redraws an Election Map That Was Ruled to Be Unconstitutional,2014-08-09,article,News,,"['Redistricting and Reapportionment', 'State Legislatures', 'Suits and Litigation (Civil)', 'Elections']"
"To Curb Drug Use, an Electronic Music Concert in Brooklyn Restricts What Guests Can Bring",2014-08-09,article,News,,"['Music', 'Drug Abuse and Traffic', 'Ecstasy (Drug)']"
Swinging Joints,2014-08-09,article,News,,['Crossword Puzzles']
Obama on the World,2014-08-09,article,Op-Ed,,"['United States International Relations', 'Palestinians', 'Kurds', 'United States Defense and Military Forces', 'Embargoes and Sanctions', 'Sunni Muslims', 'International Relations', 'Shiite Muslims', 'War Crimes, Genocide and Crimes Against Humanity']"
"Winning Lottery Numbers for Aug. 8, 2014",2014-08-09,article,List,,['Lotteries']
Obama on Israel,2014-08-09,multimedia,Video,,['United States Politics and Government']
Obama on America’s Place in the World,2014-08-09,multimedia,Video,,['United States Politics and Government']
Differences Between Israel and U.N. Over Gaza Episodes Go Back Years,2014-08-09,article,News,,"['Palestinians', 'Defense and Military Forces', 'International Relations']"
This Is Reform?,2014-08-09,article,Op-Ed,,"['College Athletics', 'Decisions and Verdicts']"
A Front Line Against Ebola Runs Through Newark’s Terminal B,2014-08-09,article,News,,"['Ebola Virus', 'AIRPORTS']"
When a Car Loan Means Bankruptcy,2014-08-09,article,Editorial,,"['Automobiles', 'Editorials', 'Consumer Protection', 'Credit and Debt', 'Automobile Financing', 'Banking and Financial Institutions', 'Regulation and Deregulation of Industry']"
A Spot for Local Tastes and Good Cheer,2014-08-09,article,Review,,['Restaurants']
Bankruptcy Judge Gets View of Detroit Outside Courtroom,2014-08-09,article,News,,['Bankruptcies']
"While Offering Support, Obama Warns That U.S. Won’t Be ‘Iraqi Air Force’",2014-08-09,article,News,,"['United States Defense and Military Forces', 'United States International Relations', 'United States Politics and Government']"
O’Bannon Case Decision,2014-08-09,multimedia,Interactive Feature,,['College Athletics']
Fear of ‘Another Benghazi’ Drove White House to Airstrikes in Iraq,2014-08-09,article,News,,"['Benghazi Attack (2012)', 'United States Defense and Military Forces', 'United States International Relations', 'Diplomatic Service, Embassies and Consulates']"
Rudderless Craft to Get Glimpse of Home Before Sinking Into Space’s Depths ,2014-08-09,article,News,,"['Space and Astronomy', 'Moon', 'Science and Technology']"
A World Desperate for a Little Good News,2014-08-09,article,Op-Ed,,"['Palestinians', 'Ebola Virus', 'Epidemics']"
Love Reaches the Technologically Challenged,2014-08-09,article,Review,,['Theater']
What the O’Bannon Ruling Means for Colleges and Players,2014-08-09,article,Question,,"['College Athletics', 'Antitrust Laws and Competition Issues', 'Suits and Litigation (Civil)']"
China Looks to High-Speed Rail to Expand Reach,2014-08-09,article,News,,"['High-Speed Rail Projects', 'Transportation', 'Railroads', 'International Relations']"
"Idris Muhammad, Drummer Whose Beat Still Echoes, Dies at 74",2014-08-09,article,Obituary (Obit),,"['Deaths (Obituaries)', 'Music', 'Rap and Hip-Hop', 'Jazz']"
"Fiddling and Matchmaking, 50 Years Later",2014-08-09,article,Review,,['Theater']
"‘The Knick’ Recap: Blood, Scalpels and a Good Dose of Racism for 1900 New York",2014-08-09,article,News,,['Television']
Lessons From Libya,2014-08-09,multimedia,Video,,['United States Politics and Government']
"Before Victory, Mets Look to Future With Decision on Shortstop",2014-08-09,article,News,,['Baseball']
"Flugelhorns and Fame, by Way of Serbia",2014-08-09,article,News,,"['Music', 'Movies', 'Documentary Films and Programs']"
Phelps Shakes Off Rust in His Favorite Event,2014-08-09,article,News,,['Swimming']
Iraqis’ Squandered Opportunities,2014-08-09,multimedia,Video,,['United States Politics and Government']
"Chapman Pincher, Fleet St. Scoop Specialist, Dies at 100",2014-08-09,article,Obituary (Obit),,"['Deaths (Obituaries)', 'News and News Media', 'World War II (1939-45)', 'Nuclear Tests']"
A Soundtrack for His Ears Only,2014-08-09,article,Review,,['Theater']
China as a Free Rider,2014-08-09,multimedia,Video,,['United States Politics and Government']
Yankees Continue to Use Stadium to Their Advantage,2014-08-09,article,News,,['Baseball']
